feed,title,long_url,short_url
LinuxSecurity,Oracle8: ELSA-2024-5402: thunderbird Important Security Advisory Updates,https://linuxsecurity.com/advisories/oracle/oracle8-elsa-2024-5402-thunderbird-important-security-advisory-updates-0plpjtlm8a9y,https://da.gd/kzE2jq
LinuxSecurity,Oracle8: ELSA-2024-5391: firefox security Important Security Advisory Updates,https://linuxsecurity.com/advisories/oracle/oracle8-elsa-2024-5391-firefox-security-important-security-advisory-updates-4zes3xtdcaxt,https://da.gd/S50S1
LinuxSecurity,Oracle8: ELSA-2024-5390: bind9.16 security Important Security Advisory Updates,https://linuxsecurity.com/advisories/oracle/oracle8-elsa-2024-5390-bind9-16-security-important-security-advisory-updates-rraxlgwtspef,https://da.gd/ewnc9D
LinuxSecurity,Oracle8: ELSA-2024-5337: .NET 8.0 security Moderate Security Advisory Updates,https://linuxsecurity.com/advisories/oracle/oracle8-elsa-2024-5337-net-8-0-security-moderate-security-advisory-updates-9gdm4qiuheg1,https://da.gd/UcjhU
LinuxSecurity,Oracle8: ELSA-2024-5193: httpd:2.4 Important Security Advisory Updates,https://linuxsecurity.com/advisories/oracle/oracle8-elsa-2024-5193-httpd-2-4-important-security-advisory-updates-w8tczztlria0,https://da.gd/Lhvq
LinuxSecurity,Oracle9: ELSA-2024-5392: thunderbird Important Security Advisory Updates,https://linuxsecurity.com/advisories/oracle/oracle9-elsa-2024-5392-thunderbird-important-security-advisory-updates-xiwkva4tcios,https://da.gd/CmoH1
