feed,title,long_url,short_url
LinuxSecurity,Gentoo: GLSA-202506-12 critical: JSON-LibJSON code execution,https://linuxsecurity.com/advisories/gentoo/gentoo-glsa-202506-11-yaml-libyaml-shell-injection-iuu2654ahfka,https://da.gd/EdIggF
LinuxSecurity,Gentoo: GLSA-202506-10 normal: File-Find-Rule Shell Injection Advisory,https://linuxsecurity.com/advisories/gentoo/gentoo-glsa-202506-10-file-find-rule-shell-injection-uql6b89pmxl2,https://da.gd/UjxUrI
LinuxSecurity,Gentoo: GLSA-202506-09 normal: OpenImageIO multiple issues,https://linuxsecurity.com/advisories/gentoo/gentoo-glsa-202506-09-openimageio-negb8louh95t,https://da.gd/YxMbl
LinuxSecurity,"Gentoo: GLSA-202506-08 critical: Ruby, JRuby security vulnerability",https://linuxsecurity.com/advisories/gentoo/gentoo-glsa-202506-07-python-pypy-62b0kojnwuok,https://da.gd/3tdlZZ
LinuxSecurity,SUSE Linux Kernel Security Update: 2025:01918-1 Important Patch,https://linuxsecurity.com/advisories/suse/suse-2025-01918-1-important-the-linux-kernel-teupvqf85wtc,https://da.gd/Mx7SiZ
LinuxSecurity,SUSE Linux 15 SP6 advisory: 2025:01919-1 important kernel updates,https://linuxsecurity.com/advisories/suse/suse-2025-01919-1-important-the-linux-kernel-zayqklk2q2lu,https://da.gd/Bmloj
