feed,title,long_url,short_url
LinuxSecurity,Oracle8: ELSA-2022-7129: git-lfs security and bug fix Moderate Security Update,https://www.linuxsecurity.com/advisories/oracle/oracle8-elsa-2022-7129-git-lfs-security-and-bug-fix-moderate-security-update-09-51-05?rss,https://bit.ly/3suPjsW
LinuxSecurity,Oracle8: ELSA-2022-7192: device-mapper-multipath Important Security Update,https://www.linuxsecurity.com/advisories/oracle/oracle8-elsa-2022-7192-device-mapper-multipath-important-security-update-09-51-05?rss,https://bit.ly/3FAzQQ3
LinuxSecurity,Oracle8: ELSA-2022-7111: samba security and bug fix Moderate Security Update,https://www.linuxsecurity.com/advisories/oracle/oracle8-elsa-2022-7111-samba-security-and-bug-fix-moderate-security-update-09-51-05?rss,https://bit.ly/3D7pYKF
LinuxSecurity,Oracle8: ELSA-2022-7108: sqlite security Moderate Security Update,https://www.linuxsecurity.com/advisories/oracle/oracle8-elsa-2022-7108-sqlite-security-moderate-security-update-09-51-04?rss,https://bit.ly/3ziRTpF
LinuxSecurity,"Oracle8: ELSA-2022-7110: kernel security, bug fix, and enhancement Important Security Upda",https://www.linuxsecurity.com/advisories/oracle/oracle8-elsa-2022-7110-kernel-security-bug-fix-and-enhancement-important-security-upda-09-51-04?rss,https://bit.ly/3zhAe1J
LinuxSecurity,Oracle8: ELSA-2022-7070: firefox security Important Security Update,https://www.linuxsecurity.com/advisories/oracle/oracle8-elsa-2022-7070-firefox-security-important-security-update-09-51-03?rss,https://bit.ly/3suPkx0
