feed,title,long_url,short_url
PacketstormSecurity,GitHub Says Hackers Cloned Code-Signing Certificates In Breached Repository,https://packetstormsecurity.com/news/view/34266/GitHub-Says-Hackers-Cloned-Code-Signing-Certificates-In-Breached-Repository.html,https://da.gd/BkV2n
PacketstormSecurity,U.S. Stops Granting Export Licenses For China's Huawei,https://packetstormsecurity.com/news/view/34267/U.S.-Stops-Granting-Export-Licenses-For-Chinas-Huawei.html,https://da.gd/BtLBj
PacketstormSecurity,Chromebook SH1MMER Exploit Promises Admin Jailbreak,https://packetstormsecurity.com/news/view/34269/Chromebook-SH1MMER-Exploit-Promises-Admin-Jailbreak.html,https://da.gd/7AolgN
PacketstormSecurity,KeePass Disputes Report Of Flaw That Could Exfiltrate A Database,https://packetstormsecurity.com/news/view/34268/KeePass-Disputes-Report-Of-Flaw-That-Could-Exfiltrate-A-Database.html,https://da.gd/wRTR3
PacketstormSecurity,South Korea Makes Crypto Crackdown A National Justice Priority,https://packetstormsecurity.com/news/view/34271/South-Korea-Makes-Crypto-Crackdown-A-National-Justice-Priority.html,https://da.gd/zwI8JC
PacketstormSecurity,Bill Targets Suicide Hotline Vulnerabilities After Cyberattack On Intrado,https://packetstormsecurity.com/news/view/34270/Bill-Targets-Suicide-Hotline-Vulnerabilities-After-Cyberattack-On-Intrado.html,https://da.gd/oQoF
