feed,title,long_url,short_url
ArXiv:cs.CR,Evaluating Generalization Mechanisms in Autonomous Cyber Attack Agents,https://arxiv.org/abs/2603.10041,
ArXiv:cs.CR,Targeted Bit-Flip Attacks on LLM-Based Agents,https://arxiv.org/abs/2603.10042,
ArXiv:cs.CR,OAuthHub: Mitigating OAuth Data Overaccess through a Local Data Hub,https://arxiv.org/abs/2603.10056,
ArXiv:cs.CR,"SBOMs into Agentic AIBOMs: Schema Extensions, Agentic Orchestration, and Reproducibility Evaluation",https://arxiv.org/abs/2603.10057,
ArXiv:cs.CR,"Tool Receipts, Not Zero-Knowledge Proofs: Practical Hallucination Detection for AI Agents",https://arxiv.org/abs/2603.10060,
ArXiv:cs.CR,Building Privacy-and-Security-Focused Federated Learning Infrastructure for Global Multi-Centre Healthcare Research,https://arxiv.org/abs/2603.10063,
ArXiv:cs.CR,ADVERSA: Measuring Multi-Turn Guardrail Degradation and Judge Reliability in Large Language Models,https://arxiv.org/abs/2603.10068,
ArXiv:cs.CR,Why LLMs Fail: A Failure Analysis and Partial Success Measurement for Automated Security Patch Generation,https://arxiv.org/abs/2603.10072,
ArXiv:cs.CR,TASER: Task-Aware Spectral Energy Refine for Backdoor Suppression in UAV Swarms Decentralized Federated Learning,https://arxiv.org/abs/2603.10075,
ArXiv:cs.CR,Amnesia: Adversarial Semantic Layer Specific Activation Steering in Large Language Models,https://arxiv.org/abs/2603.10080,
ArXiv:cs.CR,Multi-Stream Perturbation Attack: Breaking Safety Alignment of Thinking LLMs Through Concurrent Task Interference,https://arxiv.org/abs/2603.10091,
ArXiv:cs.CR,Execution Is the New Attack Surface: Survivability-Aware Agentic Crypto Trading with OpenClaw-Style Local Executors,https://arxiv.org/abs/2603.10092,
ArXiv:cs.CR,Detecting Privilege Escalation with Temporal Braid Groups,https://arxiv.org/abs/2603.10094,
ArXiv:cs.CR,Compatibility at a Cost: Systematic Discovery and Exploitation of MCP Clause-Compliance Vulnerabilities,https://arxiv.org/abs/2603.10163,
ArXiv:cs.CR,MCP-in-SoS: Risk assessment framework for open-source MCP servers,https://arxiv.org/abs/2603.10194,
ArXiv:cs.CR,Multilingual AI-Driven Password Strength Estimation with Similarity-Based Detection,https://arxiv.org/abs/2603.10217,
ArXiv:cs.CR,Paladin: A Policy Framework for Securing Cloud APIs by Combining Application Context with Generative AI,https://arxiv.org/abs/2603.10228,
ArXiv:cs.CR,ACE Runtime - A ZKP-Native Blockchain Runtime with Sub-Second Cryptographic Finality,https://arxiv.org/abs/2603.10242,
ArXiv:cs.CR,Post-Quantum Entropy as a Service for Embedded Systems,https://arxiv.org/abs/2603.10274,
ArXiv:cs.CR,PRoADS: Provably Secure and Robust Audio Diffusion Steganography with latent optimization and backward Euler Inversion,https://arxiv.org/abs/2603.10314,
ArXiv:cs.CR,The Orthogonal Vulnerabilities of Generative AI Watermarks: A Comparative Empirical Benchmark of Spatial and Latent Provenance,https://arxiv.org/abs/2603.10323,
ArXiv:cs.CR,Don't Let the Claw Grip Your Hand: A Security Analysis and Defense Framework for OpenClaw,https://arxiv.org/abs/2603.10387,
ArXiv:cs.CR,Silent Subversion: Sensor Spoofing Attacks via Supply Chain Implants in Satellite Systems,https://arxiv.org/abs/2603.10388,
ArXiv:cs.CR,Enhancing Network Intrusion Detection Systems: A Multi-Layer Ensemble Approach to Mitigate Adversarial Attacks,https://arxiv.org/abs/2603.10413,
ArXiv:cs.CR,"Na\""ive Exposure of Generative AI Capabilities Undermines Deepfake Detection",https://arxiv.org/abs/2603.10504,
ArXiv:cs.CR,An Approach for Safe and Secure Software Protection Supported by Symbolic Execution,https://arxiv.org/abs/2603.10608,
ArXiv:cs.CR,Detecting and Eliminating Neural Network Backdoors Through Active Paths with Application to Intrusion Detection,https://arxiv.org/abs/2603.10641,
ArXiv:cs.CR,Repurposing Backdoors for Good: Ephemeral Intrinsic Proofs for Verifiable Aggregation in Cross-silo Federated Learning,https://arxiv.org/abs/2603.10692,
ArXiv:cs.CR,CacheSolidarity: Preventing Prefix Caching Side Channels in Multi-tenant LLM Serving Systems,https://arxiv.org/abs/2603.10726,
ArXiv:cs.CR,AttriGuard: Defeating Indirect Prompt Injection in LLM Agents via Causal Attribution of Tool Invocations,https://arxiv.org/abs/2603.10749,
ArXiv:cs.CR,A PUF-Based Approach for Copy Protection of Intellectual Property in Neural Network Models,https://arxiv.org/abs/2603.10753,
ArXiv:cs.CR,Incremental Federated Learning for Intrusion Detection in IoT Networks under Evolving Threat Landscape,https://arxiv.org/abs/2603.10776,
ArXiv:cs.CR,Re-Evaluating EVMBench: Are AI Agents Ready for Smart Contract Security?,https://arxiv.org/abs/2603.10795,
ArXiv:cs.CR,MAD: Memory Allocation meets Software Diversity,https://arxiv.org/abs/2603.10840,
ArXiv:cs.CR,"Layered Performance Analysis of TLS 1.3 Handshakes: Classical, Hybrid, and Pure Post-Quantum Key Exchange",https://arxiv.org/abs/2603.11006,
ArXiv:cs.CR,Separating Oblivious and Adaptive Differential Privacy under Continual Observation,https://arxiv.org/abs/2603.11029,
ArXiv:cs.CR,There Are No Silly Questions: Evaluation of Offline LLM Capabilities from a Turkish Perspective,https://arxiv.org/abs/2603.09996,
ArXiv:cs.CR,Where Do Flow Semantics Reside? A Protocol-Native Tabular Pretraining Paradigm for Encrypted Traffic Classification,https://arxiv.org/abs/2603.10051,
ArXiv:cs.CR,Denoising the US Census: Succinct Block Hierarchical Regression,https://arxiv.org/abs/2603.10099,
ArXiv:cs.CR,IH-Challenge: A Training Dataset to Improve Instruction Hierarchy on Frontier LLMs,https://arxiv.org/abs/2603.10521,
ArXiv:cs.CR,Backdoor Directions in Vision Transformers,https://arxiv.org/abs/2603.10806,
ArXiv:cs.CR,TOSSS: a CVE-based Software Security Benchmark for Large Language Models,https://arxiv.org/abs/2603.10969,
