feed,title,long_url,short_url
ArXiv:cs.CR,SoK: Decoding the Enigma of Encrypted Network Traffic Classifiers,https://arxiv.org/abs/2503.20093,
ArXiv:cs.CR,Software Vulnerability Analysis Across Programming Language and Program Representation Landscapes: A Survey,https://arxiv.org/abs/2503.20244,
ArXiv:cs.CR,How Secure is Forgetting? Linking Machine Unlearning to Machine Learning Attacks,https://arxiv.org/abs/2503.20257,
ArXiv:cs.CR,Are We There Yet? Unraveling the State-of-the-Art Graph Network Intrusion Detection Systems,https://arxiv.org/abs/2503.20281,
ArXiv:cs.CR,UnReference: analysis of the effect of spoofing on RTK reference stations for connected rovers,https://arxiv.org/abs/2503.20364,
ArXiv:cs.CR,ARGO-SLSA: Software Supply Chain Security in Argo Workflows,https://arxiv.org/abs/2503.20079,
ArXiv:cs.CR,A Blockchain-based Quantum Binary Voting for Decentralized IoT Towards Industry 5.0,https://arxiv.org/abs/2503.20247,
ArXiv:cs.CR,sudo rm -rf agentic_security,https://arxiv.org/abs/2503.20279,
ArXiv:cs.CR,Enabling Heterogeneous Adversarial Transferability via Feature Permutation Attacks,https://arxiv.org/abs/2503.20310,
ArXiv:cs.CR,"Power Networks SCADA Communication Cybersecurity, A Qiskit Implementation",https://arxiv.org/abs/2503.20365,
ArXiv:cs.CR,Certified randomness using a trapped-ion quantum processor,https://arxiv.org/abs/2503.20498,
ArXiv:cs.CR,Defending against Backdoor Attack on Deep Neural Networks,https://arxiv.org/abs/2002.12162,
ArXiv:cs.CR,UPPRESSO: Untraceable and Unlinkable Privacy-PREserving Single Sign-On Services,https://arxiv.org/abs/2110.10396,
ArXiv:cs.CR,SE#PCFG: Semantically Enhanced PCFG for Password Analysis and Cracking,https://arxiv.org/abs/2306.06824,
ArXiv:cs.CR,Hiding Functions within Functions: Steganography by Implicit Neural Representations,https://arxiv.org/abs/2312.04743,
ArXiv:cs.CR,Mixture of Robust Experts (MoRE):A Robust Denoising Method towards multiple perturbations,https://arxiv.org/abs/2104.10586,
ArXiv:cs.CR,Personalized Federated Learning of Probabilistic Models: A PAC-Bayesian Approach,https://arxiv.org/abs/2401.08351,
