feed,title,long_url,short_url
PacketstormSecurity,Google To Destroy Browsing Data To Settle Consumer Privacy Lawsuit,https://packetstormsecurity.com/news/view/35732/Google-To-Destroy-Browsing-Data-To-Settle-Consumer-Privacy-Lawsuit.html,https://da.gd/gahpEo
PacketstormSecurity,Prudential Financials Exposed Data Of Nearly 37k Customers,https://packetstormsecurity.com/news/view/35727/Prudential-Financials-Exposed-Data-Of-Nearly-37k-Customers.html,https://da.gd/bnrfe
PacketstormSecurity,Hotel Self Check-In Kiosks Exposed Room Access Codes,https://packetstormsecurity.com/news/view/35731/Hotel-Self-Check-In-Kiosks-Exposed-Room-Access-Codes.html,https://da.gd/Elur
PacketstormSecurity,Pandabuy Admits To Data Breach Of 1.3 Million Unique Records,https://packetstormsecurity.com/news/view/35730/Pandabuy-Admits-To-Data-Breach-Of-1.3-Million-Unique-Records.html,https://da.gd/FNv6FH
PacketstormSecurity,"Heartbleed Is 10 Years Old - Farewell Heartbleed, Hello QuantumBleed!",https://packetstormsecurity.com/news/view/35735/Heartbleed-Is-10-Years-Old-Farewell-Heartbleed-Hello-QuantumBleed.html,https://da.gd/EqdH
PacketstormSecurity,Security Flaw In WP-Members Plugin Leads To Script Injection,https://packetstormsecurity.com/news/view/35734/Security-Flaw-In-WP-Members-Plugin-Leads-To-Script-Injection.html,https://da.gd/DJODE
PacketstormSecurity,Microsoft Warns Deepfake Election Subversion Is Disturbingly Easy,https://packetstormsecurity.com/news/view/35733/Microsoft-Warns-Deepfake-Election-Subversion-Is-Disturbingly-Easy.html,https://da.gd/q4oCAp
PacketstormSecurity,OWASP Data Breach Caused By Server Misconfiguration,https://packetstormsecurity.com/news/view/35729/OWASP-Data-Breach-Caused-By-Server-Misconfiguration.html,https://da.gd/rQihv
PacketstormSecurity,Polish Officials May Face Criminal Charges In Pegasus Spyware Probe,https://packetstormsecurity.com/news/view/35728/Polish-Officials-May-Face-Criminal-Charges-In-Pegasus-Spyware-Probe.html,https://da.gd/8oudG
