feed,title,long_url,short_url
LinuxSecurity,openSUSE: Chromium Important Insufficient Policy Enforcement CVE-2026-0628,https://linuxsecurity.com/advisories/opensuse/chromium-noopenh264-opensuse-2026-0006-1-2026-0628,https://da.gd/PlQqU
LinuxSecurity,SUSE: libjpeg62 Critical Buffer Overflow Vulnerability 2026:0120-1,https://linuxsecurity.com/advisories/suse/libpng16-suse-2026-0085-1-2025-66293,https://da.gd/Uzmg5p
LinuxSecurity,SUSE Advisory 2026:0086-1 for Moderate Heap Overflow in php8 CVE-2025-14177,https://linuxsecurity.com/advisories/suse/php8-suse-2026-0086-1-2025-14177,https://da.gd/wnDhU
LinuxSecurity,SUSE: libheif Moderate Heap Buffer Over-Read Fix CVE-2025-68431,https://linuxsecurity.com/advisories/suse/libheif-suse-2026-0087-1-2025-68431,https://da.gd/bDqX0
LinuxSecurity,SUSE: Kernel Important Security Update 2026:20015-1 CVE-2025-40131,https://linuxsecurity.com/advisories/suse/kernel-suse-2026-20015-1-2022-50253,https://da.gd/MWNjh
LinuxSecurity,SUSE Linux 16.0 fontforge Low Risk Memory Leak Fix 2026:20016-1,https://linuxsecurity.com/advisories/suse/fontforge-suse-2026-20016-1-2025-50949,https://da.gd/0uKMz
