feed,title,long_url,short_url
LinuxSecurity,Ubuntu 25.10: Django Important SQL Exec DoS Vulnerabilities 2025:7903-1,https://linuxsecurity.com/advisories/ubuntu/ubuntu-7903-1-django-bohetkxi1wms,https://da.gd/7uh4k
LinuxSecurity,openSUSE: python39 Moderate Fix for Vulnerabilities 2025:15792-1,https://linuxsecurity.com/advisories/opensuse/opensuse-2025-15792-1-python39-3-9-24-2-1-x1asuqlyuuhn,https://da.gd/RlsF0
LinuxSecurity,openSUSE Tumbleweed: python315 Moderate CVE-2025-6075 Advisory 2025:15791-1,https://linuxsecurity.com/advisories/opensuse/opensuse-2025-15791-1-python315-3-15-0~a1-2-1-ihwus00prwo2,https://da.gd/yxkrwi
LinuxSecurity,openSUSE Tumbleweed: python-mistralclient-doc Moderate Fix CVE-2021-4472,https://linuxsecurity.com/advisories/opensuse/opensuse-2025-15790-1-python-mistralclient-doc-6-1-0-1-1-p452bedxv17h,https://da.gd/tMHLiB
LinuxSecurity,openSUSE Tumbleweed: lightdm-kde-greeter Moderate CVE-2025-62876 Update,https://linuxsecurity.com/advisories/opensuse/opensuse-2025-15788-1-lightdm-kde-greeter-6-0-5-1-1-jrmhyj8pwrsg,https://da.gd/bvtq
LinuxSecurity,openSUSE: libecpg6 Moderate Security Issues Advisory 2025:15789-1,https://linuxsecurity.com/advisories/opensuse/opensuse-2025-15789-1-libecpg6-18-1-1-1-nqjt1kygmgat,https://da.gd/FIrwS
