feed,title,long_url,short_url
PacketstormSecurity,"EU Governments, Lawmakers Agree On Tougher Cybersecurity Rules For Key Sectors",https://packetstormsecurity.com/news/view/33445/EU-Governments-Lawmakers-Agree-On-Tougher-Cybersecurity-Rules-For-Key-Sectors.html,https://bit.ly/3NgHuzB
PacketstormSecurity,Threat Actors Use Telegram To Spread Eternity Malware-As-A-Service,https://packetstormsecurity.com/news/view/33444/Threat-Actors-Use-Telegram-To-Spread-Eternity-Malware-As-A-Service.html,https://bit.ly/3Lg7hpY
PacketstormSecurity,Konica Minolta bizhub MFP Printer Terminal Sandbox Escape,https://packetstormsecurity.com/files/167166/SA-20220512-0.tgz,https://bit.ly/3wpSSSW
PacketstormSecurity,Red Hat Security Advisory 2022-2236-01,https://packetstormsecurity.com/files/167165/RHSA-2022-2236-01.txt,https://bit.ly/3suX1Uk
PacketstormSecurity,Red Hat Security Advisory 2022-1699-01,https://packetstormsecurity.com/files/167164/RHSA-2022-1699-01.txt,https://bit.ly/3l9SmmB
PacketstormSecurity,COOPER: Testing The Binding Code Of Scripting Languages With Cooperative Mutation,https://packetstormsecurity.com/files/167160/xucooper.pdf,https://bit.ly/3wcmCUl
PacketstormSecurity,COOPER Analysis Tool,https://packetstormsecurity.com/files/167161/Cooper-master.zip,https://bit.ly/37Ln1no
