feed,title,long_url,short_url
LinuxSecurity,openSUSE: libetebase Moderate Use-After-Free CVE-2025-3416 Fix 2025:0221-1,https://linuxsecurity.com/advisories/opensuse/opensuse-2025-0221-1-moderate-libetebase-eoyk1pprcgcx,https://da.gd/2m2p5
LinuxSecurity,openSUSE Leap 15.6: Opera Important Security Update CVE-2025-6558,https://linuxsecurity.com/advisories/opensuse/opensuse-2025-0271-1-important-opera-5eri4n7vdbij,https://da.gd/wSWB3
LinuxSecurity,openSUSE: MozillaThunderbird Moderate Update 2025:15383-1 CVE-2025-6435,https://linuxsecurity.com/advisories/opensuse/opensuse-2025-15383-1-moderate-mozillathunderbird-140-1-0-1-1-kpwcrb2d0ybc,https://da.gd/NL23Qp
LinuxSecurity,openSUSE: Python311-Starlette Moderate CVE-2025-54121 Advisory 2025:15381-1,https://linuxsecurity.com/advisories/opensuse/opensuse-2025-15381-1-moderate-python311-starlette-0-47-2-1-1-ugyfa0n4znam,https://da.gd/rVLsax
LinuxSecurity,openSUSE Tumbleweed: perl-Authen-SASL Moderate Threat CVE-2025-40918,https://linuxsecurity.com/advisories/opensuse/opensuse-2025-15385-1-moderate-perl-authen-sasl-2-180-0-2-1-qwm7iipitjse,https://da.gd/Tblwd
LinuxSecurity,openSUSE: Apache Moderate CVE-2025-54090 Threat Advisory 2025:15384-1,https://linuxsecurity.com/advisories/opensuse/opensuse-2025-15384-1-moderate-apache2-2-4-65-1-1-fiq9kl7ae5ew,https://da.gd/Pc0Ay
