feed,title,long_url,short_url
PacketstormSecurity,Red Hat Security Advisory 2022-2272-01,https://packetstormsecurity.com/files/167271/RHSA-2022-2272-01.txt,https://bit.ly/3NHBYWV
PacketstormSecurity,Tigase XMPP Server Stanza Smuggling,https://packetstormsecurity.com/files/167270/GS20220526163003.txt,https://bit.ly/3t00XfZ
PacketstormSecurity,ChromeOS usbguard Bypass,https://packetstormsecurity.com/files/167269/GS20220526162753.txt,https://bit.ly/3z567LA
PacketstormSecurity,Exploit Persistent XSS And Unsanitized Injection Vectors For Layer 2 Bypass And COOLHANDLUKE Protocol Creation,https://packetstormsecurity.com/files/167268/Layer7MattersAtLayer2-PoCForRelease.pdf,https://bit.ly/3LU1Zki
PacketstormSecurity,Exploiting Persistent XSS And Unsanitized Injection Vectors For DIRECTIVEFOUR Protocol Creation / IP Router-Less Tunneling,https://packetstormsecurity.com/files/167267/L7-CiscoS.pdf,https://bit.ly/3sZL8Gi
PacketstormSecurity,Red Hat Security Advisory 2022-2268-01,https://packetstormsecurity.com/files/167265/RHSA-2022-2268-01.txt,https://bit.ly/3wYYSUh
PacketstormSecurity,qdPM 9.1 Remote Code Execution,https://packetstormsecurity.com/files/167264/qdpm91v2-exec.txt,https://bit.ly/3ae70Hg
PacketstormSecurity,Red Hat Security Advisory 2022-4745-01,https://packetstormsecurity.com/files/167262/RHSA-2022-4745-01.txt,https://bit.ly/3lKDJq7
