feed,title,long_url,short_url
LinuxSecurity,Oracle7: ELSA-2022-9142: kernel Important Security Update,https://www.linuxsecurity.com/advisories/oracle/oracle7-elsa-2022-9142-kernel-important-security-update-10-24-14?rss,https://bit.ly/3LnZOX4
LinuxSecurity,Oracle7: ELSA-2022-9141: kernel Important Security Update,https://www.linuxsecurity.com/advisories/oracle/oracle7-elsa-2022-9141-kernel-important-security-update-10-24-13?rss,https://bit.ly/33cm1q6
LinuxSecurity,Oracle8: ELSA-2022-9141: kernel Important Security Update,https://www.linuxsecurity.com/advisories/oracle/oracle8-elsa-2022-9141-kernel-important-security-update-10-24-05?rss,https://bit.ly/3uDa3Ba
LinuxSecurity,Oracle8: ELSA-2022-9141: kernel Important Security Update,https://www.linuxsecurity.com/advisories/oracle/oracle8-elsa-2022-9141-kernel-important-security-update-10-23-54?rss,https://bit.ly/34rr728
LinuxSecurity,Oracle7: ELSA-2022-0473: aide Important Security Update,https://www.linuxsecurity.com/advisories/oracle/oracle7-elsa-2022-0473-aide-important-security-update-10-23-48?rss,https://bit.ly/3GIvjYl
LinuxSecurity,Oracle7: ELSA-2022-9123: qemu Important Security Update,https://www.linuxsecurity.com/advisories/oracle/oracle7-elsa-2022-9123-qemu-important-security-update-10-23-47?rss,https://bit.ly/3GDJeir
