feed,title,long_url,short_url
LinuxSecurity,openSUSE: Flannel Important Update for CVE-2019-14697 2025:0474-1,https://linuxsecurity.com/advisories/opensuse/flannel-opensuse-2025-0474-1-2019-14697,https://da.gd/6LEw7
LinuxSecurity,openSUSE Tumbleweed: netty Moderate CVE-2025-67735 Advisory 2025:15824-1,https://linuxsecurity.com/advisories/opensuse/netty-4-1-130-1-1-opensuse-2025-15824-1-2025-67735,https://da.gd/PsoTL
LinuxSecurity,openSUSE: Important CVE-2025-47908 Patch Advisory Now Available,https://linuxsecurity.com/advisories/opensuse/clair-4-9-0-1-2025-15823-2025-47907,https://da.gd/18Rr
LinuxSecurity,SUSE: Multi-Linux Manager Important 5.1.1.1 Security Fix CVE-2025-47911,https://linuxsecurity.com/advisories/suse/multi-linux-manager-5-1-1-1-2025-47911,https://da.gd/aozHP
LinuxSecurity,SUSE: Multi-Linux Manager Important Patch for Security Issues 2025:4445-1,https://linuxsecurity.com/advisories/suse/multi-linux-manager-salt-bundle-2025-62348,https://da.gd/Po3Ml
LinuxSecurity,SUSE: Multi-Linux Manager Client Tools Important Update CVE-2025-11065,https://linuxsecurity.com/advisories/suse/multi-linux-manager-5-1-1-1-2025-11065,https://da.gd/wQL2L7
