feed,title,long_url,short_url
ArXiv:cs.CR,Privacy Amplification for the Gaussian Mechanism via Bounded Support,https://arxiv.org/abs/2403.05598,
ArXiv:cs.CR,A Formal Analysis of SCTP: Attack Synthesis and Patch Verification,https://arxiv.org/abs/2403.05663,
ArXiv:cs.CR,DP-TabICL: In-Context Learning with Differentially Private Tabular Data,https://arxiv.org/abs/2403.05681,
ArXiv:cs.CR,Inception Attacks: Immersive Hijacking in Virtual Reality Systems,https://arxiv.org/abs/2403.05721,
ArXiv:cs.CR,Privacy-Preserving Diffusion Model Using Homomorphic Encryption,https://arxiv.org/abs/2403.05794,
ArXiv:cs.CR,Hufu: A Modality-Agnositc Watermarking System for Pre-Trained Transformers via Permutation Equivariance,https://arxiv.org/abs/2403.05842,
ArXiv:cs.CR,MirrorAttack: Backdoor Attack on 3D Point Cloud with a Distorting Mirror,https://arxiv.org/abs/2403.05847,
ArXiv:cs.CR,"Federated Learning: Attacks, Defenses, Opportunities, and Challenges",https://arxiv.org/abs/2403.06067,
ArXiv:cs.CR,SecureRights: A Blockchain-Powered Trusted DRM Framework for Robust Protection and Asserting Digital Rights,https://arxiv.org/abs/2403.06094,
ArXiv:cs.CR,FedPIT: Towards Privacy-preserving and Few-shot Federated Instruction Tuning,https://arxiv.org/abs/2403.06131,
ArXiv:cs.CR,Fluent: Round-efficient Secure Aggregation for Private Federated Learning,https://arxiv.org/abs/2403.06143,
ArXiv:cs.CR,ABC-Channel: An Advanced Blockchain-based Covert Channel,https://arxiv.org/abs/2403.06261,
ArXiv:cs.CR,Refinement of MMIO Models for Improving the Coverage of Firmware Fuzzing,https://arxiv.org/abs/2403.06281,
ArXiv:cs.CR,Practically adaptable CPABE based Health-Records sharing framework,https://arxiv.org/abs/2403.06347,
ArXiv:cs.CR,A Zero Trust Framework for Realization and Defense Against Generative AI Attacks in Power Grid,https://arxiv.org/abs/2403.06388,
ArXiv:cs.CR,Intra-Section Code Cave Injection for Adversarial Evasion Attacks on Windows PE Malware File,https://arxiv.org/abs/2403.06428,
ArXiv:cs.CR,Asset-driven Threat Modeling for AI-based Systems,https://arxiv.org/abs/2403.06512,
ArXiv:cs.CR,DNNShield: Embedding Identifiers for Deep Neural Network Ownership Verification,https://arxiv.org/abs/2403.06581,
ArXiv:cs.CR,Towards more accurate and useful data anonymity vulnerability measures,https://arxiv.org/abs/2403.06595,
ArXiv:cs.CR,Real is not True: Backdoor Attacks Against Deepfake Detection,https://arxiv.org/abs/2403.06610,
ArXiv:cs.CR,Self-Sovereign Identity for Electric Vehicle Charging,https://arxiv.org/abs/2403.06632,
ArXiv:cs.CR,Stealing Part of a Production Language Model,https://arxiv.org/abs/2403.06634,
ArXiv:cs.CR,Poisoning Programs by Un-Repairing Code: Security Concerns of AI-generated Code,https://arxiv.org/abs/2403.06675,
ArXiv:cs.CR,Unprotected 4G/5G Control Procedures at Low Layers Considered Dangerous,https://arxiv.org/abs/2403.06717,
ArXiv:cs.CR,Towards Incident Response Orchestration and Automation for the Advanced Metering Infrastructure,https://arxiv.org/abs/2403.06907,
ArXiv:cs.CR,"Enabling Developers, Protecting Users: Investigating Harassment and Safety in VR",https://arxiv.org/abs/2403.05499,
ArXiv:cs.CR,AMUSE: Adaptive Multi-Segment Encoding for Dataset Watermarking,https://arxiv.org/abs/2403.05628,
ArXiv:cs.CR,Internet Sanctions on Russian Media: Actions and Effects,https://arxiv.org/abs/2403.05638,
ArXiv:cs.CR,Measuring Robustness in Cyber-Physical Systems under Sensor Attacks,https://arxiv.org/abs/2403.05829,
ArXiv:cs.CR,PAPER-HILT: Personalized and Adaptive Privacy-Aware Early-Exit for Reinforcement Learning in Human-in-the-Loop Systems,https://arxiv.org/abs/2403.05864,
ArXiv:cs.CR,Cross-ecosystem categorization: A manual-curation protocol for the categorization of Java Maven libraries along Python PyPI Topics,https://arxiv.org/abs/2403.06300,
ArXiv:cs.CR,Fake or Compromised? Making Sense of Malicious Clients in Federated Learning,https://arxiv.org/abs/2403.06319,
ArXiv:cs.CR,Provable Mutual Benefits from Federated Learning in Privacy-Sensitive Domains,https://arxiv.org/abs/2403.06672,
ArXiv:cs.CR,ACFIX: Guiding LLMs with Mined Common RBAC Practices for Context-Aware Repair of Access Control Vulnerabilities in Smart Contracts,https://arxiv.org/abs/2403.06838,
ArXiv:cs.CR,SoK: Secure Human-centered Wireless Sensing,https://arxiv.org/abs/2211.12087,
ArXiv:cs.CR,RSBA: Robust Statistical Backdoor Attack under Privilege-Constrained Scenarios,https://arxiv.org/abs/2304.10985,
ArXiv:cs.CR,zkFi: Privacy-Preserving and Regulation Compliant Transactions using Zero Knowledge Proofs,https://arxiv.org/abs/2307.00521,
ArXiv:cs.CR,Breaking Speaker Recognition with PaddingBack,https://arxiv.org/abs/2308.04179,
ArXiv:cs.CR,A Scalable Formal Verification Methodology for Data-Oblivious Hardware,https://arxiv.org/abs/2308.07757,
ArXiv:cs.CR,That Doesn't Go There: Attacks on Shared State in Multi-User Augmented Reality Applications,https://arxiv.org/abs/2308.09146,
ArXiv:cs.CR,Tortoise: An Authenticated Encryption Scheme,https://arxiv.org/abs/2309.05769,
ArXiv:cs.CR,"From Chatbots to PhishBots? -- Preventing Phishing scams created using ChatGPT, Google Bard and Claude",https://arxiv.org/abs/2310.19181,
ArXiv:cs.CR,SeDe: Balancing Blockchain Privacy and Regulatory Compliance by Selective De-Anonymization,https://arxiv.org/abs/2311.08167,
ArXiv:cs.CR,SecureReg: A Combined Framework for Proactively Exposing Malicious Domain Name Registrations,https://arxiv.org/abs/2401.03196,
ArXiv:cs.CR,Phishing Website Detection through Multi-Model Analysis of HTML Content,https://arxiv.org/abs/2401.04820,
ArXiv:cs.CR,SeMA: Extending and Analyzing Storyboards to Develop Secure Android Apps,https://arxiv.org/abs/2001.10052,
ArXiv:cs.CR,Group-based Robustness: A General Framework for Customized Robustness in the Real World,https://arxiv.org/abs/2306.16614,
ArXiv:cs.CR,Defending Against Malicious Behaviors in Federated Learning with Blockchain,https://arxiv.org/abs/2307.00543,
ArXiv:cs.CR,Detecting Pretraining Data from Large Language Models,https://arxiv.org/abs/2310.16789,
ArXiv:cs.CR,"Robustness, Efficiency, or Privacy: Pick Two in Machine Learning",https://arxiv.org/abs/2312.14712,
ArXiv:cs.CR,Towards Scalable and Robust Model Versioning,https://arxiv.org/abs/2401.09574,
