feed,title,long_url,short_url
LinuxSecurity,SUSE: Kernel Important Security Update 2026:0170-1 CVE-2022-50116,https://linuxsecurity.com/advisories/suse/kernel-suse-2026-0170-1-2022-50116,https://da.gd/KtpKjq
LinuxSecurity,SUSE: Kernel Important Security Update 2026:0168-1 Fixes Multiple Issues,https://linuxsecurity.com/advisories/suse/kernel-suse-2026-0168-1-2022-50233,https://da.gd/kkbz2
LinuxSecurity,openSUSE: Kernel Important Security Update 2026:0168-1 CVE-2022-50233,https://linuxsecurity.com/advisories/opensuse/kernel-opensuse-2026-0168-1-2022-50233,https://da.gd/xRnWB
LinuxSecurity,SUSE: Kernel RT Important Security Update 2026:0169-1 CVE-2023-53676,https://linuxsecurity.com/advisories/suse/kernel-rt-suse-2026-0169-1-2023-53676,https://da.gd/0KWr
LinuxSecurity,SUSE: Kernel RT Important Patch for Live Patching 2026:0171-1,https://linuxsecurity.com/advisories/suse/kernel-rt-suse-2026-0171-1-2023-53676,https://da.gd/2FusJ
LinuxSecurity,SUSE: Kernel Important Security Update 2026:0173-1 CVE-2025-40204,https://linuxsecurity.com/advisories/suse/kernel-suse-2026-0173-1-2022-50327,https://da.gd/VvVxS0
