feed,title,long_url,short_url
gNews,Bitgert (BRISE) Shall Overtake Big Players' Price Growth 10X In 2022- 4 Reasons - Analytics Insight,https://www.analyticsinsight.net/bitgert-brise-shall-overtake-big-players-price-growth-10x-in-2022-4-reasons/,https://bit.ly/3t7e3b7
gNews,Top 10 Recession-Proof JavaScript Skills to Master for Success in 2023 - Analytics Insight,https://www.analyticsinsight.net/top-10-recession-proof-javascript-skills-to-master-for-success-in-2023/,https://bit.ly/3WFfbQD
gNews,Making Robots More Independent by Using Humans as Sensors - Analytics Insight,https://www.analyticsinsight.net/making-robots-more-independent-by-using-humans-as-sensors/,https://bit.ly/3UeWYIi
gNews,More Bitcoin and Ethereum Holders Eyeing These Coins' Pump This Month - Analytics Insight,https://www.analyticsinsight.net/more-bitcoin-and-ethereum-holders-eyeing-these-coins-pump-this-month/,https://bit.ly/3hhOt0r
gNews,Reality Labs is Taking Away the Majority of Meta Stocks (20%) - Analytics Insight,https://www.analyticsinsight.net/reality-labs-is-taking-away-the-majority-of-meta-stocks-20/,https://bit.ly/3t1Mdgv
