feed,title,long_url,short_url
PacketstormSecurity,Code Found Online Exploits LogoFAIL To Install Bootkitty Linux Backdoor,https://packetstormsecurity.com/news/view/36654/Code-Found-Online-Exploits-LogoFAIL-To-Install-Bootkitty-Linux-Backdoor.html,https://da.gd/s8Om
PacketstormSecurity,Russian Hacker With $10 Million Bounty On His Head Reportedly Arrested,https://packetstormsecurity.com/news/view/36650/Russian-Hacker-With-10-Million-Bounty-On-His-Head-Reportedly-Arrested.html,https://da.gd/Q9rq
PacketstormSecurity,Chinese Lidar Sensors Pose Hacking Risk To US Defense Equipment,https://packetstormsecurity.com/news/view/36651/Chinese-Lidar-Sensors-Pose-Hacking-Risk-To-US-Defense-Equipment.html,https://da.gd/I3jLj
PacketstormSecurity,Telco Security Is A Dumpster Fire And Everyone's Getting Burned,https://packetstormsecurity.com/news/view/36653/Telco-Security-Is-A-Dumpster-Fire-And-Everyones-Getting-Burned.html,https://da.gd/UE3HOH
PacketstormSecurity,Zabbix Urges Upgrades After Critical SQL Injection Bug Disclosure,https://packetstormsecurity.com/news/view/36655/Zabbix-Urges-Upgrades-After-Critical-SQL-Injection-Bug-Disclosure.html,https://da.gd/dwmYS
PacketstormSecurity,"Starbucks, Grocery Stores Hit By Blue Yonder Ransomware Attack",https://packetstormsecurity.com/news/view/36652/Starbucks-Grocery-Stores-Hit-By-Blue-Yonder-Ransomware-Attack.html,https://da.gd/kiQrZc
