feed,title,long_url,short_url
LinuxSecurity,openSUSE Tumbleweed: valkey Moderate Update 2025:15604-1 for Four Issues,https://linuxsecurity.com/advisories/opensuse/opensuse-2025-15604-1-valkey-8-1-4-1-1,https://da.gd/0utbs
LinuxSecurity,openSUSE Tumbleweed: matrix-synapse Moderate DoS CVE-2025-61672 Advisory,https://linuxsecurity.com/advisories/opensuse/opensuse-2025-15603-1-matrix-synapse-1-139-1-1-1,https://da.gd/bOQ8E
LinuxSecurity,Debian: Moderate SQL Injection and Directory Traversal in python-django,https://linuxsecurity.com/advisories/deblts/debian-lts-dla-4324-1-python-django-security-update-xef0iicm8vsr,https://da.gd/GuLwTT
LinuxSecurity,Ubuntu 24.04: FORT Validator Security Advisory USN-7813-1 DoS Risks,https://linuxsecurity.com/advisories/ubuntu/ubuntu-7813-1-fort-validator-egnp1mjwlxmj,https://da.gd/GZt0U6
LinuxSecurity,"SUSE: Kernel Important Security Update for CVE-2024-53168, 2025:03496-1",https://linuxsecurity.com/advisories/suse/suse-2025-03496-1-for-kernel-9iz8pxxvdt3b,https://da.gd/vivCaa
LinuxSecurity,SUSE: Kernel RT Important Security Update 2025:03494-1 CVE-2025-21791,https://linuxsecurity.com/advisories/suse/suse-2025-03494-1-for-kernel-rt-papyylgajdta,https://da.gd/Kl5tBe
