feed,title,long_url,short_url
UbuntuSecurityNotice,USN-6495-1: Linux kernel vulnerabilities,https://ubuntu.com/security/notices/USN-6495-1,https://da.gd/JI7g2X
UbuntuSecurityNotice,USN-6492-1: Mosquitto vulnerabilities,https://ubuntu.com/security/notices/USN-6492-1,https://da.gd/ytG5W
UbuntuSecurityNotice,USN-6497-1: Linux kernel (OEM) vulnerabilities,https://ubuntu.com/security/notices/USN-6497-1,https://da.gd/18e5Ls
UbuntuSecurityNotice,USN-6496-1: Linux kernel vulnerabilities,https://ubuntu.com/security/notices/USN-6496-1,https://da.gd/4Bhj
UbuntuSecurityNotice,USN-6494-1: Linux kernel vulnerabilities,https://ubuntu.com/security/notices/USN-6494-1,https://da.gd/106zk
