feed,title,long_url,short_url
PacketstormSecurity,"US Targets Election Influence Operation With Charges, Sanctions, Domain Seizures",https://packetstormsecurity.com/news/view/36301/US-Targets-Election-Influence-Operation-With-Charges-Sanctions-Domain-Seizures.html,https://da.gd/EYDIT
PacketstormSecurity,Colorado Tops List Of Cyberattacks Per Capita In The US,https://packetstormsecurity.com/news/view/36300/Colorado-Tops-List-Of-Cyberattacks-Per-Capita-In-The-US.html,https://da.gd/cWmw
PacketstormSecurity,Cisco Patches Critical Vulns In Smart Licensing Utility,https://packetstormsecurity.com/news/view/36302/Cisco-Patches-Critical-Vulns-In-Smart-Licensing-Utility.html,https://da.gd/Vfrt6
PacketstormSecurity,North Korean Hackers Target Job Seekers With Fake App,https://packetstormsecurity.com/news/view/36303/North-Korean-Hackers-Target-Job-Seekers-With-Fake-App.html,https://da.gd/NJU7Zc
PacketstormSecurity,Ukrainian Drones Now Spray Thermite Streams Right Into Russian Trenches,https://packetstormsecurity.com/news/view/36299/Ukrainian-Drones-Now-Spray-Thermite-Streams-Right-Into-Russian-Trenches.html,https://da.gd/LTYO3
PacketstormSecurity,"Security Boom Is Over, With Over 1/3 Of CISOs Reporting Flat Or Falling Budgets",https://packetstormsecurity.com/news/view/36298/Security-Boom-Is-Over-With-Over-1-3-Of-CISOs-Reporting-Flat-Or-Falling-Budgets.html,https://da.gd/T1zK
