feed,title,long_url,short_url
PacketstormSecurity,Unpatchable Zero Day In Surveillance Cam Is Being Exploited To Install Mirai,https://packetstormsecurity.com/news/view/36271/Unpatchable-Zero-Day-In-Surveillance-Cam-Is-Being-Exploited-To-Install-Mirai.html,https://da.gd/6EbG9d
PacketstormSecurity,Dick's Sporting Goods Discloses Cyberattack,https://packetstormsecurity.com/news/view/36270/Dicks-Sporting-Goods-Discloses-Cyberattack.html,https://da.gd/esHns
PacketstormSecurity,Cisco Patches Multiple NX-OS Software Vulnerabilities,https://packetstormsecurity.com/news/view/36272/Cisco-Patches-Multiple-NX-OS-Software-Vulnerabilities.html,https://da.gd/QufGik
PacketstormSecurity,PoC Code Released For Zero Click Critical Windows Vuln,https://packetstormsecurity.com/news/view/36273/PoC-Code-Released-For-Zero-Click-Critical-Windows-Vuln.html,https://da.gd/LVKh5
PacketstormSecurity,Iranian Hackers Use New Tickler Malware For Intelligence Gathering,https://packetstormsecurity.com/news/view/36275/Iranian-Hackers-Use-New-Tickler-Malware-For-Intelligence-Gathering.html,https://da.gd/zAjg
PacketstormSecurity,"Brain Cipher Claims Attack On Olympic Venue, Promises 300 GB Data Leak",https://packetstormsecurity.com/news/view/36274/Brain-Cipher-Claims-Attack-On-Olympic-Venue-Promises-300-GB-Data-Leak.html,https://da.gd/HUQ96
