feed,title,long_url,short_url
gNews,HiddenLayer announces the public launch of their MLSec platform and its design partner programme - SourceSecurity,https://www.sourcesecurity.com/tags/cyber-security/news/hiddenlayer-announces-public-launch-mlsec-platform-co-14411-ga-co-1642672810-ga-co-1649062793-ga-co-1663651514-ga.1666695453.html,https://bit.ly/3SX81EB
gNews,AI poses an 'existential threat to humanity' say 49% of IT pros - DIGIT,https://www.digit.fyi/ai-poses-existential-threat-to-humanity/,https://bit.ly/3gOCI1h
gNews,New “thermal attacks” can crack device passwords in seconds - Technology Magazine,https://technologymagazine.com/articles/new-thermal-attacks-can-crack-device-passwords-in-seconds,https://bit.ly/3zpyUd9
gNews,Daily Roundup: Zscaler Bolsters SSE With AI-Powered Data Protection - SDxCentral,https://www.sdxcentral.com/articles/summary/daily-roundup-zscaler-bolsters-sse-with-ai-powered-data-protection/2022/10/,https://bit.ly/3sCkEKm
gNews,NVIDIA CEO Sees Massive Potential in AI-Powered Language Models-as-a-Service - The Software Report,https://www.thesoftwarereport.com/nvidia-ceo-sees-massive-potential-in-ai-powered-language-models-as-a-service/,https://bit.ly/3sDnxL4
gNews,Human-Centric No-Code Automation is the Future of Cybersecurity - Security Boulevard,https://securityboulevard.com/2022/10/human-centric-no-code-automation-is-the-future-of-cybersecurity/,https://bit.ly/3W73ORc
