feed,title,long_url,short_url
LinuxSecurity,Oracle8: ELSA-2022-0258: httpd Important Security Update,https://www.linuxsecurity.com/advisories/oracle/oracle8-elsa-2022-0258-httpd-important-security-update-18-55-00?rss,https://bit.ly/3fZSdzA
LinuxSecurity,Oracle8: ELSA-2022-0267: polkit Important Security Update,https://www.linuxsecurity.com/advisories/oracle/oracle8-elsa-2022-0267-polkit-important-security-update-18-55-00?rss,https://bit.ly/3KMYxbR
LinuxSecurity,Oracle8: ELSA-2022-0185: java Moderate Security Update,https://www.linuxsecurity.com/advisories/oracle/oracle8-elsa-2022-0185-java-moderate-security-update-18-54-59?rss,https://bit.ly/3Gew5fP
LinuxSecurity,Oracle7: ELSA-2022-0204: java Moderate Security Update,https://www.linuxsecurity.com/advisories/oracle/oracle7-elsa-2022-0204-java-moderate-security-update-18-54-52?rss,https://bit.ly/3Av4RAh
LinuxSecurity,Oracle7: ELSA-2022-0274: polkit Important Security Update,https://www.linuxsecurity.com/advisories/oracle/oracle7-elsa-2022-0274-polkit-important-security-update-18-54-52?rss,https://bit.ly/34blcxC
LinuxSecurity,Oracle7: ELSA-2022-0274: polkit Important Security Update,https://www.linuxsecurity.com/advisories/oracle/oracle7-elsa-2022-0274-polkit-important-security-update-18-54-46?rss,https://bit.ly/33RIV6f
