feed,title,long_url,short_url
LinuxSecurity,openSUSE: python-ldap Moderate Update for Security Issues 2025:3714-1,https://linuxsecurity.com/advisories/opensuse/opensuse-2025-3714-1-python-ldap,https://da.gd/R3e2D
LinuxSecurity,SUSE: python-ldap Moderate Security Update for CVE-2025-61911 2025:3714-1,https://linuxsecurity.com/advisories/suse/suse-2025-3714-1-for-python-ldap-cy7ui3kvhuxw,https://da.gd/hZvyR
LinuxSecurity,openSUSE Leap 15.6: ffmpeg-4 Important Security Update 2025:3715-1,https://linuxsecurity.com/advisories/opensuse/opensuse-2025-3715-1-ffmpeg-4,https://da.gd/tMcf9
LinuxSecurity,SUSE: ffmpeg-4 Important Buffer Overflow Vuln 2025:3715-1,https://linuxsecurity.com/advisories/suse/suse-2025-3715-1-for-ffmpeg-4-zehdxyeaoxj8,https://da.gd/5PB0
LinuxSecurity,SUSE Linux Enterprise: Kernel Important Security Patch Update 2025:3716-1,https://linuxsecurity.com/advisories/suse/suse-2025-3716-1-for-kernel-vvuclo6jobhx,https://da.gd/QpXsCu
LinuxSecurity,openSUSE 15.4 Kernel Important Update for Five Issues SUSE-2025:3712-1,https://linuxsecurity.com/advisories/opensuse/opensuse-2025-3712-1-kernel,https://da.gd/nrWKO
