feed,title,long_url,short_url
LinuxSecurity,SUSE: Protobuf Moderate Crash Issue Update CVE-2025-4565 2025:3722-1,https://linuxsecurity.com/advisories/suse/suse-2025-3722-1-for-protobuf-szqgebvekzba,https://da.gd/28xyPw
LinuxSecurity,openSUSE: libqt5-qtbase Moderate Crash and Performance Issues 2025:3723-1,https://linuxsecurity.com/advisories/opensuse/opensuse-2025-3723-1-libqt5-qtbase,https://da.gd/sMDU6
LinuxSecurity,SUSE: libqt5-qtbase Moderate Issues CVE-2025-30348 Advisory 2025:3723-1,https://linuxsecurity.com/advisories/suse/suse-2025-3723-1-for-libqt5-qtbase-0eczsytxrhxb,https://da.gd/qNNHAq
LinuxSecurity,openSUSE: Kernel Important Security Update 2025:3717-1 CVE-2025-21971,https://linuxsecurity.com/advisories/opensuse/opensuse-2025-3717-1-kernel,https://da.gd/n95Ief
LinuxSecurity,SUSE: Kernel Important Security Update for 2025:3717-1 CVE-2025-21971,https://linuxsecurity.com/advisories/suse/suse-2025-3717-1-for-kernel-k9xzmq9mkvcs,https://da.gd/ZnfA
LinuxSecurity,openSUSE Leap 15.4: Kernel Important Security Fixes 2025:3720-1,https://linuxsecurity.com/advisories/opensuse/opensuse-2025-3720-1-kernel,https://da.gd/xgATze
