feed,title,long_url,short_url
LinuxSecurity,openSUSE Tumbleweed: istioctl Moderate Security Update 2025:15655-1,https://linuxsecurity.com/advisories/opensuse/opensuse-2025-15655-1-istioctl-1-27-3-1-1,https://da.gd/Bh3nRD
LinuxSecurity,openSUSE Tumbleweed: git-bug Moderate Threat Fix 2025:15654-1,https://linuxsecurity.com/advisories/opensuse/opensuse-2025-15654-1-git-bug-0-10-1-2-1,https://da.gd/sSHbpz
LinuxSecurity,openSUSE Tumbleweed: sccache Moderate Security Patch CVE-2024-12224,https://linuxsecurity.com/advisories/opensuse/opensuse-2025-15656-1-sccache-0-12-0~1-1-1,https://da.gd/ZhmG5w
LinuxSecurity,openSUSE Tumbleweed fetchmail Moderate CVE-2025-61962 Fix 2025:15653-1,https://linuxsecurity.com/advisories/opensuse/opensuse-2025-15653-1-fetchmail-6-5-6-1-1,https://da.gd/nTcbMF
LinuxSecurity,openSUSE Tumbleweed: Cargo-Audit Moderate CVE-2025-62370 Alert 2025:15652-1,https://linuxsecurity.com/advisories/opensuse/opensuse-2025-15652-1-cargo-audit-advisory-db-20251021-1-1,https://da.gd/EYOj
LinuxSecurity,openSUSE Tumbleweed: ImageMagick Moderate Security Alert 2025:15650-1,https://linuxsecurity.com/advisories/opensuse/opensuse-2025-15650-1-imagemagick-7-1-2-7-1-1,https://da.gd/ZaZDju
