feed,title,long_url,short_url
PacketstormSecurity,Hate It When That Happens: China Says It's Checking If It Accidentally Sent A Spy Balloon To Montana,https://packetstormsecurity.com/news/view/34283/Hate-It-When-That-Happens-China-Says-Its-Checking-If-It-Accidentally-Sent-A-Spy-Balloon-To-Montana.html,https://da.gd/MmA8Lf
PacketstormSecurity,"HeadCrab Malware Compromised 1,200 Redis Servers",https://packetstormsecurity.com/news/view/34284/HeadCrab-Malware-Compromised-1-200-Redis-Servers.html,https://da.gd/lIy3AY
PacketstormSecurity,Passion Botnet Cyberattacks Hit Healthcare,https://packetstormsecurity.com/news/view/34285/Passion-Botnet-Cyberattacks-Hit-Healthcare.html,https://da.gd/fCihZX
PacketstormSecurity,Former Ubiquiti Dev Pleads Guilty In Data Theft And Extortion Case,https://packetstormsecurity.com/news/view/34286/Former-Ubiquiti-Dev-Pleads-Guilty-In-Data-Theft-And-Extortion-Case.html,https://da.gd/3xvQab
PacketstormSecurity,Lenovo Diagnostics Driver Memory Access,https://packetstormsecurity.com/files/170849/cve_2022_3699_lenovo_diagnostics_driver.rb.txt,https://da.gd/NiFBR
PacketstormSecurity,macOS Dirty Cow Arbitrary File Write Local Privilege Escalation,https://packetstormsecurity.com/files/170848/mac_dirty_cow.rb.txt,https://da.gd/52sRX
PacketstormSecurity,F5 Big-IP Create Administrative User,https://packetstormsecurity.com/files/170847/f5_create_user.rb.txt,https://da.gd/4mFS09
PacketstormSecurity,Oracle Database 12.1.0.2 Spatial Component Privilege Escalation,https://packetstormsecurity.com/files/170845/oracle12102-escalate.txt,https://da.gd/6vhpzB
