feed,title,long_url,short_url
LinuxSecurity,openSUSE Leap 15.6: Important Fix for java-1_8_0-openj9 Heap Corruption,https://linuxsecurity.com/advisories/opensuse/opensuse-2025-02545-1-important-java-1-8-0-openj9-f5amgvvkiwxl,https://da.gd/aJmk
LinuxSecurity,SUSE: java-1_8_0-openj9 Important Heap Corruption Issues Fix 2025:02545-1,https://linuxsecurity.com/advisories/suse/suse-2025-02545-1-important-java-1-8-0-openj9-i0d2mfqhvu3l,https://da.gd/epUPsW
LinuxSecurity,SUSE: MozillaThunderbird Important Update CVE-2025-6424 Security Advisory,https://linuxsecurity.com/advisories/suse/suse-2025-02546-1-important-mozillathunderbird-i9av4qqt4xq2,https://da.gd/Wf5KS8
LinuxSecurity,openSUSE: MozillaThunderbird Important Security Patch Advisory 2025:02546-1,https://linuxsecurity.com/advisories/opensuse/opensuse-2025-02546-1-important-mozillathunderbird-ozkibjzqfxox,https://da.gd/GD72Wa
LinuxSecurity,SUSE: 2025:02547-1 Important libxml2 Heap Corruption CVE-2025-7425,https://linuxsecurity.com/advisories/suse/suse-2025-02547-1-important-libxml2-sndcj8cqw9pi,https://da.gd/OjBDXU
LinuxSecurity,SUSE: Docker Moderate CVE-2025-22872 Security Advisory 2025:02366-2,https://linuxsecurity.com/advisories/suse/suse-2025-02366-2-moderate-docker-jcutne6wb93g,https://da.gd/siAC3
