feed,title,long_url,short_url
gNews,Gartner identifies the Top Cybersecurity Trends for 2024 - Nation Thailand,https://news.google.com/rss/articles/CBMiNWh0dHBzOi8vd3d3Lm5hdGlvbnRoYWlsYW5kLmNvbS9idXNpbmVzcy90ZWNoLzQwMDM2MzM20gEA?oc=5,https://da.gd/1bFmY
gNews,Biden's budget boost for cybersecurity. - The CyberWire,https://news.google.com/rss/articles/CBMiP2h0dHBzOi8vdGhlY3liZXJ3aXJlLmNvbS9wb2RjYXN0cy9kYWlseS1wb2RjYXN0LzIwMjIvdHJhbnNjcmlwdNIBAA?oc=5,https://da.gd/Ys1hi
gNews,"ChatGPT Plugin Vulnerabilities Exposed Data, Accounts - SecurityWeek",https://news.google.com/rss/articles/CBMiUmh0dHBzOi8vd3d3LnNlY3VyaXR5d2Vlay5jb20vY2hhdGdwdC1wbHVnaW4tdnVsbmVyYWJpbGl0aWVzLWV4cG9zZWQtZGF0YS1hY2NvdW50cy_SAVZodHRwczovL3d3dy5zZWN1cml0eXdlZWsuY29tL2NoYXRncHQtcGx1Z2luLXZ1bG5lcmFiaWxpdGllcy1leHBvc2VkLWRhdGEtYWNjb3VudHMvYW1wLw?oc=5,https://da.gd/in1P7L
gNews,Cybersecurity Veteran Altaf Halde Joins TAC Security as APAC & Middle East Chief Business Officer - MSN,https://news.google.com/rss/articles/CBMiqgFodHRwczovL3d3dy5tc24uY29tL2VuLWluL21vbmV5L25ld3MvY3liZXJzZWN1cml0eS12ZXRlcmFuLWFsdGFmLWhhbGRlLWpvaW5zLXRhYy1zZWN1cml0eS1hcy1hcGFjLW1pZGRsZS1lYXN0LWNoaWVmLWJ1c2luZXNzLW9mZmljZXIvYXItQkIxalA4N0s_b2NpZD1maW5hbmNlLXZlcnRocC1mZWVkc9IBAA?oc=5,https://da.gd/Z7taj
gNews,"AI could pose ‘extinction-level’ threat to humans and the US must intervene, State Dept.-commissioned report warns - WSVN 7News | Miami News, Weather, Sports | Fort Lauderdale",https://news.google.com/rss/articles/CBMijgFodHRwczovL3dzdm4uY29tL25ld3MvdXMtd29ybGQvYWktY291bGQtcG9zZS1leHRpbmN0aW9uLWxldmVsLXRocmVhdC10by1odW1hbnMtYW5kLXRoZS11cy1tdXN0LWludGVydmVuZS1zdGF0ZS1kZXB0LWNvbW1pc3Npb25lZC1yZXBvcnQtd2FybnMv0gEA?oc=5,https://da.gd/WyUx
