feed,title,long_url,short_url
gNews,Most Security Pros Admit Shadow SaaS and AI Use - Infosecurity Magazine,https://news.google.com/rss/articles/CBMiTWh0dHBzOi8vd3d3LmluZm9zZWN1cml0eS1tYWdhemluZS5jb20vbmV3cy9tb3N0LXNlY3VyaXR5LXByb3Mtc2hhZG93LXNhYXMtYWkv0gEA?oc=5,https://da.gd/5J7id2
gNews,"Kaseya: AI, Automation High Priority in Partner Budgets - Channel Futures",https://news.google.com/rss/articles/CBMiWmh0dHBzOi8vd3d3LmNoYW5uZWxmdXR1cmVzLmNvbS9zZWN1cml0eS9rYXNleWEtYWktYXV0b21hdGlvbi1oaWdoLXByaW9yaXR5LXBhcnRuZXItYnVkZ2V0c9IBAA?oc=5,https://da.gd/m5oL5d
gNews,Microsoft's Partnership With Middle East AI Firm Under Scrutiny - Dark Reading,https://news.google.com/rss/articles/CBMiZWh0dHBzOi8vd3d3LmRhcmtyZWFkaW5nLmNvbS9jeWJlci1yaXNrL21pY3Jvc29mdHMtcGFydG5lcnNoaXAtd2l0aC1taWRkbGUtZWFzdC1haS1maXJtLXVuZGVyLXNjcnV0aW550gEA?oc=5,https://da.gd/d87LF
gNews,White House to require increased cybersecurity protocols for R&D institutions - FedScoop,https://news.google.com/rss/articles/CBMiYmh0dHBzOi8vZmVkc2Nvb3AuY29tL3doaXRlLWhvdXNlLXRvLXJlcXVpcmUtaW5jcmVhc2VkLWN5YmVyc2VjdXJpdHktcHJvdG9jb2xzLWZvci1yZC1pbnN0aXR1dGlvbnMv0gEA?oc=5,https://da.gd/EfYi2M
gNews,K3 Technology Acquires Dallas-Based MSP OG2 Network Services: Exclusive - CRN,https://news.google.com/rss/articles/CBMicWh0dHBzOi8vd3d3LmNybi5jb20vbmV3cy9jaGFubmVsLW5ld3MvMjAyNC9rMy10ZWNobm9sb2d5LWFjcXVpcmVzLWRhbGxhcy1iYXNlZC1tc3Atb2cyLW5ldHdvcmstc2VydmljZXMtZXhjbHVzaXZl0gEA?oc=5,https://da.gd/Slvf
