feed,title,long_url,short_url
LinuxSecurity,Oracle8: ELSA-2023-3594: python3.11 Important Security Update,https://www.linuxsecurity.com/advisories/oracle/oracle8-elsa-2023-3594-python3-11-important-security-update-56k7dfykl0q1?rss,https://da.gd/MNN1
LinuxSecurity,Oracle8: ELSA-2023-3590: firefox security Important Security Update,https://www.linuxsecurity.com/advisories/oracle/oracle8-elsa-2023-3590-firefox-security-important-security-update-nxy9k9ccja8n?rss,https://da.gd/TvZYli
LinuxSecurity,Oracle8: ELSA-2023-3588: thunderbird Important Security Update,https://www.linuxsecurity.com/advisories/oracle/oracle8-elsa-2023-3588-thunderbird-important-security-update-jdnt2buby5n6?rss,https://da.gd/7hqxhb
LinuxSecurity,Oracle8: ELSA-2023-3584: c-ares security Important Security Update,https://www.linuxsecurity.com/advisories/oracle/oracle8-elsa-2023-3584-c-ares-security-important-security-update-vz5gnsmmoonl?rss,https://da.gd/j2UGNP
LinuxSecurity,"Oracle8: ELSA-2023-3582: .NET 6.0 security, bug fix, and enhancement Important Security Up",https://www.linuxsecurity.com/advisories/oracle/oracle8-elsa-2023-3582-net-6-0-security-bug-fix-and-enhancement-important-security-up-1wxlditpz8gc?rss,https://da.gd/pwWCJI
