feed,title,long_url,short_url
LinuxSecurity,Ubuntu 18.04 LTS: USN-7685-4 Linux Kernel Critical Security Issues,https://linuxsecurity.com/advisories/ubuntu/ubuntu-7685-4-linux-kernel-oracle-u3sjx6ogoq1n,https://da.gd/a9a6z
LinuxSecurity,SUSE: Linux Kernel Important Fix CVE-2024-53125 DoS 2025:02688-1,https://linuxsecurity.com/advisories/suse/suse-2025-02688-1-important-the-linux-kernel-06kgmncw0z8v,https://da.gd/895gVZ
LinuxSecurity,openSUSE: Critical Linux Kernel Security Patch CVE-2025-37797 2025:02688-1,https://linuxsecurity.com/advisories/opensuse/opensuse-2025-02688-1-important-the-linux-kernel-qzulwuttbxm6,https://da.gd/HZlJvV
LinuxSecurity,SUSE: Linux Kernel Important Update Advisory 2025:02689-1 CVE-2025-37797,https://linuxsecurity.com/advisories/suse/suse-2025-02689-1-important-the-linux-kernel-ygubz6kk0ntm,https://da.gd/uTP7Z
LinuxSecurity,openSUSE 15.6: Linux Kernel Important Security Update 2025:02689-1,https://linuxsecurity.com/advisories/opensuse/opensuse-2025-02689-1-important-the-linux-kernel-m9x75zj5bwpk,https://da.gd/LA5Jo
LinuxSecurity,SUSE: Linux Kernel Important Patch DoS Issues 2025:02691-1,https://linuxsecurity.com/advisories/suse/suse-2025-02691-1-important-the-linux-kernel-nuhodzgtxvws,https://da.gd/soX60
