feed,title,long_url,short_url
LinuxSecurity,Debian: Urgent Vulnerability in Dropbear DSA-6086-1 CVE-2025-14282,https://linuxsecurity.com/advisories/debian/dropbear-dsa-6086-1-2025-14282,https://da.gd/oWswhQ
LinuxSecurity,Debian: MediaWiki DSA-6085-1 Security Updates for DoS and XSS,https://linuxsecurity.com/advisories/debian/mediawiki-dsa-6085-1-2025-11173,https://da.gd/ie9bAO
LinuxSecurity,openSUSE: libruby3 Moderate Update DoS Vulnerability 2025:15828-1,https://linuxsecurity.com/advisories/opensuse/libruby3-4-3-4-8-1-1-2025-58767,https://da.gd/CYiiOT
LinuxSecurity,openSUSE: coredns Moderate Update Advisory 2025:15826-1 CVE-2025-68156,https://linuxsecurity.com/advisories/opensuse/coredns-k8s-2025-15826-1-2025-68156,https://da.gd/XcXsCh
LinuxSecurity,openSUSE: rsync Update for Moderate CVE-2025-10158 Security Threat,https://linuxsecurity.com/advisories/opensuse/rsync-3-4-1-opensuse-2025-15827-1-2025-10158,https://da.gd/swu7f
LinuxSecurity,openSUSE Tumbleweed: CoreDNS Moderate Denial of Service ID 2025:15825-1,https://linuxsecurity.com/advisories/opensuse/coredns-k8s1-33-1-12-0-2025-68156,https://da.gd/H55mUE
