feed,title,long_url,short_url
LinuxSecurity,SUSE: 2024:2567-1 important: emacs Security Advisory Updates,https://linuxsecurity.com/advisories/suse/suse-2024-2567-1-important-emacs-security-advisory-updates-o2lwpds6iffi,https://da.gd/BxjXT
LinuxSecurity,Oracle9: ELSA-2024-4636: libndp security Important Security Advisory Updates,https://linuxsecurity.com/advisories/oracle/oracle9-elsa-2024-4636-libndp-security-important-security-advisory-updates-shmsytl1ah7h,https://da.gd/3zx18Q
LinuxSecurity,Oracle9: ELSA-2024-4623: qt5-qtbase Important Security Advisory Updates,https://linuxsecurity.com/advisories/oracle/oracle9-elsa-2024-4623-qt5-qtbase-important-security-advisory-updates-jylfsnrlws6u,https://da.gd/uoisnV
LinuxSecurity,Oracle9: ELSA-2024-4624: thunderbird Important Security Advisory Updates,https://linuxsecurity.com/advisories/oracle/oracle9-elsa-2024-4624-thunderbird-important-security-advisory-updates-tupmxzvxli84,https://da.gd/O0NzJ
LinuxSecurity,Oracle9: ELSA-2024-4583: kernel security Important Security Advisory Updates,https://linuxsecurity.com/advisories/oracle/oracle9-elsa-2024-4583-kernel-security-important-security-advisory-updates-fwsh1fgqeg40,https://da.gd/Xw1KHD
LinuxSecurity,Oracle9: ELSA-2024-4568: java-17-openjdk Important Security Advisory Updates,https://linuxsecurity.com/advisories/oracle/oracle9-elsa-2024-4568-java-17-openjdk-important-security-advisory-updates-l6ghx00ynnzt,https://da.gd/Ca0xQA
