feed,title,long_url,short_url
LinuxSecurity,Debian 11 bullseye DLA-4126-2 critical: jinja2 regression fix,https://linuxsecurity.com/advisories/deblts/debian-lts-dla-4126-2-jinja2-regression-update-g3f0dbghgepd,https://da.gd/Snoiy
LinuxSecurity,Debian: DSA-5911-1 moderate: request tracker information disclosure,https://linuxsecurity.com/advisories/debian/debian-dsa-5911-1-request-tracker4-knquyg5ll61y,https://da.gd/ZQVI
LinuxSecurity,Debian: DSA-5909-1 moderate: request tracker cross-site scripting,https://linuxsecurity.com/advisories/debian/debian-dsa-5909-1-request-tracker5-jyxmaqyjs0hl,https://da.gd/JNv7Gu
LinuxSecurity,Debian: DSA-5910-1 Critical: firefox-esr Execute Code Risk,https://linuxsecurity.com/advisories/debian/debian-dsa-5910-1-firefox-esr-qg8rnvszzj2u,https://da.gd/httGSh
LinuxSecurity,Debian DSA-5909-1 moderate: request tracker information disclosure,https://linuxsecurity.com/advisories/debian/debian-dsa-5909-1-request-tracker5-fycytzjrouog,https://da.gd/zVxtQ
