feed,title,long_url,short_url
PacketstormSecurity,FBI And MI5 Leaders Give Unprecedented Joint Warning On Chinese Spying,https://packetstormsecurity.com/news/view/33613/FBI-And-MI5-Leaders-Give-Unprecedented-Joint-Warning-On-Chinese-Spying.html,https://bit.ly/3RhFYjf
PacketstormSecurity,Apple Launches Lockdown To Block Spyware,https://packetstormsecurity.com/news/view/33614/Apple-Launches-Lockdown-To-Block-Spyware.html,https://bit.ly/3RjmV8a
PacketstormSecurity,End-To-End Encryption's Central Role In Modern Self Defense,https://packetstormsecurity.com/news/view/33616/End-To-End-Encryptions-Central-Role-In-Modern-Self-Defense.html,https://bit.ly/3Ij1X5z
PacketstormSecurity,Hack Allows Drone Takeover Via ExpressLRS Protocol,https://packetstormsecurity.com/news/view/33615/Hack-Allows-Drone-Takeover-Via-ExpressLRS-Protocol.html,https://bit.ly/3apGcEn
PacketstormSecurity,Windows Kerberos KerbRetrieveEncodedTicketMessage AppContainer Privilege Escalation,https://packetstormsecurity.com/files/167716/GS20220707131306.tgz,https://bit.ly/3Ingo8D
PacketstormSecurity,Dovecot IMAP Server 2.2 Improper Access Control,https://packetstormsecurity.com/files/167715/DOV-5320.txt,https://bit.ly/3ynLwAd
