feed,title,long_url,short_url
LinuxSecurity,"SUSE: Critical Privilege Escalation Vulnerabilities CVE-2025-32462,32463",https://linuxsecurity.com/advisories/suse/suse-2025-20489-1-important-sudo-s3vmso0boxle,https://da.gd/oz3Cu
LinuxSecurity,SUSE: libgcrypt Moderate Timing Attack CVE-2024-2236 Advisory 2025:20490-1,https://linuxsecurity.com/advisories/suse/suse-2025-20490-1-moderate-libgcrypt-8udhk4byr1zg,https://da.gd/PaTkD
LinuxSecurity,SUSE: rust-keylime Moderate CVE-2024-12224 Vuln 2025:20491-1,https://linuxsecurity.com/advisories/suse/suse-2025-20491-1-moderate-rust-keylime-wpiatu36vxhy,https://da.gd/J76jX
LinuxSecurity,SUSE: python311 Important Vulnerability Fix Advisory 2025:20492-1,https://linuxsecurity.com/advisories/suse/suse-2025-20492-1-important-python311-dgajlsrp2kho,https://da.gd/3e9Vk
LinuxSecurity,SUSE Issues Critical Linux Kernel Security Update for CVE-2024-26831,https://linuxsecurity.com/advisories/suse/suse-2025-20493-1-important-the-linux-kernel-cpwqlurmeosy,https://da.gd/kuMzm
LinuxSecurity,SUSE Linux Micro 6.0: pam_pkcs11 Important Security Update CVE-2025-6018,https://linuxsecurity.com/advisories/suse/suse-2025-20496-1-important-pam-pkcs11-onlb6wouppn2,https://da.gd/TjCZy9
