feed,title,long_url,short_url
LinuxSecurity,Ubuntu 20.04 LTS: USN-7671-1 Linux Kernel Critical Security Flaws,https://linuxsecurity.com/advisories/ubuntu/ubuntu-7671-1-linux-kernel-djlfgc67ikzt,https://da.gd/S7ldn
LinuxSecurity,Important Out-Of-Bounds Risk Advisory for SUSE polkit CVE-2025-7519,https://linuxsecurity.com/advisories/suse/suse-2025-02525-1-important-polkit-v2couh0ouuux,https://da.gd/Da4JP
LinuxSecurity,SUSE: polkit Important Patch CVE-2025-7519 Out-Of-Bounds Write Risk,https://linuxsecurity.com/advisories/suse/suse-2025-02527-1-important-polkit-vepah7eopz0r,https://da.gd/aXXXv
LinuxSecurity,openSUSE: polkit Important Out-of-Bounds Write CVE-2025-7519 2025:02527-1,https://linuxsecurity.com/advisories/opensuse/opensuse-2025-02527-1-important-polkit-lcaef1rbpges,https://da.gd/fC6df6
LinuxSecurity,SUSE: polkit Important Out-of-Bounds Access Issue 2025:02528-1,https://linuxsecurity.com/advisories/suse/suse-2025-02528-1-important-polkit-qayc5tdbtjif,https://da.gd/Rk7uZE
LinuxSecurity,openSUSE Tumbleweed: Minio Client Moderate CVE-2025-22874 Advisory,https://linuxsecurity.com/advisories/opensuse/opensuse-2025-15379-1-moderate-minio-client-20250721t052808z-1-1-nevrvsazxsgm,https://da.gd/ymAoq5
