feed,title,long_url,short_url
PacketstormSecurity,"Packet Storm New Exploits For November, 2022",https://packetstormsecurity.com/files/170084/202211-exploits.tgz,https://bit.ly/3Um1qEl
PacketstormSecurity,Red Hat Security Advisory 2022-8750-01,https://packetstormsecurity.com/files/170083/RHSA-2022-8750-01.txt,https://bit.ly/3VsL3ak
PacketstormSecurity,Debian Security Advisory 5292-1,https://packetstormsecurity.com/files/170077/dsa-5292-1.txt,https://bit.ly/3irTDrb
PacketstormSecurity,Backdoor.Win32.Delf.gj MVID-2022-0663 Information Disclosure,https://packetstormsecurity.com/files/170074/MVID-2022-0663.txt,https://bit.ly/3B7py6S
PacketstormSecurity,IBM Websphere Application Server 7.0 Cross Site Scripting,https://packetstormsecurity.com/files/170073/ibmwas70-xss.txt,https://bit.ly/3gYdZIk
