feed,title,long_url,short_url
PacketstormSecurity,"Google To Pay Up To $91,337 For Exploits Of New Linux And Kubernetes Bugs",https://packetstormsecurity.com/news/view/33109/Google-To-Pay-Up-To-91-337-For-Exploits-Of-New-Linux-And-Kubernetes-Bugs.html,https://bit.ly/3BoJP6T
PacketstormSecurity,EU To Launch Probe Over Use Of Cloud Services By Public Sector,https://packetstormsecurity.com/news/view/33110/EU-To-Launch-Probe-Over-Use-Of-Cloud-Services-By-Public-Sector.html,https://bit.ly/3rOfmvJ
PacketstormSecurity,TA2541: APT Has Been Shooting RATs At Aviation For Years,https://packetstormsecurity.com/news/view/33108/TA2541-APT-Has-Been-Shooting-RATs-At-Aviation-For-Years.html,https://bit.ly/3uZFENk
PacketstormSecurity,Linux Kernel Patches Remote Stack Overflow Bug,https://packetstormsecurity.com/news/view/33111/Linux-Kernel-Patches-Remote-Stack-Overflow-Bug.html,https://bit.ly/3uNPIsV
PacketstormSecurity,Red Hat Security Advisory 2022-0524-01,https://packetstormsecurity.com/files/165982/RHSA-2022-0524-01.txt,https://bit.ly/34GxpuU
PacketstormSecurity,Red Hat Security Advisory 2022-0527-01,https://packetstormsecurity.com/files/165981/RHSA-2022-0527-01.txt,https://bit.ly/3LBfBSQ
