feed,title,long_url,short_url
SecurityWeek,"Tech Leaders to Gather for AI Risk Summit at the Ritz-Carlton, Half Moon Bay June 25-26, 2024",https://www.securityweek.com/tech-leaders-to-gather-for-ai-risk-summit-at-the-ritz-carlton-half-moon-bay-june-25-26-2024/,https://da.gd/rqEhlG
SecurityWeek,CISA Conducts First AI Cyber Incident Response Exercise,https://www.securityweek.com/cisa-conducts-first-ai-cyber-incident-response-exercise/,https://da.gd/kwwzX
SecurityWeek,Keytronic Says Personal Information Stolen in Ransomware Attack,https://www.securityweek.com/keytronic-says-personal-information-stolen-in-ransomware-attack/,https://da.gd/N4lINj
SecurityWeek,Insurance Company Globe Life Investigating Data Breach,https://www.securityweek.com/insurance-company-globe-life-investigating-data-breach/,https://da.gd/FcpwW8
SecurityWeek,Aim Security Raises $18M to Secure Customers’ Implementation of AI Apps,https://www.securityweek.com/aim-security-raises-18m-to-secure-customers-implementation-of-ai-apps/,https://da.gd/uvZzIb
SecurityWeek,"200,000 Impacted by Data Breach at Los Angeles County Public Health Agency",https://www.securityweek.com/200000-impacted-by-data-breach-at-los-angeles-county-public-health-agency/,https://da.gd/1D0i7
SecurityWeek,UK Man Suspected of Being ‘Scattered Spider’ Leader Arrested,https://www.securityweek.com/uk-man-suspected-of-being-scattered-spider-leader-arrested/,https://da.gd/NXpPHb
SecurityWeek,Nigerian Faces Prison in US After BEC Fraud Conviction,https://www.securityweek.com/nigerian-faces-prison-in-us-after-bec-fraud-conviction/,https://da.gd/7i8SxF
