feed,title,long_url,short_url
SecurityWeek,SEC Says X Account Hacked via SIM Swapping,https://www.securityweek.com/sec-says-x-account-hacked-via-sim-swapping/,https://da.gd/IK2H
SecurityWeek,Russian Hackers Suspected of Sweden Cyberattack,https://www.securityweek.com/russian-hackers-suspected-of-sweden-cyberattack/,https://da.gd/JfLh8
SecurityWeek,F5 Names Samir Sherif as New CISO,https://www.securityweek.com/f5-names-samir-sherif-as-new-ciso/,https://da.gd/jt8q
SecurityWeek,Subway Sandwich Chain Investigating Ransomware Group’s Claims,https://www.securityweek.com/sandwich-chain-subway-investigating-ransomware-groups-claims/,https://da.gd/yHd1bG
SecurityWeek,A Sanction Has Been Imposed on a Hacker Who Released Australian Health Insurer Client Data,https://www.securityweek.com/a-sanction-has-been-imposed-on-a-hacker-who-released-australian-health-insurer-client-data/,https://da.gd/OV81oD
