feed,title,long_url,short_url
PacketstormSecurity,Hacker Attack Disrupts Russian State Media On Putin's Birthday,https://packetstormsecurity.com/news/view/36438/Hacker-Attack-Disrupts-Russian-State-Media-On-Putins-Birthday.html,https://da.gd/MwNkGz
PacketstormSecurity,Ryanair Faces GDPR Turbulence Over Customer ID Checks,https://packetstormsecurity.com/news/view/36434/Ryanair-Faces-GDPR-Turbulence-Over-Customer-ID-Checks.html,https://da.gd/s3QS
PacketstormSecurity,MITRE Announces AI Incident Sharing Project,https://packetstormsecurity.com/news/view/36437/MITRE-Announces-AI-Incident-Sharing-Project.html,https://da.gd/aYkwS
PacketstormSecurity,China's Salt Typhoon Hacked Multiple Telcos,https://packetstormsecurity.com/news/view/36436/Chinas-Salt-Typhoon-Hacked-Multiple-Telcos.html,https://da.gd/SqdW
PacketstormSecurity,About A Quarter Million Comcast Subscribers Had Their Data Stolen From Debt Collector,https://packetstormsecurity.com/news/view/36440/About-A-Quarter-Million-Comcast-Subscribers-Had-Their-Data-Stolen-From-Debt-Collector.html,https://da.gd/BRka5
PacketstormSecurity,"Apple Couldn't Tell Fake iPhones From Real Ones, Lost $2.5M In Scam",https://packetstormsecurity.com/news/view/36439/Apple-Couldnt-Tell-Fake-iPhones-From-Real-Ones-Lost-2.5M-In-Scam.html,https://da.gd/uOTTm
PacketstormSecurity,Antimatter Could Be The Key To Solving The Universe's Biggest Mysteries,https://packetstormsecurity.com/news/view/36435/Antimatter-Could-Be-The-Key-To-Solving-The-Universes-Biggest-Mysteries.html,https://da.gd/jEMrM
