feed,title,long_url,short_url
PacketstormSecurity,The Secret Uganda Deal That Has Brought NSO To The Brink of Collapse,https://packetstormsecurity.com/news/view/32938/The-Secret-Uganda-Deal-That-Has-Brought-NSO-To-The-Brink-of-Collapse.html,https://j.mp/3pk6HQh
PacketstormSecurity,The Cybersecurity Stories Vice Was Jealous Of In 2021,https://packetstormsecurity.com/news/view/32936/The-Cybersecurity-Stories-Vice-Was-Jealous-Of-In-2021.html,https://j.mp/3spr3d1
PacketstormSecurity,"Walk-Through Metal Detectors Can Be Hacked, New Research Finds",https://packetstormsecurity.com/news/view/32937/Walk-Through-Metal-Detectors-Can-Be-Hacked-New-Research-Finds.html,https://j.mp/3emJCWN
PacketstormSecurity,Ubisoft Confirms Just Dance Data Breach,https://packetstormsecurity.com/news/view/32939/Ubisoft-Confirms-Just-Dance-Data-Breach.html,https://j.mp/3een3Uv
PacketstormSecurity,Red Hat Security Advisory 2021-5238-02,https://packetstormsecurity.com/files/165390/RHSA-2021-5238-02.txt,https://j.mp/32rogoC
