feed,title,long_url,short_url
LinuxSecurity,Debian DSA-6264-1 Dnsmasq Important Denial of Service CVE-2026-2291,https://linuxsecurity.com/advisories/debian/debian-dsa-6264-1-dnsmasq,https://da.gd/Kc72X9
LinuxSecurity,Ubuntu 18.04 LTS Security Advisory USN-8267-1 Kernel Critical Issues,https://linuxsecurity.com/advisories/ubuntu/linux-kernel-ubuntu-8267-1,https://da.gd/5s3ETC
LinuxSecurity,openSUSE Tumbleweed libmodsecurity3 Moderate Threat Update 2026-10732-1,https://linuxsecurity.com/advisories/opensuse/libmod3-3-0-15-1-1-opensuse-2026-10732-1,https://da.gd/tLBOR
LinuxSecurity,openSUSE Tumbleweed mcphost Moderate Security Issues 2026-10731-1,https://linuxsecurity.com/advisories/opensuse/opensuse-mcphost-0-34-0-1-1,https://da.gd/9h8bk
LinuxSecurity,openSUSE Tumbleweed java-26-openj9 Moderate Threat Advisory 10729-1,https://linuxsecurity.com/advisories/opensuse/java-openj9-25-0-3-0-opensuse-2026-10728-1,https://da.gd/dKguDV
LinuxSecurity,openSUSE Tumbleweed krb5 Moderate Threat ID 2026-10729-1,https://linuxsecurity.com/advisories/opensuse/krb5-1-22-2-3-1-opensuse,https://da.gd/iezUj
