feed,title,long_url,short_url
SecurityWeek,‘Frebniis’ Malware Hijacks Microsoft IIS Function to Deploy Backdoor,https://www.securityweek.com/frebniis-malware-hijacks-microsoft-iis-function-to-deploy-backdoor/,https://da.gd/ukuN
SecurityWeek,Security Experts Warn of Foreign Cyber Threat to 2024 Voting,https://www.securityweek.com/security-experts-warn-of-foreign-cyber-threat-to-2024-voting/,https://da.gd/LIxj
SecurityWeek,SolarWinds Announces Upcoming Patches for High-Severity Vulnerabilities,https://www.securityweek.com/solarwinds-announces-upcoming-patches-for-high-severity-vulnerabilities/,https://da.gd/tzTG27
SecurityWeek,EU Organizations Warned of Chinese APT Attacks,https://www.securityweek.com/eu-organizations-warned-of-chinese-apt-attacks/,https://da.gd/5Jb8
SecurityWeek,"Hackers Earn $180,000 for ICS Exploits at Pwn2Own Miami 2023",https://www.securityweek.com/hackers-earn-180000-for-ics-exploits-at-pwn2own-miami-2023/,https://da.gd/20kEW5
SecurityWeek,Data Security Startup CommandK Raises $3 Million in Seed Funding,https://www.securityweek.com/data-security-startup-commandk-raises-3-million-in-seed-funding/,https://da.gd/BcyI
SecurityWeek,Atlassian Investigating Security Breach After Hackers Leak Data,https://www.securityweek.com/atlassian-investigating-security-breach-after-hackers-leak-data/,https://da.gd/RXkz
