feed,title,long_url,short_url
PacketstormSecurity,Aide 0.18.4,https://packetstormsecurity.com/files/172911/aide-0.18.4.tar.gz,https://da.gd/DjQQ
PacketstormSecurity,Online Examination System Project 1.0 Cross Site Request Forgery,https://packetstormsecurity.com/files/172910/oesp10-xsrf.txt,https://da.gd/EfTy
PacketstormSecurity,Teachers Record Management System 1.0 Validation Bypass,https://packetstormsecurity.com/files/172909/trms10-bypass.txt,https://da.gd/cEJG
PacketstormSecurity,Sales Tracker Management System 1.0 HTML Injection,https://packetstormsecurity.com/files/172908/stms10-inject.txt,https://da.gd/8Udvu
PacketstormSecurity,Symmetricom SyncServer Unauthenticated Remote Command Execution,https://packetstormsecurity.com/files/172907/symmetricom_syncserver_rce.rb.txt,https://da.gd/TSMC
PacketstormSecurity,Debian Security Advisory 5426-1,https://packetstormsecurity.com/files/172906/dsa-5426-1.txt,https://da.gd/RBBX7n
