feed,title,long_url,short_url
SecurityWeek,"ICS Patch Tuesday: 100 Vulnerabilities Addressed by Siemens, Schneider Electric",https://www.securityweek.com/ics-patch-tuesday-100-vulnerabilities-addressed-by-siemens-schneider-electric/,https://da.gd/6qAN4f
SecurityWeek,"Oligo Security Exits Stealth with $28M for AppSec, Open Source Security",https://www.securityweek.com/oligo-security-exits-stealth-with-28m-for-appsec-open-source-security/,https://da.gd/0zJp5i
SecurityWeek,"Citrix Patches High-Severity Vulnerabilities in Windows, Linux Apps",https://www.securityweek.com/citrix-patches-high-severity-vulnerabilities-in-windows-linux-apps/,https://da.gd/ENOV
SecurityWeek,SAP’s February 2023 Security Updates Patch High-Severity Vulnerabilities,https://www.securityweek.com/saps-february-2023-security-updates-patch-high-severity-vulnerabilities/,https://da.gd/gMZSc
SecurityWeek,"Russian Businessman Guilty in Hacking, Insider Trade Scheme",https://www.securityweek.com/russian-businessman-guilty-in-hacking-insider-trade-scheme/,https://da.gd/YDrEOA
