feed,title,long_url,short_url
PacketstormSecurity,Millions Of Android Users Scammed In SMS Fraud Driven By Tik-Tok Ads,https://packetstormsecurity.com/news/view/32756/Millions-Of-Android-Users-Scammed-In-SMS-Fraud-Driven-By-Tik-Tok-Ads.html,https://j.mp/3Ck0HuS
PacketstormSecurity,"Amazon Given Contract To Store Data For MI5, MI6, And GCHQ",https://packetstormsecurity.com/news/view/32757/Amazon-Given-Contract-To-Store-Data-For-MI5-MI6-And-GCHQ.html,https://j.mp/3ElL3QC
PacketstormSecurity,BlackMatter Botched Millions In Ransoms Due To Coding Flaw,https://packetstormsecurity.com/news/view/32759/BlackMatter-Botched-Millions-In-Ransoms-Due-To-Coding-Flaw.html,https://j.mp/2XK6T0e
PacketstormSecurity,CISA Warns Of Remote Code Execution Vulnerability With Discourse,https://packetstormsecurity.com/news/view/32755/CISA-Warns-Of-Remote-Code-Execution-Vulnerability-With-Discourse.html,https://j.mp/3vNK6gw
PacketstormSecurity,Facebook Admits Site Appears Hardwired For Misinformation,https://packetstormsecurity.com/news/view/32758/Facebook-Admits-Site-Appears-Hardwired-For-Misinformation.html,https://j.mp/3mfzh3S
