feed,title,long_url,short_url
LinuxSecurity,Ubuntu 20.04 LTS: Linux Kernel Critical Issues USN-7640-1 CVE-2025-2312,https://linuxsecurity.com/advisories/ubuntu/ubuntu-7640-1-linux-kernel-iot-jvfexo6usabf,https://da.gd/WU7j5C
LinuxSecurity,Ubuntu 20.04 LTS: Raspberry Pi Kernel Critical Security Flaws USN-7585-7,https://linuxsecurity.com/advisories/ubuntu/ubuntu-7585-7-linux-kernel-raspberry-pi-arteeqavbgmi,https://da.gd/l0spf
LinuxSecurity,openSUSE: erlang26 Moderate Path Traversal Fix CVE-2025-4748 2025:02331-1,https://linuxsecurity.com/advisories/suse/suse-2025-02331-1-moderate-erlang26-vhoz3haeclmf,https://da.gd/0h2Ef
LinuxSecurity,openSUSE: erlang26 Moderate Path Traversal Fix 2025:02331-1 CVE-2025-4748,https://linuxsecurity.com/advisories/opensuse/opensuse-2025-02331-1-moderate-erlang26-q5lvvfjroe7g,https://da.gd/gD7vHd
LinuxSecurity,openSUSE: Erlang Moderate Path Traversal Issue SUSE-2025:02332-1,https://linuxsecurity.com/advisories/suse/suse-2025-02332-1-moderate-erlang-ah2askeliyah,https://da.gd/FufG
LinuxSecurity,openSUSE Leap: Addressing Moderate Path Traversal CVE-2025-4748 Fix,https://linuxsecurity.com/advisories/opensuse/opensuse-2025-02332-1-moderate-erlang-u4ajr6h4djus,https://da.gd/nOaTv
