feed,title,long_url,short_url
PacketstormSecurity,0-Day In Cisco IOS XE Software Is Under Attack,https://packetstormsecurity.com/news/view/35131/0-Day-In-Cisco-IOS-XE-Software-Is-Under-Attack.html,https://da.gd/DZrAvT
PacketstormSecurity,Trench Tales: The College Account Takeover That Never Happened,https://packetstormsecurity.com/news/view/35132/Trench-Tales-The-College-Account-Takeover-That-Never-Happened.html,https://da.gd/NNje0
PacketstormSecurity,"Healthcare Orgs A Prime Target For NoEscape Ransomware, HHS Warns",https://packetstormsecurity.com/news/view/35129/Healthcare-Orgs-A-Prime-Target-For-NoEscape-Ransomware-HHS-Warns.html,https://da.gd/20eKaF
PacketstormSecurity,MemComputing ASICs Could Shatter 2048-Bit RSA Encryption,https://packetstormsecurity.com/news/view/35130/MemComputing-ASICs-Could-Shatter-2048-Bit-RSA-Encryption.html,https://da.gd/5GFjm2
PacketstormSecurity,"AI Chatbots Could Help Plan Bioweapon Attacks, Report Finds",https://packetstormsecurity.com/news/view/35128/AI-Chatbots-Could-Help-Plan-Bioweapon-Attacks-Report-Finds.html,https://da.gd/cfxZt
PacketstormSecurity,US Cybercops Urge Admins To Patch Amid Ongoing Confluence Chaos,https://packetstormsecurity.com/news/view/35127/US-Cybercops-Urge-Admins-To-Patch-Amid-Ongoing-Confluence-Chaos.html,https://da.gd/Tj1r
