feed,title,long_url,short_url
SecurityWeek,"Microsoft Patch Tuesday: 97 Windows Vulns, 1 Exploited Zero-Day",https://www.securityweek.com/microsoft-patch-tuesday-97-windows-vulns-1-exploited-zero-day,https://da.gd/611H9
SecurityWeek,Intel Adds TDX to Confidential Computing Portfolio With Launch of 4th Gen Xeon Processors,https://www.securityweek.com/intel-adds-tdx-confidential-computing-portfolio-launch-4th-gen-xeon-processors,https://da.gd/ccO47N
SecurityWeek,"Adobe Plugs Security Holes in Acrobat, Reader Software",https://www.securityweek.com/adobe-plugs-security-holes-acrobat-reader-software,https://da.gd/72che
SecurityWeek,"Zoom Patches High Risk Flaws on Windows, MacOS Platforms",https://www.securityweek.com/zoom-patches-high-risk-flaws-windows-macos-platforms,https://da.gd/0mDHB
SecurityWeek,"2023 ICS Patch Tuesday Debuts With 12 Security Advisories From Siemens, Schneider",https://www.securityweek.com/2023-ics-patch-tuesday-debuts-12-security-advisories-siemens-schneider,https://da.gd/PkUTI
SecurityWeek,Vulnerability in Popular JsonWebToken Open Source Project Leads to Code Execution,https://www.securityweek.com/vulnerability-popular-jsonwebtoken-open-source-project-leads-code-execution,https://da.gd/hBiar7
SecurityWeek,GitHub Introduces Automatic Vulnerability Scanning Feature,https://www.securityweek.com/github-introduces-automatic-vulnerability-scanning-feature,https://da.gd/xmjnpi
SecurityWeek,PyPI Users Targeted With PoweRAT Malware,https://www.securityweek.com/pypi-users-targeted-powerat-malware,https://da.gd/JplO9s
SecurityWeek,Iowa's Largest City Cancels Classes Due to Cyber Attack,https://www.securityweek.com/iowas-largest-city-cancels-classes-due-cyber-attack,https://da.gd/nXS8
