feed,title,long_url,short_url
gNews,Shiba Inu Fans Disappointed with Netflix Update - Analytics Insight,https://www.analyticsinsight.net/shiba-inu-fans-disappointed-with-netflix-update/,https://bit.ly/3WzC9J2
gNews,C-Suite People of Enterprises are Emphasising Cybersecurity and Here is Proof - Analytics Insight,https://www.analyticsinsight.net/c-suite-people-of-enterprises-are-emphasising-cybersecurity-and-here-is-proof/,https://bit.ly/3TbA7f4
gNews,Top 10 Unexpected Applications of Quantum Computing in 2023 - Analytics Insight,https://www.analyticsinsight.net/top-10-unexpected-applications-of-quantum-computing-in-2023/,https://bit.ly/3WxBO9N
gNews,"Dogecoin (DOGE), Cardano (ADA), And The Hideaways (HDWY) For 2023 Investments. - Analytics Insight",https://www.analyticsinsight.net/dogecoin-doge-cardano-ada-and-the-hideaways-hdwy-for-2023-investments/,https://bit.ly/3hfdKbz
gNews,Solana (SOL) Rallies Past Cardano (ADA) This Weekend- What's Next? - Analytics Insight,https://www.analyticsinsight.net/solana-sol-rallies-past-cardano-ada-this-weekend-whats-next/,https://bit.ly/3FOUXOk
gNews,Bitgert Updates: The Latest Brise Updates As of 6th November 2022 - Analytics Insight,https://www.analyticsinsight.net/bitgert-updates-the-latest-brise-updates-as-of-6th-november-2022/,https://bit.ly/3WNbjxl
gNews,Giant AI language model with 1K global languages- Thanks to Google! - Analytics Insight,https://www.analyticsinsight.net/giant-ai-language-model-with-1k-global-languages-thanks-to-google/,https://bit.ly/3FN8xSm
gNews,Litecoin is Up by 50%! Can LTC Become the New Bitcoin in 2023? - Analytics Insight,https://www.analyticsinsight.net/litecoin-is-up-by-50-can-ltc-become-the-new-bitcoin-in-2023/,https://bit.ly/3WxlxSa
gNews,Top 10 Automation Testing Tools for Businesses to Adopt Immediately - Analytics Insight,https://www.analyticsinsight.net/top-10-automation-testing-tools-for-businesses-to-adopt-immediately/,https://bit.ly/3FOuQHh
gNews,Bitgert (BRISE): Crypto Analysts Rank Bitgert As The Most Rewarding Crypto Asset 2022 - Analytics Insight,https://www.analyticsinsight.net/bitgert-brise-crypto-analysts-rank-bitgert-as-the-most-rewarding-crypto-asset-2022/,https://bit.ly/3WxYl6m
gNews,Top 10 Data Science Companies Hiring During Recession - Analytics Insight,https://www.analyticsinsight.net/top-10-data-science-companies-hiring-during-recession/,https://bit.ly/3T8s4zY
