feed,title,long_url,short_url
LinuxSecurity,Oracle7: ELSA-2024-3304: libreoffice security fix Important (aarch64) Security Advisory Updates,https://linuxsecurity.com/advisories/oracle/oracle7-elsa-2024-3304-libreoffice-security-fix-important-aarch64-security-advisory-updates-gp7ytarmwavx,https://da.gd/WFWN
LinuxSecurity,Oracle7: ELSA-2024-3304: libreoffice security fix Important Security Advisory Updates,https://linuxsecurity.com/advisories/oracle/oracle7-elsa-2024-3304-libreoffice-security-fix-important-security-advisory-updates-mcy6yyhi3gin,https://da.gd/jpqZgq
LinuxSecurity,Oracle9: ELSA-2024-3307: tomcat Important Security Advisory Updates,https://linuxsecurity.com/advisories/oracle/oracle9-elsa-2024-3307-tomcat-important-security-advisory-updates-05cttgejuqrv,https://da.gd/1DaHk
LinuxSecurity,Oracle9: ELSA-2024-3306: kernel Moderate Security Advisory Updates,https://linuxsecurity.com/advisories/oracle/oracle9-elsa-2024-3306-kernel-moderate-security-advisory-updates-ny7bwozgpu76,https://da.gd/N5p3Y
LinuxSecurity,Oracle9: ELSA-2024-2910: nodejs security Important Security Advisory Updates,https://linuxsecurity.com/advisories/oracle/oracle9-elsa-2024-2910-nodejs-security-important-security-advisory-updates-nlvfmmgdylri,https://da.gd/O6Bfn
