feed,title,long_url,short_url
PacketstormSecurity,Elon Musk To Cut Twitter Staff By 75% As Biden Worries Deal Threatens National Security,https://packetstormsecurity.com/news/view/33960/Elon-Musk-To-Cut-Twitter-Staff-By-75-As-Biden-Worries-Deal-Threatens-National-Security.html,https://bit.ly/3EZSXmb
PacketstormSecurity,"Oops, Web Trackers May Have Leaked 3 Million Patients' Info",https://packetstormsecurity.com/news/view/33959/Oops-Web-Trackers-May-Have-Leaked-3-Million-Patients-Info.html,https://bit.ly/3F4M3MA
PacketstormSecurity,Hacker Who Stole Ed Sheeran Songs Jailed,https://packetstormsecurity.com/news/view/33961/Hacker-Who-Stole-Ed-Sheeran-Songs-Jailed.html,https://bit.ly/3MR5Qke
PacketstormSecurity,UT Hacked Starlink's Signal So It Can Be Used As A GPS Alternative,https://packetstormsecurity.com/news/view/33962/UT-Hacked-Starlinks-Signal-So-It-Can-Be-Used-As-A-GPS-Alternative.html,https://bit.ly/3MUeNJD
PacketstormSecurity,How Vice Society Got Away With A Global Ransomware Spree,https://packetstormsecurity.com/news/view/33963/How-Vice-Society-Got-Away-With-A-Global-Ransomware-Spree.html,https://bit.ly/3VHs10t
