feed,title,long_url,short_url
PacketstormSecurity,Teen Who Tracked Elon Musk's Jet Turns His Attention To Russian Oligarchs,https://packetstormsecurity.com/news/view/33170/Teen-Who-Tracked-Elon-Musks-Jet-Turns-His-Attention-To-Russian-Oligarchs.html,https://bit.ly/3KjuDLz
PacketstormSecurity,Hackers Breach Russian Space Research Institute Website,https://packetstormsecurity.com/news/view/33168/Hackers-Breach-Russian-Space-Research-Institute-Website.html,https://bit.ly/3MvtQZQ
PacketstormSecurity,"Ukraine IT Army Targets Belarus Railway Network, Russian GPS",https://packetstormsecurity.com/news/view/33171/Ukraine-IT-Army-Targets-Belarus-Railway-Network-Russian-GPS.html,https://bit.ly/3499Iv0
PacketstormSecurity,"Details Of 120,000 Russian Soldiers Leaked By Ukrainian Media",https://packetstormsecurity.com/news/view/33172/Details-Of-120-000-Russian-Soldiers-Leaked-By-Ukrainian-Media.html,https://bit.ly/3tuV5e2
PacketstormSecurity,"TeaBot Trojan Haunts Google Play Store, Again",https://packetstormsecurity.com/news/view/33169/TeaBot-Trojan-Haunts-Google-Play-Store-Again.html,https://bit.ly/36Tf3aN
PacketstormSecurity,Ukraine Asks ICANN To Revoke Russian Domains And Shut Down DNS Root Servers,https://packetstormsecurity.com/news/view/33167/Ukraine-Asks-ICANN-To-Revoke-Russian-Domains-And-Shut-Down-DNS-Root-Servers.html,https://bit.ly/3sBZooW
PacketstormSecurity,Conti Ransomware Gang Dismantles Infrastructure Amid Ukraine Row,https://packetstormsecurity.com/news/view/33166/Conti-Ransomware-Gang-Dismantles-Infrastructure-Amid-Ukraine-Row.html,https://bit.ly/35LGVgq
PacketstormSecurity,Polkit pkexec Local Privilege Escalation,https://packetstormsecurity.com/files/166196/cve_2021_4034_pwnkit_lpe_pkexec.rb.txt,https://bit.ly/3vAfEbO
