feed,title,long_url,short_url
PacketstormSecurity,TSA Announces New Pipeline Security Order,https://packetstormsecurity.com/news/view/32484/TSA-Announces-New-Pipeline-Security-Order.html,https://j.mp/3rnIecq
PacketstormSecurity,Fortinet's Security Appliances Hit By Remote Code Exec Vuln,https://packetstormsecurity.com/news/view/32488/Fortinets-Security-Appliances-Hit-By-Remote-Code-Exec-Vuln.html,https://j.mp/3rpN7BG
PacketstormSecurity,Why Apple's Walled Garden Is No Match For Pegasus Spyware,https://packetstormsecurity.com/news/view/32485/Why-Apples-Walled-Garden-Is-No-Match-For-Pegasus-Spyware.html,https://j.mp/3wXgDzI
PacketstormSecurity,EU Plans To Make Bitcoin Transfers More Traceable,https://packetstormsecurity.com/news/view/32487/EU-Plans-To-Make-Bitcoin-Transfers-More-Traceable.html,https://j.mp/2V2HE7C
PacketstormSecurity,MacOS Being Picked Apart By $49 XLoader Data Stealer,https://packetstormsecurity.com/news/view/32486/MacOS-Being-Picked-Apart-By-49-XLoader-Data-Stealer.html,https://j.mp/2TuJv4W
