feed,title,long_url,short_url
PacketstormSecurity,Microsoft's May Patch Tuesday Updates Cause Windows AD Authentication Errors,https://packetstormsecurity.com/news/view/33449/Microsofts-May-Patch-Tuesday-Updates-Cause-Windows-AD-Authentication-Errors.html,https://bit.ly/3NlWk7X
PacketstormSecurity,San Francisco Police Use Driverless Cars For Surveillance,https://packetstormsecurity.com/news/view/33446/San-Francisco-Police-Use-Driverless-Cars-For-Surveillance.html,https://bit.ly/3Lwdizf
PacketstormSecurity,Twitter Turns Its Privacy Policy Into An Old School Video Game,https://packetstormsecurity.com/news/view/33448/Twitter-Turns-Its-Privacy-Policy-Into-An-Old-School-Video-Game.html,https://bit.ly/3LhvWur
PacketstormSecurity,Ex-eBay Exec Admits Cyberstalking Critics,https://packetstormsecurity.com/news/view/33447/Ex-eBay-Exec-Admits-Cyberstalking-Critics.html,https://bit.ly/3yzCVMC
PacketstormSecurity,Zyxel Remote Execution Bug Is Being Exploited,https://packetstormsecurity.com/news/view/33450/Zyxel-Remote-Execution-Bug-Is-Being-Exploited.html,https://bit.ly/3wgrbwJ
