feed,title,long_url,short_url
LinuxSecurity,Oracle8: ELSA-2023-0116: libtasn1 security Moderate Security Update,https://www.linuxsecurity.com/advisories/oracle/oracle8-elsa-2023-0116-libtasn1-security-moderate-security-update-pjy4rzpqv4tb?rss,https://da.gd/EC8Y
LinuxSecurity,Oracle8: ELSA-2023-0110: sqlite security Moderate Security Update,https://www.linuxsecurity.com/advisories/oracle/oracle8-elsa-2023-0110-sqlite-security-moderate-security-update-rsip3fgkym2w?rss,https://da.gd/Fvh9d
LinuxSecurity,"Oracle8: ELSA-2023-0079: .NET 6.0 security, bug fix, and enhancement Moderate Security Upd",https://www.linuxsecurity.com/advisories/oracle/oracle8-elsa-2023-0079-net-6-0-security-bug-fix-and-enhancement-moderate-security-upd-ww4jty6dhq54?rss,https://da.gd/kiMnOW
LinuxSecurity,Oracle8: ELSA-2023-12018: kernel-container Important Security Update,https://www.linuxsecurity.com/advisories/oracle/oracle8-elsa-2023-12018-kernel-container-important-security-update-xa9pje5u9p1l?rss,https://da.gd/mlu2h
LinuxSecurity,Oracle8: ELSA-2023-12017: kernel Important Security Update,https://www.linuxsecurity.com/advisories/oracle/oracle8-elsa-2023-12017-kernel-important-security-update-sqlyuzgdyled?rss,https://da.gd/aw2Pd
LinuxSecurity,"Oracle9: ELSA-2023-0077: .NET 6.0 security, bug fix, and enhancement Moderate Security Upd",https://www.linuxsecurity.com/advisories/oracle/oracle9-elsa-2023-0077-net-6-0-security-bug-fix-and-enhancement-moderate-security-upd-otargo0kdchs?rss,https://da.gd/pd6x
