feed,title,long_url,short_url
LinuxSecurity,Ubuntu 7007-1: Linux kernel Security Advisory Updates,https://linuxsecurity.com/advisories/ubuntu/ubuntu-7007-1-linux-kernel-security-advisory-updates-byc2g0gdifhl,https://da.gd/IN9r
LinuxSecurity,Oracle8: ELSA-2024-6569: 389-ds:1.4 Moderate Security Advisory Updates,https://linuxsecurity.com/advisories/oracle/oracle8-elsa-2024-6569-389-ds-1-4-moderate-security-advisory-updates-wkvkq81cc1oc,https://da.gd/U1pNex
LinuxSecurity,Oracle7: ELSA-2024-12612: kernel-container Important Security Advisory Updates,https://linuxsecurity.com/advisories/oracle/oracle7-elsa-2024-12612-kernel-container-important-security-advisory-updates-fpyu7mn559rn,https://da.gd/Bari3
LinuxSecurity,Oracle7: ELSA-2024-12610: kernel Important Security Advisory Updates,https://linuxsecurity.com/advisories/oracle/oracle7-elsa-2024-12610-kernel-important-security-advisory-updates-uzewus5uzcri,https://da.gd/jdXQL
LinuxSecurity,Oracle7: ELSA-2024-12611: kernel Important (aarch64) Security Advisory Updates,https://linuxsecurity.com/advisories/oracle/oracle7-elsa-2024-12611-kernel-important-aarch64-security-advisory-updates-jr0faywjsfos,https://da.gd/6LTz2
