feed,title,long_url,short_url
LinuxSecurity,openSUSE 15.4: avahi Moderate DNS Spoofing Fix SUSE-SU-2025:03331-1,https://linuxsecurity.com/advisories/opensuse/opensuse-2025-03331-1-moderate-avahi,https://da.gd/DFrz4
LinuxSecurity,SUSE: avahi Moderate DNS Spoofing Threat CVE-2024-52615 Advisory,https://linuxsecurity.com/advisories/suse/suse-2025-03331-1-moderate-avahi-dhtvcgkilf3h,https://da.gd/cA1Ow
LinuxSecurity,SUSE: avahi Moderate DNS Spoofing Risk CVE-2024-52615 2025:03332-1,https://linuxsecurity.com/advisories/suse/suse-2025-03332-1-moderate-avahi-5xlqpqxtulbe,https://da.gd/tasvk
LinuxSecurity,SUSE: avahi Moderate DNS Spoofing Risk CVE-2024-52615 Advisory 2025:03333-1,https://linuxsecurity.com/advisories/suse/suse-2025-03333-1-moderate-avahi-96rwkggdemag,https://da.gd/WDlab
LinuxSecurity,openSUSE: Avahi Moderate DNS Spoofing Threat CVE-2024-52615 2025:03333-1,https://linuxsecurity.com/advisories/opensuse/opensuse-2025-03333-1-moderate-avahi,https://da.gd/KHux5
LinuxSecurity,SUSE:Linux Kernel RT Important Advisory CVE-2024-49860 2025:03315-1,https://linuxsecurity.com/advisories/suse/suse-2025-03315-1-important-kernel-rt-6wkreri99szo,https://da.gd/wN4Fx
