feed,title,long_url,short_url
LinuxSecurity,SUSE: Tomcat Important Security Update DoS Fixes 2025:03024-1,https://linuxsecurity.com/advisories/suse/suse-2025-03024-1-important-tomcat-acggk23bymjm,https://da.gd/vq1vAV
LinuxSecurity,openSUSE: Tomcat Important DoS Issues CVE-2025-48989 2025:03024-1,https://linuxsecurity.com/advisories/opensuse/opensuse-2025-03024-1-important-tomcat-cimrdxxuycb4,https://da.gd/BXjyWZ
LinuxSecurity,SUSE Releases Advisory for Moderate SMTP Injection Fix CVE-2025-7962,https://linuxsecurity.com/advisories/suse/suse-2025-03025-1-moderate-javamail-dlm74qknp9s1,https://da.gd/02EsG
LinuxSecurity,openSUSE: javamail Moderate SMTP Injection Fix SUSE-SU-2025:03025-1,https://linuxsecurity.com/advisories/opensuse/opensuse-2025-03025-1-moderate-javamail-qfuizx2awfem,https://da.gd/s2CYD
LinuxSecurity,SUSE: libsoup Low Data Access Security Fix CVE-2025-4945 2025:03026-1,https://linuxsecurity.com/advisories/suse/suse-2025-03026-1-low-libsoup-gedkazx9mguj,https://da.gd/9O3sca
LinuxSecurity,SUSE: python-future Important Code Execution Vuln CVE-2025-50817,https://linuxsecurity.com/advisories/suse/suse-2025-03028-1-important-python-future-oaggm3wo6ya2,https://da.gd/2yIZ
