feed,title,long_url,short_url
gNews,$18m funding boost for Aim Security to enhance GenAI enterprise security - FinTech Global,https://news.google.com/rss/articles/CBMiamh0dHBzOi8vZmludGVjaC5nbG9iYWwvMjAyNC8wNi8xNy8xOG0tZnVuZGluZy1ib29zdC1mb3ItYWltLXNlY3VyaXR5LXRvLWVuaGFuY2UtZ2VuYWktZW50ZXJwcmlzZS1zZWN1cml0eS_SAQA?oc=5,https://da.gd/T9qb5J
gNews,Hewlett Packard Enterprise and CrowdStrike Announce Partnership - CrowdStrike,https://news.google.com/rss/articles/CBMibmh0dHBzOi8vd3d3LmNyb3dkc3RyaWtlLmNvbS9wcmVzcy1yZWxlYXNlcy9oZXdsZXR0LXBhY2thcmQtZW50ZXJwcmlzZS1hbmQtY3Jvd2RzdHJpa2UtdG8tc2VjdXJlLWFpLWlubm92YXRpb24v0gEA?oc=5,https://da.gd/gvydk
gNews,Ontario government introduces new bill for strengthening cybersecurity and for responsible AI - Norton Rose Fulbright,https://news.google.com/rss/articles/CBMiqAFodHRwczovL3d3dy5ub3J0b25yb3NlZnVsYnJpZ2h0LmNvbS9lbi1ici9rbm93bGVkZ2UvcHVibGljYXRpb25zLzc3Y2I3YTkwL29udGFyaW8tZ292ZXJubWVudC1pbnRyb2R1Y2VzLW5ldy1iaWxsLWZvci1zdHJlbmd0aGVuaW5nLWN5YmVyLXNlY3VyaXR5LWFuZC1mb3ItcmVzcG9uc2libGUtYWnSAQA?oc=5,https://da.gd/G8Ov
gNews,Maryland launches web accessibility training program - StateScoop,https://news.google.com/rss/articles/CBMiTGh0dHBzOi8vc3RhdGVzY29vcC5jb20vbWFyeWxhbmQtbGF1bmNoZXMtd2ViLWFjY2Vzc2liaWxpdHktdHJhaW5pbmctcHJvZ3JhbS_SAQA?oc=5,https://da.gd/MQZuG
gNews,Harnessing Renewable Energy: The Transformative Role of AI and Cybersecurity in the Global South - Tech | Business | Economy - TechEconomy,https://news.google.com/rss/articles/CBMid2h0dHBzOi8vdGVjaGVjb25vbXkubmcvaGFybmVzc2luZy1yZW5ld2FibGUtZW5lcmd5LXRoZS10cmFuc2Zvcm1hdGl2ZS1yb2xlLW9mLWFpLWFuZC1jeWJlcnNlY3VyaXR5LWluLXRoZS1nbG9iYWwtc291dGgv0gEA?oc=5,https://da.gd/KgsSW
