feed,title,long_url,short_url
PacketstormSecurity,Microsoft Compares Russian Hacks Of Ukraine To Assassination That Started World War I,https://packetstormsecurity.com/news/view/33574/Microsoft-Compares-Russian-Hacks-Of-Ukraine-To-Assassination-That-Started-World-War-I.html,https://bit.ly/3u1TygJ
PacketstormSecurity,"Google Warns Spyware Being Deployed Against Android, iOS",https://packetstormsecurity.com/news/view/33575/Google-Warns-Spyware-Being-Deployed-Against-Android-iOS.html,https://bit.ly/39QNLUs
PacketstormSecurity,NSO Claims More Than 5 EU States Use Pegasus Spyware,https://packetstormsecurity.com/news/view/33577/NSO-Claims-More-Than-5-EU-States-Use-Pegasus-Spyware.html,https://bit.ly/3NkOKdp
PacketstormSecurity,Beijing-Backed Attackers Use Ransomware As Decoy While They Conduct Espionage,https://packetstormsecurity.com/news/view/33576/Beijing-Backed-Attackers-Use-Ransomware-As-Decoy-While-They-Conduct-Espionage.html,https://bit.ly/3bqOxIh
PacketstormSecurity,Backdoor.Win32.InfecDoor.17.c MVID-2022-0614 Insecure Permissions,https://packetstormsecurity.com/files/167583/MVID-2022-0614.txt,https://bit.ly/3u0jk5f
PacketstormSecurity,Trojan-Mailfinder.Win32.VB.p MVID-2022-0616 Insecure Permissions,https://packetstormsecurity.com/files/167582/MVID-2022-0616.txt,https://bit.ly/3bfmzyW
PacketstormSecurity,Backdoor.Win32.Shark.btu MVID-2022-0615 Insecure Permissions,https://packetstormsecurity.com/files/167581/MVID-2022-0615.txt,https://bit.ly/3OIVFy5
PacketstormSecurity,Yashma Ransomware Builder 1.2 MVID-2022-0613 Insecure Permissions,https://packetstormsecurity.com/files/167580/MVID-2022-0613.txt,https://bit.ly/3OFP3Ai
