feed,title,long_url,short_url
LinuxSecurity,Mageia 9: libtiff Important Memory Corruption MGASA-2025-0252,https://linuxsecurity.com/advisories/mageia/mageia-2025-0252-libtiff-fysjhmoylscs,https://da.gd/nM3F
LinuxSecurity,SUSE: Squid Important Auth Issue Advisory 2025:3902-1 for CVE-2025-62168,https://linuxsecurity.com/advisories/suse/suse-2025-3902-1-for-squid-wzs9s0vto1hb,https://da.gd/zuOct
LinuxSecurity,Important Proxy Authentication Issue in openSUSE Leap 15.4 Advisory,https://linuxsecurity.com/advisories/opensuse/opensuse-2025-3902-1-squid-nlj1dolod68p,https://da.gd/6Bi2W
LinuxSecurity,SUSE: Critical Cache Vulnerability & Spoofing Security Patch 2025:3904-2,https://linuxsecurity.com/advisories/suse/suse-2025-3903-1-for-bind-8ny2pqt7iaub,https://da.gd/xzof
LinuxSecurity,Ubuntu 22.04: USN-7835-4 Critical Linux Kernel Issues Fixed,https://linuxsecurity.com/advisories/ubuntu/ubuntu-7835-4-linux-kernel-hwe-1xcwrvxyoprh,https://da.gd/apDRJv
LinuxSecurity,Oracle9: ELSA-2025-19345: redis Severity Important Security Update,https://linuxsecurity.com/advisories/oracle/oracle9-elsa-2025-19345-redis-7-important-raiygrqblvhm,https://da.gd/CDNPe
