feed,title,long_url,short_url
PacketstormSecurity,Google Sued In US Over Deceptive Location Tracking,https://packetstormsecurity.com/news/view/33032/Google-Sued-In-US-Over-Deceptive-Location-Tracking.html,https://bit.ly/3nYAA7F
PacketstormSecurity,Linux Servers At Risk Of RCE Due To Critical CWP Bugs,https://packetstormsecurity.com/news/view/33036/Linux-Servers-At-Risk-Of-RCE-Due-To-Critical-CWP-Bugs.html,https://bit.ly/3KId0WE
PacketstormSecurity,BRATA Android Trojan Updated With Kill Switch That Wipes Devices,https://packetstormsecurity.com/news/view/33035/BRATA-Android-Trojan-Updated-With-Kill-Switch-That-Wipes-Devices.html,https://bit.ly/3u6CO8O
PacketstormSecurity,"Russia Makes More Arrests, But Cybercrime Harboring Reputation Hard To Shake",https://packetstormsecurity.com/news/view/33033/Russia-Makes-More-Arrests-But-Cybercrime-Harboring-Reputation-Hard-To-Shake.html,https://bit.ly/3KAUwqW
PacketstormSecurity,Hacktivists Say They Hacked Belarus Rail System To Stop Russian Military Buildup,https://packetstormsecurity.com/news/view/33034/Hacktivists-Say-They-Hacked-Belarus-Rail-System-To-Stop-Russian-Military-Buildup.html,https://bit.ly/3FTHLnW
