feed,title,long_url,short_url
gNews,"Thales, Google Cloud to Develop Generative AI Security Capabilities - MSSP Alert",https://news.google.com/rss/articles/CBMihAFodHRwczovL3d3dy5tc3NwYWxlcnQuY29tL2N5YmVyc2VjdXJpdHktc2VydmljZXMtYW5kLXByb2R1Y3RzL2FpL3RoYWxlcy1nb29nbGUtY2xvdWQtdG8tZGV2ZWxvcC1nZW5lcmF0aXZlLWFpLXNlY3VyaXR5LWNhcGFiaWxpdGllcy_SAQA?oc=5,https://da.gd/h2fQk
gNews,Plurilock expands Early Access Program for AI PromptGuard as it welcomes first cohort of certified partners - Proactive Investors USA,https://news.google.com/rss/articles/CBMisgFodHRwczovL3d3dy5wcm9hY3RpdmVpbnZlc3RvcnMuY29tL2NvbXBhbmllcy9uZXdzLzEwMjI5MjUvcGx1cmlsb2NrLWV4cGFuZHMtZWFybHktYWNjZXNzLXByb2dyYW0tZm9yLWFpLXByb21wdGd1YXJkLWFzLWl0LXdlbGNvbWVzLWZpcnN0LWNvaG9ydC1vZi1jZXJ0aWZpZWQtcGFydG5lcnMtMTAyMjkyNS5odG1s0gEA?oc=5,https://da.gd/hSsmPX
gNews,Vectra AI launches groundbreaking platform for hybrid attack defense - Tahawul Tech,https://news.google.com/rss/articles/CBMiZmh0dHBzOi8vd3d3LnRhaGF3dWx0ZWNoLmNvbS9uZXdzL3ZlY3RyYS1haS1sYXVuY2hlcy1ncm91bmRicmVha2luZy1wbGF0Zm9ybS1mb3ItaHlicmlkLWF0dGFjay1kZWZlbnNlL9IBAA?oc=5,https://da.gd/vg3h4f
gNews,Creating an Intelligent Win-Win Future - Inaugural Smart+ Tech Ecosystem Summit Debuts This Summer! - PR Newswire APAC - PR Newswire Asia,https://news.google.com/rss/articles/CBMikgFodHRwczovL2VuLnBybmFzaWEuY29tL3JlbGVhc2VzL2FwYWMvY3JlYXRpbmctYW4taW50ZWxsaWdlbnQtd2luLXdpbi1mdXR1cmUtaW5hdWd1cmFsLXNtYXJ0LXRlY2gtZWNvc3lzdGVtLXN1bW1pdC1kZWJ1dHMtdGhpcy1zdW1tZXItLTQxNDA1My5zaHRtbNIBAA?oc=5,https://da.gd/5XVucY
gNews,NetGuard Cybersecurity Dome Demo was released; Nokia x Microsoft partnership is using AI to provide a quick threat detection - MSPoweruser,https://news.google.com/rss/articles/CBMiNGh0dHBzOi8vbXNwb3dlcnVzZXIuY29tL25ldGd1YXJkLWN5YmVyc2VjdXJpdHktZG9tZS_SAQA?oc=5,https://da.gd/wCZw
gNews,Gandhinagar University Launches 1st AI Blockchain Cyber Lab - Crypto Times,https://news.google.com/rss/articles/CBMiV2h0dHBzOi8vd3d3LmNyeXB0b3RpbWVzLmlvL2dhbmRoaW5hZ2FyLXVuaXZlcnNpdHktbGF1bmNoZXMtMXN0LWFpLWJsb2NrY2hhaW4tY3liZXItbGFiL9IBAA?oc=5,https://da.gd/T0as6Y
