feed,title,long_url,short_url
PacketstormSecurity,"Disabling Cyberattacks Are Hitting Critical US Water Systems, White House Warns",https://packetstormsecurity.com/news/view/35674/Disabling-Cyberattacks-Are-Hitting-Critical-US-Water-Systems-White-House-Warns.html,https://da.gd/IJjF
PacketstormSecurity,Five Eyes Agencies Issue New Alert On Chinese APT Volt Typhoon,https://packetstormsecurity.com/news/view/35676/Five-Eyes-Agencies-Issue-New-Alert-On-Chinese-APT-Volt-Typhoon.html,https://da.gd/IXIi
PacketstormSecurity,"Chrome 123, Firefox 124 Patch Serious Vulnerabilities",https://packetstormsecurity.com/news/view/35677/Chrome-123-Firefox-124-Patch-Serious-Vulnerabilities.html,https://da.gd/L4Jwv
PacketstormSecurity,"300,000 Systems Vulnerable To New Loop DoS Attack",https://packetstormsecurity.com/news/view/35675/300-000-Systems-Vulnerable-To-New-Loop-DoS-Attack.html,https://da.gd/tCKKbd
PacketstormSecurity,Google Firebase May Have Exposed 125M Records From Misconfigurations,https://packetstormsecurity.com/news/view/35680/Google-Firebase-May-Have-Exposed-125M-Records-From-Misconfigurations.html,https://da.gd/RVDgw
PacketstormSecurity,Fraud Risk For Vans Customers After Data Breach,https://packetstormsecurity.com/news/view/35679/Fraud-Risk-For-Vans-Customers-After-Data-Breach.html,https://da.gd/94RbtD
PacketstormSecurity,"Stalkerware Usage Surging, Despite Data Privacy Concerns",https://packetstormsecurity.com/news/view/35678/Stalkerware-Usage-Surging-Despite-Data-Privacy-Concerns.html,https://da.gd/0Wrf1
