feed,title,long_url,short_url
PacketstormSecurity,MOVEit Customers Urged To Patch Third Critical Vulnerability,https://packetstormsecurity.com/news/view/34731/MOVEit-Customers-Urged-To-Patch-Third-Critical-Vulnerability.html,https://da.gd/yqkeL
PacketstormSecurity,Microsoft Admits DDoS As Cause Of Recent Cloud Outages,https://packetstormsecurity.com/news/view/34734/Microsoft-Admits-DDoS-As-Cause-Of-Recent-Cloud-Outages.html,https://da.gd/pmd072
PacketstormSecurity,Abandoned S3 Bucket Used To Launch Malicious Payloads,https://packetstormsecurity.com/news/view/34733/Abandoned-S3-Bucket-Used-To-Launch-Malicious-Payloads.html,https://da.gd/Wp4v
PacketstormSecurity,Bill Allowing CISA To Assist Foreign Governments Passes Senate Committee,https://packetstormsecurity.com/news/view/34732/Bill-Allowing-CISA-To-Assist-Foreign-Governments-Passes-Senate-Committee.html,https://da.gd/ZTh4Tq
PacketstormSecurity,"The US Navy, NATO, And NASA Are Using A Shady Chinese Company's Encryption Chips",https://packetstormsecurity.com/news/view/34730/The-US-Navy-NATO-And-NASA-Are-Using-A-Shady-Chinese-Companys-Encryption-Chips.html,https://da.gd/ISLj
