feed,title,long_url,short_url
r/Securitynews,Latest cyber security strategies in ASEAN,https://redd.it/99bogv,
r/Securitynews,ETSI crypto-based access control standards land,https://redd.it/99b77b,
r/Securitynews,Physical Security for your Car,https://redd.it/99ayh9,
r/Securitynews,New Zealand to run national cyber security exercise,https://redd.it/999ed3,
r/Securitynews,Nova signs up to build cyber security capability,https://redd.it/999ed1,
r/Securitynews,"Russia's political meddling efforts go beyond midterms, experts say",https://redd.it/998ke5,
r/Securitynews,Superdrug: Hackers claim to have 20k online UK customer records,https://redd.it/9979uu,
r/Securitynews,"Banks, mobile money firms to file cyber security reports",https://redd.it/9979nl,
r/Securitynews,Security MadLibs: Your IOT electrical outlet can now pwn your smart TV,https://redd.it/996svz,
r/Securitynews,FBI probes computer hacks in Southern California House campaigns,https://redd.it/996sk5,
r/Securitynews,"Scioto Valley Local Schools improve computer technology, continue security measures",https://redd.it/996d6t,
r/Securitynews,Use Debian? Want Intel's latest CPU patch? Small print sparks big problem,https://redd.it/996bxn,
r/Securitynews,"Russian hacking attempts are widening in scope, Microsoft warns",https://redd.it/994ua8,
r/Securitynews,The Global Maritime Industry Remains Unprepared for Future Cybersecurity Challenges,https://redd.it/994rd4,
r/Securitynews,Microsoft: We busted Russian Fancy Bear disinfo websites,https://redd.it/993whp,
r/Securitynews,Software products aren't cookies,https://redd.it/993k6o,
r/Securitynews,FBI investigates computer hacks in two California House campaigns,https://redd.it/992jh2,
r/Securitynews,Microsoft announces free election cyber defence tools,https://redd.it/992iba,
r/Securitynews,TLS developers should ditch 'pseudo constant time' crypto processing,https://redd.it/991zjx,
r/Securitynews,Youngsters learn about cyber security to encourage career in IT,https://redd.it/991vde,
r/Securitynews,Sectra's Medical IT Operation Receives National Computer Security Certification in the UK,https://redd.it/991puf,
r/Securitynews,Connected car data handover headache: There's no quick fix... and it's NOT just Land Rovers,https://redd.it/991p57,
r/Securitynews,That's the way the cookies crumble: Consent banners up 16% since GDPR,https://redd.it/991gzy,
r/Securitynews,Perception Virtual Launch Unlocks Military-Grade Network Security to More Businesses,https://redd.it/9918y3,
r/Securitynews,MP warns of cyber threat to Australian elections,https://redd.it/99176m,
