feed,title,long_url,short_url
PacketstormSecurity,Bankman-Fried Set To Enter Not Guilty Plea In FTX Fraud Case,https://packetstormsecurity.com/news/view/34181/Bankman-Fried-Set-To-Enter-Not-Guilty-Plea-In-FTX-Fraud-Case.html,https://da.gd/LWYOV
PacketstormSecurity,SQLMAP - Automatic SQL Injection Tool 1.7,https://packetstormsecurity.com/files/170365/sqlmap-1.7.tar.gz,https://da.gd/HOhl4c
PacketstormSecurity,Oracle DBMS_REDACT Dynamic Data Masking Bypass,https://packetstormsecurity.com/files/170363/oracledbmsredact-bypass.txt,https://da.gd/NSahN
PacketstormSecurity,Linux PT_SUSPEND_SECCOMP Permission Bypass / Ptracer Death Race,https://packetstormsecurity.com/files/170362/GS20230103153417.tgz,https://da.gd/yqCJP
PacketstormSecurity,ModSecurity Backdoor Tool,https://packetstormsecurity.com/files/170361/modsecurity-backdoor-master.zip,https://da.gd/6dgKF
