feed,title,long_url,short_url
gNews,"A Pentagon official said he resigned because US cybersecurity is no match for China, calling it 'kindergarten level' - Yahoo News",https://www.yahoo.com/entertainment/pentagon-official-said-resigned-because-093911720.html,https://yhoo.it/3BIpE2M
gNews,Check Out Essential Features For An EDR Cybersecurity Platform - Techiexpert.com - TechiExpert,https://www.techiexpert.com/check-out-essential-features-for-an-edr-cybersecurity-platform/,https://j.mp/3Bvuf8D
gNews,Hillstone Networks Provides Cybersecurity Solutions Using Artificial Intelligence: Interview With Co-founder and CTO Timothy Liu. - TechBullion,https://techbullion.com/hillstone-networks-provides-cybersecurity-solutions-using-artificial-intelligence-interview-with-co-founder-and-cto-timothy-liu/,https://j.mp/3iS1PhH
gNews,"Emirates News Agency – Ahead of UAE embracing ‘AI government,’ cyber-pandemic quickened digital t... - Toys Matrix",https://toysmatrix.com/emirates-news-agency-ahead-of-uae-embracing-ai-government-cyber-pandemic-quickened-digital-transformation-cybersecurity-chief/,https://j.mp/3ApJZIY
gNews,LG acquiring Israeli vehicle cybersecurity startup Cybellum for at least $140 million | Ctech - CTech,"https://www.calcalistech.com/ctech/articles/0,7340,L-3918269,00.html",https://j.mp/3oSchcL
