feed,title,long_url,short_url
PacketstormSecurity,"Kentucky Hospital Reports Network Outage, Care Delays Amid Cyberattack",https://packetstormsecurity.com/news/view/33045/Kentucky-Hospital-Reports-Network-Outage-Care-Delays-Amid-Cyberattack.html,https://bit.ly/3g94rWB
PacketstormSecurity,DeepDotWeb Operator Sentenced To Eight Years Behind Bars,https://packetstormsecurity.com/news/view/33047/DeepDotWeb-Operator-Sentenced-To-Eight-Years-Behind-Bars.html,https://bit.ly/3u5KvMS
PacketstormSecurity,Let's Encrypt To Revoke About 2 Million HTTPS Certificates In Two Days,https://packetstormsecurity.com/news/view/33048/Lets-Encrypt-To-Revoke-About-2-Million-HTTPS-Certificates-In-Two-Days.html,https://bit.ly/3IH1CIH
PacketstormSecurity,Indonesia Bars Financial Institutions From Offering Crypto Services,https://packetstormsecurity.com/news/view/33049/Indonesia-Bars-Financial-Institutions-From-Offering-Crypto-Services.html,https://bit.ly/3r7Op5Y
PacketstormSecurity,"Apple Fixes 2 Zero-Day Security Bugs, One Exploited In the Wild",https://packetstormsecurity.com/news/view/33046/Apple-Fixes-2-Zero-Day-Security-Bugs-One-Exploited-In-the-Wild.html,https://bit.ly/3AAsDL0
