feed,title,long_url,short_url
LinuxSecurity,Gentoo: Roundcube High Multiple Issues Exec Risk GLSA-202507-10,https://linuxsecurity.com/advisories/gentoo/gentoo-glsa-202507-10-roundcube-4yvp6omdbybc,https://da.gd/Ate28
LinuxSecurity,SUSE: Python Moderate DoS Risk CVE-2025-6069 Advisory 2025:02460-1,https://linuxsecurity.com/advisories/suse/suse-2025-02460-1-moderate-python-q8kiz2kjyxmu,https://da.gd/it0YNY
LinuxSecurity,openSUSE Leap 15.6: Python Moderate DoS Threat CVE-2025-6069,https://linuxsecurity.com/advisories/opensuse/opensuse-2025-02460-1-moderate-python-euq2tt4krfty,https://da.gd/JVOk
LinuxSecurity,SUSE: Linux Kernel Important Patch for CVE-2024-56558 Advisory 2025:02456-1,https://linuxsecurity.com/advisories/suse/suse-2025-02456-1-important-the-linux-kernel-aywck3unpzsk,https://da.gd/QanDzA
LinuxSecurity,openSUSE: Kernel Important nfsd Fix CVE-2024-56558 SUSE-SU-2025:02456-1,https://linuxsecurity.com/advisories/opensuse/opensuse-2025-02456-1-important-the-linux-kernel-kxofmu5uaohs,https://da.gd/vmsT
LinuxSecurity,openSUSE Leap 15.5: Linux Kernel Important Security Update CVE-2024-53146,https://linuxsecurity.com/advisories/opensuse/opensuse-2025-02459-1-important-the-linux-kernel-jtdualcmld9g,https://da.gd/TfPwd
