feed,title,long_url,short_url
PacketstormSecurity,Feds Allege Destructive Russian Hackers Targeted US Oil Refineries,https://packetstormsecurity.com/news/view/33261/Feds-Allege-Destructive-Russian-Hackers-Targeted-US-Oil-Refineries.html,https://bit.ly/3JU3wXG
PacketstormSecurity,Sophos Patches Critical Remote Code Execution Vulnerability In Firewall,https://packetstormsecurity.com/news/view/33262/Sophos-Patches-Critical-Remote-Code-Execution-Vulnerability-In-Firewall.html,https://bit.ly/36ASVlR
PacketstormSecurity,FCC Puts Kaspersky On Security Threat List,https://packetstormsecurity.com/news/view/33263/FCC-Puts-Kaspersky-On-Security-Threat-List.html,https://bit.ly/36ERsLc
PacketstormSecurity,Hundreds More Packages Found In Malicious npm Factory,https://packetstormsecurity.com/news/view/33264/Hundreds-More-Packages-Found-In-Malicious-npm-Factory.html,https://bit.ly/3Lmysjr
PacketstormSecurity,Morgan Stanley Wealth Management Accounts Breached In Vishing Attack,https://packetstormsecurity.com/news/view/33265/Morgan-Stanley-Wealth-Management-Accounts-Breached-In-Vishing-Attack.html,https://bit.ly/3tIPRwQ
