feed,title,long_url,short_url
gNews,Why the Cybersecurity Growth Slowdown Could Boost Microsoft Sales - The Information,https://news.google.com/rss/articles/CBMiaWh0dHBzOi8vd3d3LnRoZWluZm9ybWF0aW9uLmNvbS9hcnRpY2xlcy93aHktdGhlLWN5YmVyc2VjdXJpdHktZ3Jvd3RoLXNsb3dkb3duLWNvdWxkLWJvb3N0LW1pY3Jvc29mdC1zYWxlc9IBAA?oc=5,https://da.gd/rB1n8
gNews,Mitch Herckis on federal agencies' journey towards agile cybersecurity - CyberScoop,https://news.google.com/rss/articles/CBMiY2h0dHBzOi8vY3liZXJzY29vcC5jb20vdmlkZW8vbWl0Y2gtaGVyY2tpcy1vbi1mZWRlcmFsLWFnZW5jaWVzLWpvdXJuZXktdG93YXJkcy1hZ2lsZS1jeWJlcnNlY3VyaXR5L9IBAA?oc=5,https://da.gd/3ZCxsP
gNews,Optum's Change Healthcare responding to 'cybersecurity issue' - FierceHealthcare,https://news.google.com/rss/articles/CBMiX2h0dHBzOi8vd3d3LmZpZXJjZWhlYWx0aGNhcmUuY29tL3BheWVycy9vcHR1bXMtY2hhbmdlLWhlYWx0aGNhcmUtcmVzcG9uZGluZy1jeWJlcnNlY3VyaXR5LWlzc3Vl0gEA?oc=5,https://da.gd/KdbVs
gNews,Biden to sign executive order to give Coast Guard added authority over maritime cyber threats - StateScoop,https://news.google.com/rss/articles/CBMidWh0dHBzOi8vc3RhdGVzY29vcC5jb20vYmlkZW4tdG8tc2lnbi1leGVjdXRpdmUtb3JkZXItdG8tZ2l2ZS1jb2FzdC1ndWFyZC1hZGRlZC1hdXRob3JpdHktb3Zlci1tYXJpdGltZS1jeWJlci10aHJlYXRzL9IBAA?oc=5,https://da.gd/Xehr1T
gNews,At Munich's Cybersecurity Frontlines: DOJ's Fresh Battle Against Cyber Threats and AI Misuse - BNN Breaking,https://news.google.com/rss/articles/CBMihAFodHRwczovL2JubmJyZWFraW5nLmNvbS90ZWNoL2N5YmVyc2VjdXJpdHkvYXQtbXVuaWNocy1jeWJlcnNlY3VyaXR5LWZyb250bGluZXMtZG9qcy1mcmVzaC1iYXR0bGUtYWdhaW5zdC1jeWJlci10aHJlYXRzLWFuZC1haS1taXN1c2XSAYQBaHR0cHM6Ly9ibm5icmVha2luZy5jb20vdGVjaC9jeWJlcnNlY3VyaXR5L2F0LW11bmljaHMtY3liZXJzZWN1cml0eS1mcm9udGxpbmVzLWRvanMtZnJlc2gtYmF0dGxlLWFnYWluc3QtY3liZXItdGhyZWF0cy1hbmQtYWktbWlzdXNl?oc=5,https://da.gd/J4twq7
