feed,title,long_url,short_url
LinuxSecurity,openSUSE Tumbleweed: Input Module Control Security Advisory 2025:15433-1,https://linuxsecurity.com/advisories/opensuse/opensuse-2025-15433-1-moderate-framework-inputmodule-control-0-2-0-3-1-ih2kyroboo9i,https://da.gd/zr4EHS
LinuxSecurity,Ubuntu 25.04 MySQL Critical Update for Security Issues USN-7691-1,https://linuxsecurity.com/advisories/ubuntu/ubuntu-7691-1-mysql-2ynmzr5xx15d,https://da.gd/eEtKo
LinuxSecurity,SUSE: Icinga2 Important CVE-2025-48057 Impersonation Threat Advisory,https://linuxsecurity.com/advisories/suse/suse-2025-02783-1-important-icinga2-93j8jor4osgs,https://da.gd/TovAb3
LinuxSecurity,SUSE: apache-commons-lang3 Moderate DoS Fix 2025:02785-1 CVE-2025-48924,https://linuxsecurity.com/advisories/suse/suse-2025-02785-1-moderate-apache-commons-lang3-eyyo7ng177mv,https://da.gd/W6UfWV
LinuxSecurity,openSUSE: apache-commons-lang3 Moderate DoS Threat Advisory 2025:02785-1,https://linuxsecurity.com/advisories/opensuse/opensuse-2025-02785-1-moderate-apache-commons-lang3-ldum6m19oiai,https://da.gd/wFCoY
LinuxSecurity,SUSE: 2025:02786-1 Apache-commons-lang3 Moderate DoS Security Fix,https://linuxsecurity.com/advisories/suse/suse-2025-02786-1-moderate-apache-commons-lang3-cqzbjqyi5yy7,https://da.gd/mEOxg
