feed,title,long_url,short_url
LinuxSecurity,openSUSE Tumbleweed: go1.25 Moderate Threat Update 2026:10064-1,https://linuxsecurity.com/advisories/opensuse/go-opensuse-2026-10064-1-2025-61726,https://da.gd/lh24G
LinuxSecurity,openSUSE: harfbuzz-devel Moderate Update CVE-2026-22693 Advisory,https://linuxsecurity.com/advisories/opensuse/harfbuzz-devel-12-3-0-2026-22693,https://da.gd/F0Vh
LinuxSecurity,openSUSE Tumbleweed: Go Moderate Security Update 2026:10063-1,https://linuxsecurity.com/advisories/opensuse/go-opensuse-2026-10063-1-2025-61726,https://da.gd/OMHaP
LinuxSecurity,SUSE: Kernel Important Patch Advisory 2026:0149-1 CVE-2021-47557 DoS,https://linuxsecurity.com/advisories/suse/kernel-suse-2026-0149-1-2021-47557,https://da.gd/IGHpy
LinuxSecurity,"SUSE: libsoup Important Security Fix for CVE-2025-14523, CVE-2026-0719",https://linuxsecurity.com/advisories/suse/libsoup-suse-2026-0151-1-2025-14523,https://da.gd/xcvJXI
LinuxSecurity,SUSE: MozillaThunderbird Critical Security Update CVE-2025-14327,https://linuxsecurity.com/advisories/suse/mozilla-thunderbird-2026-0153-1-2025-14327,https://da.gd/8Qfm7l
