feed,title,long_url,short_url
SecurityWeek,Pakistani Threat Actors Caught Targeting Indian Gov Entities,https://www.securityweek.com/pakistani-threat-actors-caught-targeting-indian-gov-entities/,https://da.gd/pD7F2S
SecurityWeek,OpenAI Appoints Former NSA Director Paul Nakasone to Board of Directors,https://www.securityweek.com/openai-appoints-former-nsa-director-paul-nakasone-to-board-of-directors/,https://da.gd/voLpm
SecurityWeek,Edge Devices: The New Frontier for Mass Exploitation Attacks,https://www.securityweek.com/edge-devices-the-new-frontier-for-mass-exploitation-attacks/,https://da.gd/LH2uY
SecurityWeek,"Ascension Says Personal, Health Information Stolen in Ransomware Attack",https://www.securityweek.com/ascension-says-personal-health-information-stolen-in-ransomware-attack/,https://da.gd/InlkKo
SecurityWeek,"In Other News: Fuxnet ICS Malware, Google User Tracking, CISA Employee Scams",https://www.securityweek.com/in-other-news-fuxnet-ics-malware-google-user-tracking-cisa-employee-scams/,https://da.gd/7SCA
