feed,title,long_url,short_url
PacketstormSecurity,Massive Zero-Day Hole Found In Palo Alto Security Appliances,https://packetstormsecurity.com/news/view/32813/Massive-Zero-Day-Hole-Found-In-Palo-Alto-Security-Appliances.html,https://j.mp/2YFD5m6
PacketstormSecurity,"Critical Citrix DDoS Bug Shuts Down Network, Cloud App Access",https://packetstormsecurity.com/news/view/32812/Critical-Citrix-DDoS-Bug-Shuts-Down-Network-Cloud-App-Access.html,https://j.mp/3DaWhqW
PacketstormSecurity,USA Finally Signs Paris Call For Trust And Security In Cyberspace,https://packetstormsecurity.com/news/view/32814/USA-Finally-Signs-Paris-Call-For-Trust-And-Security-In-Cyberspace.html,https://j.mp/3C1UvGZ
PacketstormSecurity,Ransomware Attack Delays Comic Book Distributor Shipments,https://packetstormsecurity.com/news/view/32811/Ransomware-Attack-Delays-Comic-Book-Distributor-Shipments.html,https://j.mp/3c2HeDF
PacketstormSecurity,Tiny Font Size Fools Email Filters In BEC Phishing,https://packetstormsecurity.com/news/view/32815/Tiny-Font-Size-Fools-Email-Filters-In-BEC-Phishing.html,https://j.mp/3F83vMU
