feed,title,long_url,short_url
PacketstormSecurity,SCOTUS To Biden: Is NSO Group A Foreign Agent?,https://packetstormsecurity.com/news/view/33527/SCOTUS-To-Biden-Is-NSO-Group-A-Foreign-Agent.html,https://bit.ly/3mnLS4s
PacketstormSecurity,Microsoft Seizes 41 Domains Tied To Iranian Phishing Ring,https://packetstormsecurity.com/news/view/33528/Microsoft-Seizes-41-Domains-Tied-To-Iranian-Phishing-Ring.html,https://bit.ly/3zmOIOH
PacketstormSecurity,Attackers Use Public Exploits To Throttle Atlassian Confluence Flaw,https://packetstormsecurity.com/news/view/33530/Attackers-Use-Public-Exploits-To-Throttle-Atlassian-Confluence-Flaw.html,https://bit.ly/38X0KDH
PacketstormSecurity,Microsoft Won't Say If It Will Patch Critical Windows Vuln Under Exploit,https://packetstormsecurity.com/news/view/33529/Microsoft-Wont-Say-If-It-Will-Patch-Critical-Windows-Vuln-Under-Exploit.html,https://bit.ly/3ayy4Ba
PacketstormSecurity,Spanish Court Calls CEO Of Israel's NSO Group To Testify In Spying Case,https://packetstormsecurity.com/news/view/33532/Spanish-Court-Calls-CEO-Of-Israels-NSO-Group-To-Testify-In-Spying-Case.html,https://bit.ly/3aKKc2h
PacketstormSecurity,Follina Exploited By State-Sponsored Hackers,https://packetstormsecurity.com/news/view/33531/Follina-Exploited-By-State-Sponsored-Hackers.html,https://bit.ly/3zo2Ln8
