feed,title,long_url,short_url
PacketstormSecurity,Microsoft Takes Down Websites Used To Create 750 Million Fraudulent Accounts,https://packetstormsecurity.com/news/view/35308/Microsoft-Takes-Down-Websites-Used-To-Create-750-Million-Fraudulent-Accounts.html,https://da.gd/03MqT8
PacketstormSecurity,Recent Apache Struts 2 Vulnerability In Attacker Crosshairs,https://packetstormsecurity.com/news/view/35304/Recent-Apache-Struts-2-Vulnerability-In-Attacker-Crosshairs.html,https://da.gd/4BJVwA
PacketstormSecurity,Food Giant Kraft Heinz Targeted By Ransomware Group,https://packetstormsecurity.com/news/view/35305/Food-Giant-Kraft-Heinz-Targeted-By-Ransomware-Group.html,https://da.gd/8i0kAN
PacketstormSecurity,Russian Hackers Attack JetBrains TeamCity Servers,https://packetstormsecurity.com/news/view/35306/Russian-Hackers-Attack-JetBrains-TeamCity-Servers.html,https://da.gd/rWQH
PacketstormSecurity,"Suspects Can Refuse To Provide Phone Passcodes To Police, Court Rules",https://packetstormsecurity.com/news/view/35309/Suspects-Can-Refuse-To-Provide-Phone-Passcodes-To-Police-Court-Rules.html,https://da.gd/DQW3
PacketstormSecurity,"Information For 45,000 Stolen In Idaho National Laboratory Data Breach",https://packetstormsecurity.com/news/view/35307/Information-For-45-000-Stolen-In-Idaho-National-Laboratory-Data-Breach.html,https://da.gd/e2IlG
PacketstormSecurity,NKabuse Backdoor Harnesses Blockchain Brawn To Hit Several Architectures,https://packetstormsecurity.com/news/view/35303/NKabuse-Backdoor-Harnesses-Blockchain-Brawn-To-Hit-Several-Architectures.html,https://da.gd/30qNr
