feed,title,long_url,short_url
PacketstormSecurity,"Thanks, Dad: Jammer Used To Stop Kids Going Online, Wipes Out A Town's Internet By Mistake",https://packetstormsecurity.com/news/view/33121/Thanks-Dad-Jammer-Used-To-Stop-Kids-Going-Online-Wipes-Out-A-Towns-Internet-By-Mistake.html,https://bit.ly/3JE0W7y
PacketstormSecurity,Taiwan Cracks Down On China Spying On Tech Firms,https://packetstormsecurity.com/news/view/33122/Taiwan-Cracks-Down-On-China-Spying-On-Tech-Firms.html,https://bit.ly/3gXerCW
PacketstormSecurity,New RCE Flaw Added To Adobe Security Advisory,https://packetstormsecurity.com/news/view/33123/New-RCE-Flaw-Added-To-Adobe-Security-Advisory.html,https://bit.ly/3gVwwBd
PacketstormSecurity,VMware Horizon Servers Are Under Attack By Iranian State Hackers,https://packetstormsecurity.com/news/view/33124/VMware-Horizon-Servers-Are-Under-Attack-By-Iranian-State-Hackers.html,https://bit.ly/3s99Sfn
PacketstormSecurity,Severe WordPress Plug-In UpdraftPlus Bug Threatens Backups,https://packetstormsecurity.com/news/view/33126/Severe-WordPress-Plug-In-UpdraftPlus-Bug-Threatens-Backups.html,https://bit.ly/3rYdmkp
PacketstormSecurity,Baby Goland-Based Botnet Already Pulling In $3k/Month For Operators,https://packetstormsecurity.com/news/view/33125/Baby-Goland-Based-Botnet-Already-Pulling-In-3k-Month-For-Operators.html,https://bit.ly/3oZGGoP
