feed,title,long_url,short_url
gNews,AI attacks now 'the main cybersecurity concern' for businesses across sectors - Verdict,https://news.google.com/rss/articles/CBMib2h0dHBzOi8vd3d3LnZlcmRpY3QuY28udWsvZmVhdHVyZXMvYWktYXR0YWNrcy1ub3ctdGhlLW1haW4tY3liZXJzZWN1cml0eS1jb25jZXJuLWZvci1idXNpbmVzc2VzLWFjcm9zcy1zZWN0b3JzL9IBAA?oc=5,https://da.gd/F6A0kz
gNews,Cisco Study: 91 pc of UAE Companies use AI Technologies in cybersecurity - Edge Middle East,https://news.google.com/rss/articles/CBMib2h0dHBzOi8vd3d3LmVkZ2VtaWRkbGVlYXN0LmNvbS9zZWN1cml0eS9jaXNjby1zdHVkeS05MS1wYy1vZi11YWUtY29tcGFuaWVzLXVzZS1haS10ZWNobm9sb2dpZXMtaW4tY3liZXJzZWN1cml0edIBAA?oc=5,https://da.gd/9L4pJu
gNews,"Alabama company expands to Arizona, sees 'massive market' for cybersecurity - Phoenix Business Journal",https://news.google.com/rss/articles/CBMiZmh0dHBzOi8vd3d3LmJpempvdXJuYWxzLmNvbS9waG9lbml4L2lubm8vc3Rvcmllcy9uZXdzLzIwMjQvMDQvMjQvbWFycy1zdWl0ZS1waG9lbml4LWN5YmVyc2VjdXJpdHkuaHRtbNIBAA?oc=5,https://da.gd/Tin8Y
gNews,Tracer Fortifies Leadership Team as Demand for Brand Protection and Cybersecurity Measures Skyrockets - 01Net,https://news.google.com/rss/articles/CBMie2h0dHBzOi8vd3d3LjAxbmV0Lml0L3RyYWNlci1mb3J0aWZpZXMtbGVhZGVyc2hpcC10ZWFtLWFzLWRlbWFuZC1mb3ItYnJhbmQtcHJvdGVjdGlvbi1hbmQtY3liZXJzZWN1cml0eS1tZWFzdXJlcy1za3lyb2NrZXRzL9IBAA?oc=5,https://da.gd/upZZ9L
gNews,"AI: Experts Advocate Cybersecurity Literacy, Risk Mgt In Capital Market - New Telegraph Newspaper",https://news.google.com/rss/articles/CBMiYWh0dHBzOi8vbmV3dGVsZWdyYXBobmcuY29tL2FpLWV4cGVydHMtYWR2b2NhdGUtY3liZXJzZWN1cml0eS1saXRlcmFjeS1yaXNrLW1ndC1pbi1jYXBpdGFsLW1hcmtldC_SAQA?oc=5,https://da.gd/eNeN6
gNews,AI Platforms Name Cybersecurity Threats and Advice for 2024 - tripwire,https://news.google.com/rss/articles/CBMiYmh0dHBzOi8vd3d3LnRyaXB3aXJlLmNvbS9zdGF0ZS1vZi1zZWN1cml0eS9haS1wbGF0Zm9ybXMtbmFtZS1jeWJlcnNlY3VyaXR5LXRocmVhdHMtYW5kLWFkdmljZS0yMDI00gEA?oc=5,https://da.gd/gtXNw
