feed,title,long_url,short_url
CiscoSecurityAdvisory,Cisco Nexus 9000 Series Fabric Switches in ACI Mode Link Layer Discovery Protocol Memory Leak Denial of Service Vulnerability,https://sec.cloudapps.cisco.com/security/center/content/CiscoSecurityAdvisory/cisco-sa-aci-lldp-dos-ySCNZOpX?vs_f=Cisco%20Security%20Advisory&vs_cat=Security%20Intelligence&vs_type=RSS&vs_p=Cisco%20Nexus%209000%20Series%20Fabric%20Switches%20in%20ACI%20Mode%20Link%20Layer%20Discovery%20Protocol%20Memory%20Leak%20Denial%20of%20Service%20Vulnerability&vs_k=1,https://da.gd/fwWpTZ
CiscoSecurityAdvisory,Cisco FXOS Software and UCS Manager Software Configuration Backup Static Key Vulnerability,https://sec.cloudapps.cisco.com/security/center/content/CiscoSecurityAdvisory/cisco-sa-ucsm-bkpsky-H8FCQgsA?vs_f=Cisco%20Security%20Advisory&vs_cat=Security%20Intelligence&vs_type=RSS&vs_p=Cisco%20FXOS%20Software%20and%20UCS%20Manager%20Software%20Configuration%20Backup%20Static%20Key%20Vulnerability&vs_k=1,https://da.gd/nr2ZG8
CiscoSecurityAdvisory,Cisco NX-OS Software SSH X.509v3 Certificate Authentication with Unsupported Remote Authorization Method Privilege Escalation Issues,https://sec.cloudapps.cisco.com/security/center/content/CiscoSecurityAdvisory/cisco-sa-nxos-x509v3-unsupportedconfig-ScRtAbUk?vs_f=Cisco%20Security%20Advisory&vs_cat=Security%20Intelligence&vs_type=RSS&vs_p=Cisco%20NX-OS%20Software%20SSH%20X.509v3%20Certificate%20Authentication%20with%20Unsupported%20Remote%20Authorization%20Method%20Privilege%20Escalation%20Issues&vs_k=1,https://da.gd/jtmIS
CiscoSecurityAdvisory,Cisco NX-OS Software CLI Command Injection Vulnerability,https://sec.cloudapps.cisco.com/security/center/content/CiscoSecurityAdvisory/cisco-sa-nxos-cli-cmdinject-euQVK9u?vs_f=Cisco%20Security%20Advisory&vs_cat=Security%20Intelligence&vs_type=RSS&vs_p=Cisco%20NX-OS%20Software%20CLI%20Command%20Injection%20Vulnerability&vs_k=1,https://da.gd/ToJlw
CiscoSecurityAdvisory,"Cisco Firepower 4100 Series, Firepower 9300 Security Appliances, and UCS Fabric Interconnects Command Injection Vulnerability","https://sec.cloudapps.cisco.com/security/center/content/CiscoSecurityAdvisory/cisco-sa-nxfp-cmdinj-XXBZjtR?vs_f=Cisco%20Security%20Advisory&vs_cat=Security%20Intelligence&vs_type=RSS&vs_p=Cisco%20Firepower%204100%20Series,%20Firepower%209300%20Security%20Appliances,%20and%20UCS%20Fabric%20Interconnects%20Command%20Injection%20Vulnerability&vs_k=1",https://da.gd/Gsunq6
CiscoSecurityAdvisory,Cisco Nexus 9300-FX3 Series Fabric Extender for UCS Fabric Interconnects Authentication Bypass Vulnerability,https://sec.cloudapps.cisco.com/security/center/content/CiscoSecurityAdvisory/cisco-sa-elyfex-dos-gfvcByx?vs_f=Cisco%20Security%20Advisory&vs_cat=Security%20Intelligence&vs_type=RSS&vs_p=Cisco%20Nexus%209300-FX3%20Series%20Fabric%20Extender%20for%20UCS%20Fabric%20Interconnects%20Authentication%20Bypass%20Vulnerability&vs_k=1,https://da.gd/9MHqvT
CiscoSecurityAdvisory,Cisco Application Policy Infrastructure Controller and Cisco Cloud Network Controller Cross-Site Request Forgery Vulnerability,https://sec.cloudapps.cisco.com/security/center/content/CiscoSecurityAdvisory/cisco-sa-capic-csrfv-DMx6KSwV?vs_f=Cisco%20Security%20Advisory&vs_cat=Security%20Intelligence&vs_type=RSS&vs_p=Cisco%20Application%20Policy%20Infrastructure%20Controller%20and%20Cisco%20Cloud%20Network%20Controller%20Cross-Site%20Request%20Forgery%20Vulnerability&vs_k=1,https://da.gd/Op8PqK
