feed,title,long_url,short_url
PacketstormSecurity,"Hackers Stole Data Center Logins For Apple, Microsoft, And Many More",https://packetstormsecurity.com/news/view/34350/Hackers-Stole-Data-Center-Logins-For-Apple-Microsoft-And-Many-More.html,https://da.gd/rY1Bal
PacketstormSecurity,GoDaddy Blasted For Breach Response,https://packetstormsecurity.com/news/view/34351/GoDaddy-Blasted-For-Breach-Response.html,https://da.gd/RY9KaV
PacketstormSecurity,"Open Source Has Its Perks, But Supply Chain Risks Can't Be Ignored",https://packetstormsecurity.com/news/view/34352/Open-Source-Has-Its-Perks-But-Supply-Chain-Risks-Cant-Be-Ignored.html,https://da.gd/a4UXx
PacketstormSecurity,Zeek 5.0.7,https://packetstormsecurity.com/files/171097/zeek-5.0.7.tar.gz,https://da.gd/aOiwo
PacketstormSecurity,pyLoad js2py Python Execution,https://packetstormsecurity.com/files/171096/pyload_js2py_exec.rb.txt,https://da.gd/YYlzOd
PacketstormSecurity,Red Hat Security Advisory 2023-0774-01,https://packetstormsecurity.com/files/171094/RHSA-2023-0774-01.txt,https://da.gd/m3itt
PacketstormSecurity,Red Hat Security Advisory 2023-0833-01,https://packetstormsecurity.com/files/171092/RHSA-2023-0833-01.txt,https://da.gd/sxeRY
PacketstormSecurity,Red Hat Security Advisory 2023-0888-01,https://packetstormsecurity.com/files/171091/RHSA-2023-0888-01.txt,https://da.gd/72yPY
