feed,title,long_url,short_url
ArXiv:cs.CR,When Poison Fails After Retrieval: Revisiting Corpus Poisoning under Chunking and Reranking Pipelines,https://arxiv.org/abs/2606.11265,
ArXiv:cs.CR,MPC-Patch-Bench: Security-Aware LLM Code Patch for Multi-Party Computation,https://arxiv.org/abs/2606.11416,
ArXiv:cs.CR,JailbreakOPT: Tool-Assisted Iterative Jailbreak Prompt Optimization,https://arxiv.org/abs/2606.11425,
ArXiv:cs.CR,Evaluating and Combating the Impact of Concept Drift on the Performance of Machine Learning-Based Phishing Detection Systems,https://arxiv.org/abs/2606.11471,
ArXiv:cs.CR,Hiding the Trees in the Forest: Building Network Covert Channels with Hash-Based Covert Carrier Filtering,https://arxiv.org/abs/2606.11532,
ArXiv:cs.CR,VIPIR: A Versatile GPU Framework for Integrating Private Information Retrieval Protocols,https://arxiv.org/abs/2606.11536,
ArXiv:cs.CR,PriME-Deal: Privacy-Preserving Bilateral Data Trading with Efficient Matchmaking and Auditable Fair Exchange on Blockchain,https://arxiv.org/abs/2606.11539,
ArXiv:cs.CR,WHET: Welding Homomorphic Encryption to Accelerator Architectures,https://arxiv.org/abs/2606.11541,
ArXiv:cs.CR,Privacy-Preserving Federated Autoencoder for ECG Anomaly Detection on Edge Devices,https://arxiv.org/abs/2606.11556,
ArXiv:cs.CR,"A Deterministic Forensic Preprocessing Framework for Heterogeneous Network Datasets: Formal Foundations, Implementation, and Empirical Validation",https://arxiv.org/abs/2606.11565,
ArXiv:cs.CR,Defense Against Prompt Inversion Attacks: An Information-Theoretic Approach for LLM Collaborative Inference,https://arxiv.org/abs/2606.11592,
ArXiv:cs.CR,Sovereign Assurance Boundary: Certificate-Bound Admission for Agentic Infrastructure,https://arxiv.org/abs/2606.11632,
ArXiv:cs.CR,Dummy Backdoor as a Defense: Removing Unknown Backdoors via Shared Internal Mechanisms for Generative LLMs,https://arxiv.org/abs/2606.11648,
ArXiv:cs.CR,A Robust Framework for Sybil Attack Detection in Vehicular Ad Hoc Networks,https://arxiv.org/abs/2606.11667,
ArXiv:cs.CR,Runtime Skill Audit: Targeted Runtime Probing for Agent Skill Security,https://arxiv.org/abs/2606.11671,
ArXiv:cs.CR,Can Open-Source LLM Agents Replace Static Application Security Testing Tools? An Empirical Assessment,https://arxiv.org/abs/2606.11672,
ArXiv:cs.CR,T2S: A Rehearsal-Based Approach for Extraction-Resistant Model Watermarking,https://arxiv.org/abs/2606.11698,
ArXiv:cs.CR,A VPN-as-a-Service Tailored Enabler for Computing-constrained Environments,https://arxiv.org/abs/2606.11729,
ArXiv:cs.CR,MHOT: Height-Optimized Authenticated Data Structure for Blockchain State Commitment,https://arxiv.org/abs/2606.11736,
ArXiv:cs.CR,SwarmSense-DNN: A Trustworthy and Decentralized Neural Framework for Proactive Anomaly Defense in Consumer IoT,https://arxiv.org/abs/2606.11803,
ArXiv:cs.CR,Grammar-Constrained Decoding Can Jailbreak LLMs into Generating Malicious Code,https://arxiv.org/abs/2606.11817,
ArXiv:cs.CR,Jaguar: Fast Private CNN Inference with Power-of-Two Homomorphic Arithmetic,https://arxiv.org/abs/2606.11827,
ArXiv:cs.CR,Systematic Cybersecurity Risk Analysis of European Rail Traffic Management System,https://arxiv.org/abs/2606.11839,
ArXiv:cs.CR,WarpGuard: Protected-Site Control-Flow Integrity for CUDA SASS Binaries,https://arxiv.org/abs/2606.11871,
ArXiv:cs.CR,Gerrymandering the Warp: Non-Control-Data Attacks on CUDA Collective Decision,https://arxiv.org/abs/2606.11878,
ArXiv:cs.CR,"Quadratic APN Functions in Dimension 8 via Gr\""obner Basis Search in a Self-Equivalence Subspace",https://arxiv.org/abs/2606.11967,
ArXiv:cs.CR,InjectV: Modeling Fault Injection Attacks in RISC-V Simulation Environment,https://arxiv.org/abs/2606.12011,
ArXiv:cs.CR,Categorical Robustness Assessment for Machine Learning based Network Intrusion Detection Systems,https://arxiv.org/abs/2606.12075,
ArXiv:cs.CR,Bridging the Smart City Cybersecurity Data Gap Through AI-Driven Synthetic Dataset Generation,https://arxiv.org/abs/2606.12225,
ArXiv:cs.CR,"Partitioned Tags, Shared Data: Reconciling Strict Cache Isolation with Write-Shared Coherence",https://arxiv.org/abs/2606.12259,
ArXiv:cs.CR,Selection Integrity for LLM Graph Memory: An Accumulability Criterion for Information-Flow-Blind Retrieval,https://arxiv.org/abs/2606.12290,
ArXiv:cs.CR,OCELOT: Inference-Leakage Budgets for Privacy-Preserving LLM Agents,https://arxiv.org/abs/2606.12341,
ArXiv:cs.CR,ECYSAP EYE: From Cyber Situational Awareness to Mission-Centric Decision Support for Enhanced Cyberspace Operations,https://arxiv.org/abs/2606.12354,
ArXiv:cs.CR,MARCIM-WG: A cyber wargame proposal based on math modeling applied in a naval scenario,https://arxiv.org/abs/2606.12395,
ArXiv:cs.CR,Homomorphic Quantum Error Correction,https://arxiv.org/abs/2605.25692,
ArXiv:cs.CR,Hardware-Aware QAOA for Honeypot Traffic Partitioning on 100+ Qubit IBM Quantum Processors,https://arxiv.org/abs/2606.09469,
ArXiv:cs.CR,PoQ-Judge: A Multi-Architecture Evaluation Framework for Cost-Aware Proof-of-Quality in Decentralized LLM Inference,https://arxiv.org/abs/2606.11196,
ArXiv:cs.CR,A prior-free blind detection of information leakage from model predictions,https://arxiv.org/abs/2606.11267,
ArXiv:cs.CR,Risk Under Pressure: Compute-Aware Evaluation of Adversarial Robustness in Language Models,https://arxiv.org/abs/2606.11409,
ArXiv:cs.CR,On the Study of Biometric Spoofing Detection using Deep Learning,https://arxiv.org/abs/2606.11505,
ArXiv:cs.CR,Superspace Concentration and Adversarial Robustness in Quantum Algorithms,https://arxiv.org/abs/2606.11580,
ArXiv:cs.CR,Adv-TGD: Adversarial Text-Guided Diffusion for Face Recognition Impersonation Attacks,https://arxiv.org/abs/2606.11615,
ArXiv:cs.CR,"A Fast Gaussian Mechanism under Continual Observation, with Applications",https://arxiv.org/abs/2606.11760,
ArXiv:cs.CR,Toward Trustworthy AI: Multi-Target Adversarial Attacks and Robust Defenses for Continuous Data Summarization,https://arxiv.org/abs/2606.11804,
ArXiv:cs.CR,Feature-Aligned Speech Watermarking for Robustness to Reconstruction Distortions,https://arxiv.org/abs/2606.11828,
ArXiv:cs.CR,Image Quality Assessment of Identity Cards Using Measures from Open Face Image Quality,https://arxiv.org/abs/2606.11884,
ArXiv:cs.CR,Online Shift Detection and Conformal Adaptation for Deployed Safety Classifiers,https://arxiv.org/abs/2606.11949,
ArXiv:cs.CR,Undefined Behavior in C and C++: An Experiment With Desktop Use Cases,https://arxiv.org/abs/2606.12064,
ArXiv:cs.CR,Mind your key: An Empirical Study of LLM API Credential Leakage in iOS Apps,https://arxiv.org/abs/2606.12212,
ArXiv:cs.CR,Reinforcement Learning Disrupts Gradient-Based Adversarial Optimization,https://arxiv.org/abs/2606.12251,
ArXiv:cs.CR,A Five-Plane Reference Architecture for Runtime Governance of Production AI Agents,https://arxiv.org/abs/2606.12320,
ArXiv:cs.CR,LSTM based IoT Device Identification,https://arxiv.org/abs/2304.13905,
