feed,title,long_url,short_url
PacketstormSecurity,Rockwell Automation Urges Customers To Disconnect ICS From Internet,https://packetstormsecurity.com/news/view/35910/Rockwell-Automation-Urges-Customers-To-Disconnect-ICS-From-Internet.html,https://da.gd/tW5l3
PacketstormSecurity,Uncle Sam To Inject $50M Into Auto-Patcher For Hospital IT,https://packetstormsecurity.com/news/view/35914/Uncle-Sam-To-Inject-50M-Into-Auto-Patcher-For-Hospital-IT.html,https://da.gd/d2f4
PacketstormSecurity,GitHub Enterprise Server Patches 10-outta-10 Critical Hole,https://packetstormsecurity.com/news/view/35911/GitHub-Enterprise-Server-Patches-10-outta-10-Critical-Hole.html,https://da.gd/FCH9l
PacketstormSecurity,"Microsoft's AI Recall Feature Raises Security, Privacy Concerns",https://packetstormsecurity.com/news/view/35915/Microsofts-AI-Recall-Feature-Raises-Security-Privacy-Concerns.html,https://da.gd/wJetfT
PacketstormSecurity,Researchers Spot Cryptojacking Attack That Disables Endpoint Protections,https://packetstormsecurity.com/news/view/35916/Researchers-Spot-Cryptojacking-Attack-That-Disables-Endpoint-Protections.html,https://da.gd/8C7WQ
PacketstormSecurity,LockBit Dethroned As Ransomware Leader Since Takedown,https://packetstormsecurity.com/news/view/35913/LockBit-Dethroned-As-Ransomware-Leader-Since-Takedown.html,https://da.gd/qRXeBo
PacketstormSecurity,Congo Lawyers Say They Have New Evidence On Apple's Minerals Supply Chain,https://packetstormsecurity.com/news/view/35912/Congo-Lawyers-Say-They-Have-New-Evidence-On-Apples-Minerals-Supply-Chain.html,https://da.gd/9wtgDp
PacketstormSecurity,We May Know A Whole Lot More About UFOs Soon,https://packetstormsecurity.com/news/view/35909/We-May-Know-A-Whole-Lot-More-About-UFOs-Soon.html,https://da.gd/ZJWTK
