feed,title,long_url,short_url
PacketstormSecurity,Check Out This Great RCE PoC Walkthrough For The VMware ESXi OpenSLP Heap Overflow Vulnerability,https://packetstormsecurity.com/news/view/32346/Check-Out-This-Great-RCE-PoC-Walkthrough-For-The-VMware-ESXi-OpenSLP-Heap-Overflow-Vulnerability.html,https://j.mp/3pg0uDz
PacketstormSecurity,Microsoft RDP Remote Code Execution,https://packetstormsecurity.com/files/162960/microsoftrdp-exec.txt,https://j.mp/3phRU70
PacketstormSecurity,Exim base64d Buffer Overflow,https://packetstormsecurity.com/files/162959/eximsmtp-overflow.txt,https://j.mp/2RlT5Gc
PacketstormSecurity,Cisco SD-WAN vManage 19.2.2 Remote Root,https://packetstormsecurity.com/files/162958/ciscosdwanvmanage1922-exec.txt,https://j.mp/3uODAEc
PacketstormSecurity,VMware ESXi OpenSLP Heap Overflow,https://packetstormsecurity.com/files/162957/vmware-heapoverflow.txt,https://j.mp/3fLaHo7
