feed,title,long_url,short_url
PacketstormSecurity,Chinese Hackers Deliver Malware To Barracuda Email Security Appliances Via New Zero-Day,https://packetstormsecurity.com/news/view/35335/Chinese-Hackers-Deliver-Malware-To-Barracuda-Email-Security-Appliances-Via-New-Zero-Day.html,https://da.gd/1hUY
PacketstormSecurity,NASA Launches Cybersecurity Guide For Space Industry,https://packetstormsecurity.com/news/view/35339/NASA-Launches-Cybersecurity-Guide-For-Space-Industry.html,https://da.gd/FIbsW1
PacketstormSecurity,Hackers Steal Customer Data From Europe's Largest Parking App Operator,https://packetstormsecurity.com/news/view/35338/Hackers-Steal-Customer-Data-From-Europes-Largest-Parking-App-Operator.html,https://da.gd/YFoE3J
PacketstormSecurity,"Cyberattack Disrupts Operations Of First American, Subsidiaries",https://packetstormsecurity.com/news/view/35336/Cyberattack-Disrupts-Operations-Of-First-American-Subsidiaries.html,https://da.gd/WSwOl
PacketstormSecurity,Police Warns Hundreds Of Online Merchants Of Skimmers,https://packetstormsecurity.com/news/view/35337/Police-Warns-Hundreds-Of-Online-Merchants-Of-Skimmers.html,https://da.gd/zUuLa7
PacketstormSecurity,WhatACart 2.0.7 Cross Site Scripting,https://packetstormsecurity.com/files/176314/whatacart207-xss.txt,https://da.gd/dxMU2
PacketstormSecurity,Gentoo Linux Security Advisory 202312-15,https://packetstormsecurity.com/files/176313/glsa-202312-15.txt,https://da.gd/2Xap
