feed,title,long_url,short_url
PacketstormSecurity,"2FA App With 10,000 Google Play Downloads Loaded Well-Known Banking Trojan",https://packetstormsecurity.com/news/view/33053/2FA-App-With-10-000-Google-Play-Downloads-Loaded-Well-Known-Banking-Trojan.html,https://bit.ly/3L3FlXN
PacketstormSecurity,Microsoft Fends Off Record Breaking 3.47Tbps DDoS Attack,https://packetstormsecurity.com/news/view/33050/Microsoft-Fends-Off-Record-Breaking-3.47Tbps-DDoS-Attack.html,https://bit.ly/3H9nNag
PacketstormSecurity,US Bans Telecom Giant China Unicom Over Spying Concerns,https://packetstormsecurity.com/news/view/33052/US-Bans-Telecom-Giant-China-Unicom-Over-Spying-Concerns.html,https://bit.ly/3KVgDZA
PacketstormSecurity,"Intel Fails To Get Spectre, Meltdown Class Action Suits Thrown Out",https://packetstormsecurity.com/news/view/33051/Intel-Fails-To-Get-Spectre-Meltdown-Class-Action-Suits-Thrown-Out.html,https://bit.ly/35wQaBf
PacketstormSecurity,Shipment Delivery Scams Become The Favored Way To Spread Malware,https://packetstormsecurity.com/news/view/33054/Shipment-Delivery-Scams-Become-The-Favored-Way-To-Spread-Malware.html,https://bit.ly/32EgOHa
