feed,title,long_url,short_url
PacketstormSecurity,23andMe Confirms Nearly 7 Million Customers Affected In Data Leak,https://packetstormsecurity.com/news/view/35263/23andMe-Confirms-Nearly-7-Million-Customers-Affected-In-Data-Leak.html,https://da.gd/RLmJEo
PacketstormSecurity,Cyber Av3ngers Gang Hacks Industrial Controllers Across US,https://packetstormsecurity.com/news/view/35264/Cyber-Av3ngers-Gang-Hacks-Industrial-Controllers-Across-US.html,https://da.gd/1o1rxU
PacketstormSecurity,MIPS Chips Targeted By New P2Pinfect Malware In Multiple Attacks,https://packetstormsecurity.com/news/view/35265/MIPS-Chips-Targeted-By-New-P2Pinfect-Malware-In-Multiple-Attacks.html,https://da.gd/DMLjX
PacketstormSecurity,94 Vulns Patched In Android With December Updates,https://packetstormsecurity.com/news/view/35266/94-Vulns-Patched-In-Android-With-December-Updates.html,https://da.gd/oIvZ
PacketstormSecurity,Two New Versions Of OpenZFS Fix Long-Hidden Corruption Bug,https://packetstormsecurity.com/news/view/35267/Two-New-Versions-Of-OpenZFS-Fix-Long-Hidden-Corruption-Bug.html,https://da.gd/MdBgMb
