feed,title,long_url,short_url
gNews,"Microsoft, Darktrace Partner For Cloud Cybersecurity - pymnts",https://www.pymnts.com/news/security-and-risk/2021/microsoft-darktrace-partner-for-cloud-cybersecurity/,https://j.mp/2Sxgt3C
gNews,"MIT Centre for Future Skills Excellence to offer diploma in AI/ML, Cloud Computing, Cybersecurity, DevOps - PR Newswire India",https://www.prnewswire.com/in/news-releases/mit-centre-for-future-skills-excellence-to-offer-diploma-in-ai-ml-cloud-computing-cybersecurity-devops-805968857.html,https://prn.to/339M5yA
gNews,Alert Fatigue: How AI Can Help You Address Your Most Important Alerts - Security Intelligence,https://securityintelligence.com/articles/alert-fatigue-ai-solves-important-alerts/,https://ibm.co/3nTFT7p
gNews,SRMIST-The Hindu career guidance webinars available online - The Hindu,https://www.thehindu.com/education/srmist-the-hindu-career-guidance-webinars-available-online/article34567231.ece,https://j.mp/3okiZWS
gNews,Riding the digital technology wave » Borneo Bulletin Online - Borneo Bulletin Online,https://borneobulletin.com.bn/riding-digital-technology-wave-2/,https://j.mp/3tZj837
