feed,title,long_url,short_url
LinuxSecurity,Gentoo: GLSA-202107-47: libpano13: Format string vulnerability,https://www.linuxsecurity.com/advisories/gentoo/gentoo-glsa-202107-47-libpano13-format-string-vulnerability-00-19-52?rss,https://j.mp/3irdkMa
LinuxSecurity,Gentoo: GLSA-202107-46: mpv: Format string vulnerability,https://www.linuxsecurity.com/advisories/gentoo/gentoo-glsa-202107-46-mpv-format-string-vulnerability-00-17-54?rss,https://j.mp/3wQLVs4
LinuxSecurity,"Gentoo: GLSA-202107-45: PyCharm Community, Professional: Remote code execution",https://www.linuxsecurity.com/advisories/gentoo/gentoo-glsa-202107-45-pycharm-community-professional-remote-code-execution-00-13-57?rss,https://j.mp/3wLlB2E
LinuxSecurity,Gentoo: GLSA-202107-44: libslirp: Multiple vulnerabilities,https://www.linuxsecurity.com/advisories/gentoo/gentoo-glsa-202107-44-libslirp-multiple-vulnerabilities-00-12-20?rss,https://j.mp/3wVN8hQ
LinuxSecurity,Gentoo: GLSA-202107-43: RPM: Multiple vulnerabilities,https://www.linuxsecurity.com/advisories/gentoo/gentoo-glsa-202107-43-rpm-multiple-vulnerabilities-00-08-08?rss,https://j.mp/36KNJbF
LinuxSecurity,Gentoo: GLSA-202107-42: PJSIP: Multiple vulnerabilities,https://www.linuxsecurity.com/advisories/gentoo/gentoo-glsa-202107-42-pjsip-multiple-vulnerabilities-00-01-21?rss,https://j.mp/3rlgKE8
