feed,title,long_url,short_url
UbuntuSecurityNotice,USN-5018-1: Linux kernel vulnerabilities,https://ubuntu.com/security/notices/USN-5018-1,https://j.mp/3eEl6B6
UbuntuSecurityNotice,USN-5017-1: Linux kernel vulnerabilities,https://ubuntu.com/security/notices/USN-5017-1,https://j.mp/2UtQZ8A
UbuntuSecurityNotice,USN-5014-1: Linux kernel vulnerability,https://ubuntu.com/security/notices/USN-5014-1,https://j.mp/3kFl7c4
UbuntuSecurityNotice,USN-5016-1: Linux kernel vulnerabilities,https://ubuntu.com/security/notices/USN-5016-1,https://j.mp/3rmpQR0
UbuntuSecurityNotice,USN-5015-1: Linux kernel (OEM) vulnerabilities,https://ubuntu.com/security/notices/USN-5015-1,https://j.mp/3zjFTSt
