feed,title,long_url,short_url
LinuxSecurity,Oracle9: ELSA-2022-5252: libarchive Moderate Security Update,https://www.linuxsecurity.com/advisories/oracle/oracle9-elsa-2022-5252-libarchive-moderate-security-update-17-21-11?rss,https://bit.ly/3yaUUaf
LinuxSecurity,Oracle9: ELSA-2022-5251: pcre2 Moderate Security Update,https://www.linuxsecurity.com/advisories/oracle/oracle9-elsa-2022-5251-pcre2-moderate-security-update-17-21-11?rss,https://bit.ly/3a6iAEW
LinuxSecurity,Oracle9: ELSA-2022-5250: libxml2 Moderate Security Update,https://www.linuxsecurity.com/advisories/oracle/oracle9-elsa-2022-5250-libxml2-moderate-security-update-17-21-10?rss,https://bit.ly/3a6iAoq
LinuxSecurity,Oracle9: ELSA-2022-5245: curl Moderate Security Update,https://www.linuxsecurity.com/advisories/oracle/oracle9-elsa-2022-5245-curl-moderate-security-update-17-21-09?rss,https://bit.ly/3yKf5xv
LinuxSecurity,Oracle9: ELSA-2022-5249: kernel Important Security Update,https://www.linuxsecurity.com/advisories/oracle/oracle9-elsa-2022-5249-kernel-important-security-update-17-21-09?rss,https://bit.ly/3a6iBsu
LinuxSecurity,Oracle9: ELSA-2022-5242: vim Moderate Security Update,https://www.linuxsecurity.com/advisories/oracle/oracle9-elsa-2022-5242-vim-moderate-security-update-17-21-08?rss,https://bit.ly/3ycMK10
