feed,title,long_url,short_url
LinuxSecurity,Oracle7: ELSA-2025-1601: gcc Moderate Security Advisory Updates,https://linuxsecurity.com/advisories/oracle/oracle7-elsa-2025-1601-gcc-moderate-security-advisory-updates-i3vqbwut5ebt,https://da.gd/637kYl
LinuxSecurity,Oracle8: ELSA-2025-2686: libxml2 security Important Security Advisory Updates,https://linuxsecurity.com/advisories/oracle/oracle8-elsa-2025-2686-libxml2-security-important-security-advisory-updates-ol45oyhziekw,https://da.gd/EP6nCS
LinuxSecurity,"Oracle8: ELSA-2025-2670: .NET 8.0 security, bug fix, and enhancement Important Security Advisory Updates",https://linuxsecurity.com/advisories/oracle/oracle8-elsa-2025-2670-net-8-0-security-bug-fix-and-enhancement-important-security-advisory-updates-rpyomiib4j2h,https://da.gd/KVp4w
LinuxSecurity,"Oracle8: ELSA-2025-2667: .NET 9.0 security, bug fix, and enhancement Important Security Advisory Updates",https://linuxsecurity.com/advisories/oracle/oracle8-elsa-2025-2667-net-9-0-security-bug-fix-and-enhancement-important-security-advisory-updates-mibiobcxzmic,https://da.gd/fiVM
LinuxSecurity,Oracle9: ELSA-2025-2679: libxml2 security Important Security Advisory Updates,https://linuxsecurity.com/advisories/oracle/oracle9-elsa-2025-2679-libxml2-security-important-security-advisory-updates-05ctaobqejab,https://da.gd/J8FdQ4
LinuxSecurity,"Oracle9: ELSA-2025-2669: .NET 8.0 security, bug fix, and enhancement Important Security Advisory Updates",https://linuxsecurity.com/advisories/oracle/oracle9-elsa-2025-2669-net-8-0-security-bug-fix-and-enhancement-important-security-advisory-updates-rsfftggffy87,https://da.gd/4lrTVU
