feed,title,long_url,short_url
PacketstormSecurity,Critical Cobalt Strike Bug Leaves Botnet Servers Vulnerable To Takedown,https://packetstormsecurity.com/news/view/32535/Critical-Cobalt-Strike-Bug-Leaves-Botnet-Servers-Vulnerable-To-Takedown.html,https://j.mp/3fx0yec
PacketstormSecurity,TechScape: Why Hacker Summer Camp And Pandemics Don't Mix,https://packetstormsecurity.com/news/view/32532/TechScape-Why-Hacker-Summer-Camp-And-Pandemics-Dont-Mix.html,https://j.mp/3yvmbmW
PacketstormSecurity,Black Hat: Let's All Help Cyber Immunize Each Other,https://packetstormsecurity.com/news/view/32534/Black-Hat-Lets-All-Help-Cyber-Immunize-Each-Other.html,https://j.mp/37jWSYL
PacketstormSecurity,Black Hat: Security Bugs Allow Takeover Of Capsule Hotel Rooms,https://packetstormsecurity.com/news/view/32533/Black-Hat-Security-Bugs-Allow-Takeover-Of-Capsule-Hotel-Rooms.html,https://j.mp/3lwBg3J
PacketstormSecurity,Red Hat Security Advisory 2021-3015-01,https://packetstormsecurity.com/files/163743/RHSA-2021-3015-01.txt,https://j.mp/2WXWH3E
PacketstormSecurity,GFI Mail Archiver 15.1 Arbitrary File Upload,https://packetstormsecurity.com/files/163742/gfipwn.py.txt,https://j.mp/2TYLmPG
PacketstormSecurity,Moodle 3.9 Remote Code Execution,https://packetstormsecurity.com/files/163740/moodle39-exec.txt,https://j.mp/3CdyQgx
PacketstormSecurity,Pass-The-Hash Attack Over Named Pipes Against ESET Server Security,https://packetstormsecurity.com/files/163738/passthehasheset.pdf,https://j.mp/3lyGPyF
PacketstormSecurity,CMSuno 1.7 Cross Site Scripting,https://packetstormsecurity.com/files/163737/cmsuno17-xss.txt,https://j.mp/3yDOsHG
