feed,title,long_url,short_url
PacketstormSecurity,Intel Memory Bug Poses Risk For Hundreds Of Products,https://packetstormsecurity.com/news/view/33434/Intel-Memory-Bug-Poses-Risk-For-Hundreds-Of-Products.html,https://bit.ly/3L8LksQ
PacketstormSecurity,Ransomware The Final Nail In Coffin For Small University,https://packetstormsecurity.com/news/view/33435/Ransomware-The-Final-Nail-In-Coffin-For-Small-University.html,https://bit.ly/39eVaw6
PacketstormSecurity,Novel Nerbian Trojan Uses Advanced Anti-Detection Tricks,https://packetstormsecurity.com/news/view/33438/Novel-Nerbian-Trojan-Uses-Advanced-Anti-Detection-Tricks.html,https://bit.ly/3PiLHo0
PacketstormSecurity,APT Gang Sidewinder Goes On Two Year Attack Spree Across Asia,https://packetstormsecurity.com/news/view/33436/APT-Gang-Sidewinder-Goes-On-Two-Year-Attack-Spree-Across-Asia.html,https://bit.ly/3l4Yuwz
PacketstormSecurity,Turmoil In Crypto Market As Stablecoin Tether Breaks Dollar Peg,https://packetstormsecurity.com/news/view/33439/Turmoil-In-Crypto-Market-As-Stablecoin-Tether-Breaks-Dollar-Peg.html,https://bit.ly/3M8yDzR
PacketstormSecurity,"Ukraine War: Don't Underestimate Russia Cyber Threat, Warns US",https://packetstormsecurity.com/news/view/33437/Ukraine-War-Dont-Underestimate-Russia-Cyber-Threat-Warns-US.html,https://bit.ly/39jhx3H
