feed,title,long_url,short_url
PacketstormSecurity,Pixel Perfect Ghostpulse Malware Loader Hides Inside PNG Image Files,https://packetstormsecurity.com/news/view/36503/Pixel-Perfect-Ghostpulse-Malware-Loader-Hides-Inside-PNG-Image-Files.html,https://da.gd/VnkP
PacketstormSecurity,Researchers Discover Flaws In 5 End-To-End Encrypted Cloud Services,https://packetstormsecurity.com/news/view/36500/Researchers-Discover-Flaws-In-5-End-To-End-Encrypted-Cloud-Services.html,https://da.gd/1qJhV
PacketstormSecurity,macOS HM Surf Vuln Might Already Be Under Exploit By Malware,https://packetstormsecurity.com/news/view/36501/macOS-HM-Surf-Vuln-Might-Already-Be-Under-Exploit-By-Malware.html,https://da.gd/0Fop9
PacketstormSecurity,Google Warns Of Samsung Zero Day Exploited In The Wild,https://packetstormsecurity.com/news/view/36499/Google-Warns-Of-Samsung-Zero-Day-Exploited-In-The-Wild.html,https://da.gd/d3mqr
PacketstormSecurity,"NVIDIA Computer Finds Largest Known Prime, Blows Past Record By 16 Million Digits",https://packetstormsecurity.com/news/view/36505/NVIDIA-Computer-Finds-Largest-Known-Prime-Blows-Past-Record-By-16-Million-Digits.html,https://da.gd/GAR64L
PacketstormSecurity,Data Storage In Spotlight Of Italian Security Committee After Intesa Breach,https://packetstormsecurity.com/news/view/36504/Data-Storage-In-Spotlight-Of-Italian-Security-Committee-After-Intesa-Breach.html,https://da.gd/EFhaNh
PacketstormSecurity,Detective Charged With Purchasing Stolen Credentials,https://packetstormsecurity.com/news/view/36502/Detective-Charged-With-Purchasing-Stolen-Credentials.html,https://da.gd/HLF9k8
