feed,title,long_url,short_url
LinuxSecurity,SUSE: Multi-Linux Manager Important Update Threat Mitigation 2025:4458-1,https://linuxsecurity.com/advisories/suse/multi-linux-manager-5-0-6-2025-3415,https://da.gd/tGbn29
LinuxSecurity,SUSE Multi-Linux Manager Security Patch 5.0.6 Advisory SUSE-SU-2025:4466-1,https://linuxsecurity.com/advisories/suse/multi-linux-manager-salt-5-0-6-1766092244,https://da.gd/BIUP5
LinuxSecurity,"SUSE: Multi-Linux Manager Important Security Update CVE-2025-62348,62349",https://linuxsecurity.com/advisories/suse/multi-linux-manager-salt-bundle-5-0-6-2025-62349,https://da.gd/BfbNRH
LinuxSecurity,SUSE: Multi-Linux Manager Salt Bundle Important Security Fixes 2025-62348,https://linuxsecurity.com/advisories/suse/salt-bundle-5-0-6-2025-62348,https://da.gd/lgYIs
LinuxSecurity,SUSE: Multi-Linux Manager Important Security Update 5.0.6 CVE-2025-62348,https://linuxsecurity.com/advisories/suse/multi-linux-manager-salt-bundle-5-0-6-2025-62348,https://da.gd/vmQo
LinuxSecurity,SUSE: Multi-Linux Manager 5.0.6 Important Security Update CVE-2025-62348,https://linuxsecurity.com/advisories/suse/salt-bundle-suse-202511-15319-1-2025-62348,https://da.gd/NT28rl
