feed,title,long_url,short_url
LinuxSecurity,openSUSE: kubecolor Moderate Fix for CVE-2025-47912 and CVE-2025-58185,https://linuxsecurity.com/advisories/opensuse/opensuse-2025-15703-1-kubecolor-0-5-3-1-1-egth9cje4d2i,https://da.gd/BvWLm
LinuxSecurity,openSUSE Tumbleweed: Zellij Moderate Security Issue Update 2025:15704-1,https://linuxsecurity.com/advisories/opensuse/opensuse-2025-15704-1-zellij-0-43-1-2-1-csao2ariz6pa,https://da.gd/r88YPd
LinuxSecurity,Fedora: kernel-devel-5.17.8-3.2 Critical Vulnerability Patch 2025:15703-2,https://linuxsecurity.com/advisories/opensuse/opensuse-2025-15702-1-kernel-devel-6-17-7-1-1-1hryxbqwkerj,https://da.gd/DXsk
LinuxSecurity,openSUSE Tumbleweed: OpenSMTPD Moderate Update Vulnerability 2025:15700-1,https://linuxsecurity.com/advisories/opensuse/opensuse-2025-15700-1-opensmtpd-7-8-0p0-1-1-wl1dqndj5lof,https://da.gd/wUMTLc
LinuxSecurity,openSUSE: java-1_8_0-openjdk Moderate Issues 2025:15701-1 CVE-2025-53057/66,https://linuxsecurity.com/advisories/opensuse/opensuse-2025-15701-1-java-1-8-0-openjdk-1-8-0-472-1-1-na76jfcusvz3,https://da.gd/TbR482
LinuxSecurity,Ubuntu 25.10: Django Important Command Exec Risk USN-7859-1 CVE-2025-64459,https://linuxsecurity.com/advisories/ubuntu/ubuntu-7859-1-django-bhcwzdlwtnna,https://da.gd/UP5Jd
