feed,title,long_url,short_url
PacketstormSecurity,The Supreme Court Just Fucked The Planet,https://packetstormsecurity.com/news/view/33592/The-Supreme-Court-Just-Fucked-The-Planet.html,https://bit.ly/3bKpQa0
PacketstormSecurity,Microsoft Warns Malware That Targets Linux Just Got A Big Update,https://packetstormsecurity.com/news/view/33591/Microsoft-Warns-Malware-That-Targets-Linux-Just-Got-A-Big-Update.html,https://bit.ly/3AiyFC8
PacketstormSecurity,China Lured Graduate Jobseekers Into Digital Espionage,https://packetstormsecurity.com/news/view/33594/China-Lured-Graduate-Jobseekers-Into-Digital-Espionage.html,https://bit.ly/3bKpXCs
PacketstormSecurity,Leaky Access Tokens Exposed Amazon Photos Of Users,https://packetstormsecurity.com/news/view/33593/Leaky-Access-Tokens-Exposed-Amazon-Photos-Of-Users.html,https://bit.ly/3I1QW8y
PacketstormSecurity,Blue Team Training Toolkit (BT3) 2.9,https://packetstormsecurity.com/files/167631/BT3-2.9.tar.gz,https://bit.ly/3bKpPTu
PacketstormSecurity,Backdoor.Win32.Coredoor.10.a MVID-2022-0618 Authentication Bypass,https://packetstormsecurity.com/files/167629/MVID-2022-0618.txt,https://bit.ly/3I1CVI1
PacketstormSecurity,Backdoor.Win32.EvilGoat.b MVID-2022-0619 Hardcoded Credential,https://packetstormsecurity.com/files/167628/MVID-2022-0619.txt,https://bit.ly/3AhJEvA
PacketstormSecurity,Backdoor.Win32.Cafeini.b MVID-2022-0617 Hardcoded Credential,https://packetstormsecurity.com/files/167627/MVID-2022-0617.txt,https://bit.ly/3I6NR6V
PacketstormSecurity,launchd Heap Corruption,https://packetstormsecurity.com/files/167630/GS20220630154613.txt,https://bit.ly/3bJ52zH
