feed,title,long_url,short_url
PacketstormSecurity,"White House Thinks It's Time To Fix The Insecure Glue Of The Internet: Yup, BGP",https://packetstormsecurity.com/news/view/36292/White-House-Thinks-Its-Time-To-Fix-The-Insecure-Glue-Of-The-Internet-Yup-BGP.html,https://da.gd/QWo9p
PacketstormSecurity,Zyxel Patches Critical Vulns In Networking Devices,https://packetstormsecurity.com/news/view/36294/Zyxel-Patches-Critical-Vulns-In-Networking-Devices.html,https://da.gd/U65d
PacketstormSecurity,Stop Scanning Random QR Codes,https://packetstormsecurity.com/news/view/36291/Stop-Scanning-Random-QR-Codes.html,https://da.gd/mIyHqz
PacketstormSecurity,FBI: North Korea Aggressively Hacking Cryptocurrency Firms,https://packetstormsecurity.com/news/view/36293/FBI-North-Korea-Aggressively-Hacking-Cryptocurrency-Firms.html,https://da.gd/fmeXLh
PacketstormSecurity,VMware Fusion13.x Code Execution Bug Patched,https://packetstormsecurity.com/news/view/36297/VMware-Fusion13.x-Code-Execution-Bug-Patched.html,https://da.gd/FNxbtB
PacketstormSecurity,Ex-Senior New York State Staffer Charged In Cash-For-Favors Scandal With China,https://packetstormsecurity.com/news/view/36296/Ex-Senior-New-York-State-Staffer-Charged-In-Cash-For-Favors-Scandal-With-China.html,https://da.gd/eE1Li
PacketstormSecurity,Cicada Ransomware May Be A BlackCat/ALPHV Rebrand And Upgrade,https://packetstormsecurity.com/news/view/36295/Cicada-Ransomware-May-Be-A-BlackCat-ALPHV-Rebrand-And-Upgrade.html,https://da.gd/I6eS
