feed,title,long_url,short_url
LinuxSecurity,Debian: PHP 7.4 Critical SSRF and DoS Vulnerabilities DLA-4254-1,https://linuxsecurity.com/advisories/deblts/debian-lts-dla-4254-1-php7-4-security-update-ljvs3nz3ryhm,https://da.gd/W8MIc
LinuxSecurity,openSUSE: chromium Important Update 2025:0174-1 CVE-2025-5063 DoS,https://linuxsecurity.com/advisories/opensuse/opensuse-2025-0174-1-important-chromium-hh3vnvuipxst,https://da.gd/m4eOO
LinuxSecurity,openSUSE Backports SLE-15-SP6: Chromium Important Update 2025:0209-1,https://linuxsecurity.com/advisories/opensuse/opensuse-2025-0209-1-important-chromium-lhat3wgt9bs7,https://da.gd/LcxMW
LinuxSecurity,openSUSE Tumbleweed: rpi-imager Moderate CVE-2025-5916 Advisory 2025:15388,https://linuxsecurity.com/advisories/opensuse/opensuse-2025-15388-1-moderate-rpi-imager-1-9-5-1-1-yo3remgur83h,https://da.gd/LUBA
LinuxSecurity,openSUSE Tumbleweed: MozillaFirefox Moderate Security Advisory 2025:15386-1,https://linuxsecurity.com/advisories/opensuse/opensuse-2025-15386-1-moderate-mozillafirefox-141-0-1-1-2zkaxk4wttet,https://da.gd/3IgNhZ
