feed,title,long_url,short_url
PacketstormSecurity,Windows Network File System Flaw Results In Arbitrary Code Execution As SYSTEM,https://packetstormsecurity.com/news/view/33637/Windows-Network-File-System-Flaw-Results-In-Arbitrary-Code-Execution-As-SYSTEM.html,https://bit.ly/3PiuWcs
PacketstormSecurity,"Meet Mantis, The Tiny Shrimp That Launched 3,000 DDoS Attacks",https://packetstormsecurity.com/news/view/33634/Meet-Mantis-The-Tiny-Shrimp-That-Launched-3-000-DDoS-Attacks.html,https://bit.ly/3uQwQsw
PacketstormSecurity,Journalists Emerge As Favored Attack Target For APTs,https://packetstormsecurity.com/news/view/33635/Journalists-Emerge-As-Favored-Attack-Target-For-APTs.html,https://bit.ly/3Pby7Tb
PacketstormSecurity,Tenet Health Sued Over Health Data Theft Impacting 1.2M,https://packetstormsecurity.com/news/view/33636/Tenet-Health-Sued-Over-Health-Data-Theft-Impacting-1.2M.html,https://bit.ly/3z5UbJc
PacketstormSecurity,Windows Kernel nt!MiRelocateImage Invalid Read,https://packetstormsecurity.com/files/167755/GS20220715145905.tgz,https://bit.ly/3zbBELH
PacketstormSecurity,Windows LSA Service LsapGetClientInfo Impersonation Level Check Privilege Escalation,https://packetstormsecurity.com/files/167754/GS20220715145633.tgz,https://bit.ly/3ccdtnb
