feed,title,long_url,short_url
LinuxSecurity,SUSE: openjpeg2 Low Null Pointer Dereference CVE-2018-18088 2025:03352-1,https://linuxsecurity.com/advisories/suse/suse-2025-03352-1-low-openjpeg2-6vx904wmmjky,https://da.gd/OS3Mvr
LinuxSecurity,openSUSE: openjpeg2 Low Null Pointer Threat Fix SUSE-SU-2025:03352-1,https://linuxsecurity.com/advisories/opensuse/opensuse-2025-03352-1-low-openjpeg2,https://da.gd/wdrqXr
LinuxSecurity,SUSE: openjpeg2 Low Severity Null Pointer Deference CVE-2018-18088 Advisory,https://linuxsecurity.com/advisories/suse/suse-2025-03353-1-low-openjpeg2-bhpsx8aihjlp,https://da.gd/V26UW
LinuxSecurity,openSUSE: Moderate Use-After-Free in python-pycares CVE-2025-48945,https://linuxsecurity.com/advisories/suse/suse-2025-03354-1-moderate-python-pycares-whefkpk50ags,https://da.gd/ZLAm6Z
LinuxSecurity,openSUSE Leap 15.4: python-pycares Moderate Update for CVE-2025-48945,https://linuxsecurity.com/advisories/opensuse/opensuse-2025-03354-1-moderate-python-pycares,https://da.gd/i68z
LinuxSecurity,SUSE: Kernel Important Update CVE-2025-38181 2025:03356-1,https://linuxsecurity.com/advisories/suse/suse-2025-03356-1-important-kernel-mlatjpc0glco,https://da.gd/ct2Lz
