feed,title,long_url,short_url
UbuntuSecurityNotice,USN-5003-1: Linux kernel vulnerabilities,https://ubuntu.com/security/notices/USN-5003-1,https://j.mp/3gOvnfx
UbuntuSecurityNotice,USN-5002-1: Linux kernel (HWE) vulnerability,https://ubuntu.com/security/notices/USN-5002-1,https://j.mp/2TZZasA
UbuntuSecurityNotice,USN-5001-1: Linux kernel (OEM) vulnerabilities,https://ubuntu.com/security/notices/USN-5001-1,https://j.mp/3xLkXD2
UbuntuSecurityNotice,USN-5000-1: Linux kernel vulnerabilities,https://ubuntu.com/security/notices/USN-5000-1,https://j.mp/2UthfQi
UbuntuSecurityNotice,USN-4999-1: Linux kernel vulnerabilities,https://ubuntu.com/security/notices/USN-4999-1,https://j.mp/3vPcI7C
