feed,title,long_url,short_url
LinuxSecurity,SUSE: Kernel Important Buffer Overflow Issues Fixed 2026:0186-1,https://linuxsecurity.com/advisories/suse/kernel-suse-2026-0186-1-2022-50327,https://da.gd/MhBpC8
LinuxSecurity,openSUSE: Kernel Important Patch for Nine Security Issues 2026:0186-1,https://linuxsecurity.com/advisories/opensuse/kernel-opensuse-2026-0186-1-2022-50327,https://da.gd/eDrePZ
LinuxSecurity,SUSE Linux Enterprise 15 SP5: Kernel Important Update for CVE-2022-50327,https://linuxsecurity.com/advisories/suse/kernel-suse-2026-0187-1-2022-50327,https://da.gd/SigEh
LinuxSecurity,openSUSE Leap 15.5: Kernel Important Buffer Overflow Vuln 2026:0187-1,https://linuxsecurity.com/advisories/opensuse/kernel-opensuse-2026-0187-1-2022-50327,https://da.gd/CE7UN
LinuxSecurity,SUSE: Kernel Important Update Live Patch 31 CVE-2022-50327 Security Fix,https://linuxsecurity.com/advisories/suse/kernel-suse-2026-0188-1-2022-50327,https://da.gd/jLuo7
LinuxSecurity,openSUSE: Kernel Important Buffer Overflow Fix SUSE-SU-2026:0188-1,https://linuxsecurity.com/advisories/opensuse/kernel-opensuse-2026-0188-1-2022-50327,https://da.gd/bkcev
