feed,title,long_url,short_url
r/Securitynews,Telstra's cyber security leaders exit,https://redd.it/9ekwwn,
r/Securitynews,Telstra's cyber security leaders exit,https://redd.it/9ekefr,
r/Securitynews,Lead Cyber Security Consultant - Services,https://redd.it/9ek26s,
r/Securitynews,Used Gear Installed For South Bay BART Extension Exposed System To Hackers,https://redd.it/9ejebo,
r/Securitynews,Telstra's cyber security leaders exit,https://redd.it/9eivo6,
r/Securitynews,"EXCLUSIVE: As hackers steal details of 380000 BA customers, we step inside Britain's cyber security HQ",https://redd.it/9ebmrp,
r/Securitynews,Worries arise about security of new WebAuthn protocol,https://redd.it/9eaa5v,
r/Securitynews,"EXCLUSIVE: As hackers steal details of 380000 BA customers, we step inside Britain's cyber security HQ",https://redd.it/9e83ag,
r/Securitynews,TSTC Computer Networking & Security Technology named Center of Excellence,https://redd.it/9e3kmo,
r/Securitynews,"Gits exposed, kinky app devs spanked, Feds spy on spyware buyers, etc",https://redd.it/9e36t8,
r/Securitynews,"Back from vacations, a good time to beef up cybersecurity",https://redd.it/9e24jo,
r/Securitynews,Jacobs creating Knox County cyber security task force,https://redd.it/9e1i6r,
r/Securitynews,Beyond the Cyber Leviathan: White Hats and US Cyber Defense,https://redd.it/9e1i6o,
r/Securitynews,Facebook partners with Texas A&M-San Antonio to offer cyber security courses,https://redd.it/9e1i6j,
r/Securitynews,Former FBI Agent Raises Awareness of Cyber Security,https://redd.it/9e0pbj,
r/Securitynews,Apple Removes Top Security App For Stealing Data and Sending it to China,https://redd.it/9e043s,
r/Securitynews,"Dear America: Want secure elections? Stick to pen and paper for ballots, experts urge",https://redd.it/9dydt8,
r/Securitynews,Five cyber security threats businesses need to protect against,https://redd.it/9dy3th,
r/Securitynews,Top antivirus tool nuked from macOS App Store – after it phoned browser histories to China,https://redd.it/9dy0ee,
r/Securitynews,Silicon Valley CEO admits $1.5m wire fraud: Bouxtie boss forged signatures to investors,https://redd.it/9dxxa6,
r/Securitynews,Tricked: Wegmans and Chilean supplier victimized by computer fraud,https://redd.it/9dwyal,
r/Securitynews,Computer Voting: A 'National Disgrace',https://redd.it/9dw6vw,
r/Securitynews,"How to nab a HTTPS cert for a stranger's website: Step one, shatter those DNS queries",https://redd.it/9dw551,
r/Securitynews,Revealed: British Airways in talks with IBM on outsourcing security,https://redd.it/9dvy89,
r/Securitynews,"Cyber Security Today: Attempted fraud, sexting and another airline breach",https://redd.it/9dvokx,
