feed,title,long_url,short_url
gNews,Russia's GRU enlists hackers to fight Ukraine – April 2023 in review - Tech Monitor,https://news.google.com/rss/articles/CBMiaWh0dHBzOi8vdGVjaG1vbml0b3IuYWkvdGVjaG5vbG9neS9jeWJlcnNlY3VyaXR5L3J1c3NpYS11a3JhaW5lLWdydS1oYWNrZXJzLXJpc2hpLXN1bmFrLW9ubGluZS1zYWZldHktYmlsbNIBAA?oc=5,https://da.gd/AYg0Q
gNews,Decoding the EU AI Act: A Look at the Global Implications for AI Security and Compliance - Acceleration Economy,https://news.google.com/rss/articles/CBMihgFodHRwczovL2FjY2VsZXJhdGlvbmVjb25vbXkuY29tL2N5YmVyc2VjdXJpdHkvZGVjb2RpbmctdGhlLWV1LWFpLWFjdC1hLWxvb2stYXQtdGhlLWdsb2JhbC1pbXBsaWNhdGlvbnMtZm9yLWFpLXNlY3VyaXR5LWFuZC1jb21wbGlhbmNlL9IBAA?oc=5,https://da.gd/3DrfHH
gNews,"New infosec products of the week: December 22, 2023 - Help Net Security",https://news.google.com/rss/articles/CBMiXWh0dHBzOi8vd3d3LmhlbHBuZXRzZWN1cml0eS5jb20vMjAyMy8xMi8yMi9uZXctaW5mb3NlYy1wcm9kdWN0cy1vZi10aGUtd2Vlay1kZWNlbWJlci0yMi0yMDIzL9IBAA?oc=5,https://da.gd/n9J3R
gNews,Adding Cybersecurity Expertise to Your Board - MIT Sloan Management Review,https://news.google.com/rss/articles/CBMiUWh0dHBzOi8vc2xvYW5yZXZpZXcubWl0LmVkdS9hcnRpY2xlL2FkZGluZy1jeWJlcnNlY3VyaXR5LWV4cGVydGlzZS10by15b3VyLWJvYXJkL9IBAA?oc=5,https://da.gd/POtIgd
gNews,3 AI trends that will shape your workforce in 2024 - Fortune,https://news.google.com/rss/articles/CBMiOGh0dHBzOi8vZm9ydHVuZS5jb20vMjAyMy8xMi8xNS9haS10cmVuZHMtd29ya2ZvcmNlLTIwMjQv0gE8aHR0cHM6Ly9mb3J0dW5lLmNvbS8yMDIzLzEyLzE1L2FpLXRyZW5kcy13b3JrZm9yY2UtMjAyNC9hbXAv?oc=5,https://da.gd/h0j9BP
gNews,GenAI In Business: Navigating Risks With Caution - Spiceworks News and Insights,https://news.google.com/rss/articles/CBMifmh0dHBzOi8vd3d3LnNwaWNld29ya3MuY29tL3RlY2gvYXJ0aWZpY2lhbC1pbnRlbGxpZ2VuY2UvZ3Vlc3QtYXJ0aWNsZS9idXNpbmVzc2VzLWFuZC1nZW5haS1zdHJpa2luZy10aGUtcmlnaHQtZXRoaWNhbC1iYWxhbmNlL9IBAA?oc=5,https://da.gd/jit6EV
gNews,The Role of Upskilling in Strengthening Cybersecurity Defences - TimesTech,https://news.google.com/rss/articles/CBMiVGh0dHBzOi8vdGltZXN0ZWNoLmluL3RoZS1yb2xlLW9mLXVwc2tpbGxpbmctaW4tc3RyZW5ndGhlbmluZy1jeWJlcnNlY3VyaXR5LWRlZmVuY2VzL9IBAA?oc=5,https://da.gd/UcqF5C
