feed,title,long_url,short_url
PacketstormSecurity,Feds Post $15 Million Bounty For Info On ALPHV/BlackCat Ransomware Crew,https://packetstormsecurity.com/news/view/35553/Feds-Post-15-Million-Bounty-For-Info-On-ALPHV-BlackCat-Ransomware-Crew.html,https://da.gd/WxiwU
PacketstormSecurity,Russia Exploits Roundcube Flaws Against European Governments,https://packetstormsecurity.com/news/view/35551/Russia-Exploits-Roundcube-Flaws-Against-European-Governments.html,https://da.gd/cfUEk
PacketstormSecurity,New Google Initiative To Foster AI In Cybersecurity,https://packetstormsecurity.com/news/view/35552/New-Google-Initiative-To-Foster-AI-In-Cybersecurity.html,https://da.gd/k2uZMq
PacketstormSecurity,How To Weaponize LLMs To Auto-Hijack Websites,https://packetstormsecurity.com/news/view/35550/How-To-Weaponize-LLMs-To-Auto-Hijack-Websites.html,https://da.gd/fld4
PacketstormSecurity,Big Surprise - Musk's X Is Allowing Chinese Propaganda,https://packetstormsecurity.com/news/view/35554/Big-Surprise-Musks-X-Is-Allowing-Chinese-Propaganda.html,https://da.gd/30Qn
