feed,title,long_url,short_url
UbuntuSecurityNotice,USN-7173-1: Linux kernel vulnerabilities,https://ubuntu.com/security/notices/USN-7173-1,https://da.gd/6lvPB
UbuntuSecurityNotice,USN-7170-1: Linux kernel (OEM) vulnerabilities,https://ubuntu.com/security/notices/USN-7170-1,https://da.gd/0ZE6b
UbuntuSecurityNotice,USN-7169-1: Linux kernel vulnerabilities,https://ubuntu.com/security/notices/USN-7169-1,https://da.gd/lOSfu
UbuntuSecurityNotice,USN-7167-1: Linux kernel vulnerabilities,https://ubuntu.com/security/notices/USN-7167-1,https://da.gd/li8aE
UbuntuSecurityNotice,USN-7159-2: Linux kernel (AWS) vulnerabilities,https://ubuntu.com/security/notices/USN-7159-2,https://da.gd/e5uG
UbuntuSecurityNotice,USN-7166-1: Linux kernel vulnerabilities,https://ubuntu.com/security/notices/USN-7166-1,https://da.gd/6X01Is
