feed,title,long_url,short_url
SecurityWeek,Finnish Hacker Gets Prison for Accessing Thousands of Psychotherapy Records and Demanding Ransoms,https://www.securityweek.com/finnish-hacker-gets-prison-for-accessing-thousands-of-psychotherapy-records-and-demanding-ransoms/,https://da.gd/0ZB7
SecurityWeek,"Docker Hub Users Targeted With Imageless, Malicious Repositories",https://www.securityweek.com/docker-hub-users-targeted-with-imageless-malicious-repositories/,https://da.gd/vClv9
SecurityWeek,"Critical Vulnerabilities in Judge0 Lead to Sandbox Escape, Host Takeover",https://www.securityweek.com/critical-vulnerabilities-in-judge0-lead-to-sandbox-escape-host-takeover/,https://da.gd/LWNk
SecurityWeek,Apptega Raises $15 Million for Cybersecurity Compliance Platform,https://www.securityweek.com/apptega-raises-15-million-for-cybersecurity-compliance-platform/,https://da.gd/cTRYj
SecurityWeek,Island Secures $175M Investment as Enterprise Browser Startups Defy Tech Giants,https://www.securityweek.com/island-secures-175m-investment-as-enterprise-browser-startups-defy-tech-giants/,https://da.gd/tSu66p
SecurityWeek,Chinese Hackers Have Been Probing DNS Networks Globally for Years: Report,https://www.securityweek.com/chinese-hackers-have-been-probing-dns-networks-globally-for-years-report/,https://da.gd/eyu6eK
