feed,title,long_url,short_url
LinuxSecurity,openSUSE Leap 15.4 Kernel Important Security Update 2025:03628-1,https://linuxsecurity.com/advisories/opensuse/opensuse-2025-03628-1-kernel,https://da.gd/qY9LnV
LinuxSecurity,SUSE: Kernel Important Security Update 2025:03628-1 - Action Required,https://linuxsecurity.com/advisories/suse/suse-2025-03628-1-for-kernel-ys6toy8ub1pi,https://da.gd/sMzLcA
LinuxSecurity,SUSE: gstreamer-plugins-rs Important DoS Fix CVE-2024-32650 2025:03629-1,https://linuxsecurity.com/advisories/suse/suse-2025-03629-1-for-gstreamer-plugins-rs-ct9k3ybmuotj,https://da.gd/5YiD8
LinuxSecurity,openSUSE: gstreamer-plugins-xyz Major Security Patch 2025:04738-2,https://linuxsecurity.com/advisories/opensuse/opensuse-2025-03629-1-gstreamer-plugins-rs,https://da.gd/WmFE0A
LinuxSecurity,SUSE Advisory 2025:03630-1 for OpenSSL1 Contains Critical CVE-2025-9230 Fix,https://linuxsecurity.com/advisories/suse/suse-2025-03630-1-for-openssl1-bjgjzlkorldt,https://da.gd/XnMc
