feed,title,long_url,short_url
PacketstormSecurity,"Questions Over Cyber Command Support, Operations Raised In Defense Authorization Bill",https://packetstormsecurity.com/news/view/33571/Questions-Over-Cyber-Command-Support-Operations-Raised-In-Defense-Authorization-Bill.html,https://bit.ly/3tYIXTL
PacketstormSecurity,"NSA, CISA Say: Don't Block PowerShell, Here's What To Do Instead",https://packetstormsecurity.com/news/view/33570/NSA-CISA-Say-Dont-Block-PowerShell-Heres-What-To-Do-Instead.html,https://bit.ly/3HMxxIs
PacketstormSecurity,CISA Warns Over Software Flaws In Industrial Control Systems,https://packetstormsecurity.com/news/view/33572/CISA-Warns-Over-Software-Flaws-In-Industrial-Control-Systems.html,https://bit.ly/3ncMZEw
PacketstormSecurity,Fancy Bear Uses Nuke Threat Lure To Exploit 1-Click Bug,https://packetstormsecurity.com/news/view/33573/Fancy-Bear-Uses-Nuke-Threat-Lure-To-Exploit-1-Click-Bug.html,https://bit.ly/3tSSvja
PacketstormSecurity,Red Hat Security Advisory 2022-5029-01,https://packetstormsecurity.com/files/167579/RHSA-2022-5029-01.txt,https://bit.ly/39PkWI4
PacketstormSecurity,Red Hat Security Advisory 2022-5115-01,https://packetstormsecurity.com/files/167577/RHSA-2022-5115-01.txt,https://bit.ly/3tWBm8o
PacketstormSecurity,Red Hat Security Advisory 2022-5116-01,https://packetstormsecurity.com/files/167576/RHSA-2022-5116-01.txt,https://bit.ly/39PN7GO
PacketstormSecurity,Red Hat Security Advisory 2022-5114-01,https://packetstormsecurity.com/files/167575/RHSA-2022-5114-01.txt,https://bit.ly/3tSSlZ6
