feed,title,long_url,short_url
LinuxSecurity,Oracle Linux 10 ELSA-2025-14179 Tomcat Important Denial of Service,https://linuxsecurity.com/advisories/oracle/oracle10-elsa-2025-14179-tomcat-important-m9nabgxbvcju,https://da.gd/5f4B7
LinuxSecurity,openSUSE Backports: proftpd Security Vulnerability CVE-2024-48651,https://linuxsecurity.com/advisories/opensuse/opensuse-2025-0315-1-important-proftpd-w2raoyjgxwya,https://da.gd/HlMDq
LinuxSecurity,Debian 11: Firebird 3.0 Major NULL Pointer Dereference Issue DLA-4282-1,https://linuxsecurity.com/advisories/deblts/debian-lts-dla-4282-1-firebird3-0-security-update-sqp4vpclgpko,https://da.gd/0mRVJ
LinuxSecurity,SUSE: pam Moderate Security Fix CPU Issue CVE-2024-10041 2025:02970-1,https://linuxsecurity.com/advisories/suse/suse-2025-02970-1-moderate-pam-32agantqj5jf,https://da.gd/a6Lpm1
LinuxSecurity,openSUSE: pam Moderate Security Update CVE-2024-10041 Advisory 2025:02970-1,https://linuxsecurity.com/advisories/opensuse/opensuse-2025-02970-1-moderate-pam-5az3q0zhyddp,https://da.gd/T6ZcZ1
LinuxSecurity,SUSE: pam Moderate Security Issue CVE-2024-10041 Advisory 2025:02971-1,https://linuxsecurity.com/advisories/suse/suse-2025-02971-1-moderate-pam-qrlakldo57dv,https://da.gd/kOlNZ
