feed,title,long_url,short_url
gNews,Google Cloud Next 2024: Gemini and generative AI updates - The Keyword | Google Product and Technology News,https://news.google.com/rss/articles/CBMiVmh0dHBzOi8vYmxvZy5nb29nbGUvcHJvZHVjdHMvZ29vZ2xlLWNsb3VkL2dvb2dsZS1jbG91ZC1uZXh0LTIwMjQtZ2VuZXJhdGl2ZS1haS1nZW1pbmkv0gEA?oc=5,https://da.gd/BBnqm3
gNews,Cybercriminals Are Invading Corporate Inboxes: What Small Businesses Can Do - PYMNTS,https://news.google.com/rss/articles/CBMidWh0dHBzOi8vd3d3LnB5bW50cy5jb20vY3liZXJzZWN1cml0eS8yMDI0L2N5YmVyY3JpbWluYWxzLWFyZS1pbnZhZGluZy1jb3Jwb3JhdGUtaW5ib3hlcy13aGF0LXNtYWxsLWJ1c2luZXNzZXMtY2FuLWRvL9IBAA?oc=5,https://da.gd/3rYz8a
gNews,Adapting to the Dynamic Threat Landscape: The Role of SOCaaS in this Digital Age - CXOToday,https://news.google.com/rss/articles/CBMibmh0dHBzOi8vY3hvdG9kYXkuY29tL3NwZWNpYWxzL2FkYXB0aW5nLXRvLXRoZS1keW5hbWljLXRocmVhdC1sYW5kc2NhcGUtdGhlLXJvbGUtb2Ytc29jYWFzLWluLXRoaXMtZGlnaXRhbC1hZ2Uv0gEA?oc=5,https://da.gd/Rp5LU
gNews,Why Claroty Is Considering Going Public at a $3.5B Valuation - GovInfoSecurity,https://news.google.com/rss/articles/CBMiXmh0dHBzOi8vd3d3LmdvdmluZm9zZWN1cml0eS5jb20vYmxvZ3MvY2xhcm90eS1jb25zaWRlcmluZy1nb2luZy1wdWJsaWMtYXQtMzViLXZhbHVhdGlvbi1wLTM2MDTSAQA?oc=5,https://da.gd/F4hmGm
gNews,Cyber threats inflict staggering toll on Canadian economy - Huntsville Doppler,https://news.google.com/rss/articles/CBMiXmh0dHBzOi8vZG9wcGxlcm9ubGluZS5jYS9odW50c3ZpbGxlL2N5YmVyLXRocmVhdHMtaW5mbGljdC1zdGFnZ2VyaW5nLXRvbGwtb24tY2FuYWRpYW4tZWNvbm9teS_SAQA?oc=5,https://da.gd/UYdTJ
