feed,title,long_url,short_url
LinuxSecurity,Oracle7: ELSA-2022-7184: thunderbird Important Security Update (aarch64),https://www.linuxsecurity.com/advisories/oracle/oracle7-elsa-2022-7184-thunderbird-important-security-update-aarch64--09-35-20?rss,https://bit.ly/3fbk3w1
LinuxSecurity,Oracle7: ELSA-2022-7069: firefox security Important Security Update (aarch64),https://www.linuxsecurity.com/advisories/oracle/oracle7-elsa-2022-7069-firefox-security-important-security-update-aarch64--09-35-20?rss,https://bit.ly/3TLemnC
LinuxSecurity,Oracle7: ELSA-2022-7186: device-mapper-multipath Important Security Update (aarch64),https://www.linuxsecurity.com/advisories/oracle/oracle7-elsa-2022-7186-device-mapper-multipath-important-security-update-aarch64--09-35-20?rss,https://bit.ly/3TLeqDS
LinuxSecurity,Oracle7: ELSA-2022-6998: thunderbird Important Security Update (aarch64),https://www.linuxsecurity.com/advisories/oracle/oracle7-elsa-2022-6998-thunderbird-important-security-update-aarch64--09-35-19?rss,https://bit.ly/3DzXryL
LinuxSecurity,Oracle7: ELSA-2022-6997: firefox security Important Security Update (aarch64),https://www.linuxsecurity.com/advisories/oracle/oracle7-elsa-2022-6997-firefox-security-important-security-update-aarch64--09-35-19?rss,https://bit.ly/3fbk433
LinuxSecurity,Oracle7: ELSA-2022-6711: firefox security Important Security Update (aarch64),https://www.linuxsecurity.com/advisories/oracle/oracle7-elsa-2022-6711-firefox-security-important-security-update-aarch64--09-35-18?rss,https://bit.ly/3D5D7nq
