feed,title,long_url,short_url
PacketstormSecurity,North Korean Hackers Hijack Antivirus Updates For Malware Delivery,https://packetstormsecurity.com/news/view/35809/North-Korean-Hackers-Hijack-Antivirus-Updates-For-Malware-Delivery.html,https://da.gd/SUbeW
PacketstormSecurity,TensorFlow AI Models At Risk Due To Keras API Flaw,https://packetstormsecurity.com/news/view/35806/TensorFlow-AI-Models-At-Risk-Due-To-Keras-API-Flaw.html,https://da.gd/GpadM5
PacketstormSecurity,"US Charges Iranians With Cyber Snooping On Government, Companies",https://packetstormsecurity.com/news/view/35807/US-Charges-Iranians-With-Cyber-Snooping-On-Government-Companies.html,https://da.gd/3DlfJ
PacketstormSecurity,CISA Warns Of Windows Print Spooler Flaw After Microsoft Sees Russian Exploitation,https://packetstormsecurity.com/news/view/35808/CISA-Warns-Of-Windows-Print-Spooler-Flaw-After-Microsoft-Sees-Russian-Exploitation.html,https://da.gd/wQ0a0P
PacketstormSecurity,Google Patches Critical Chrome Vulnerability,https://packetstormsecurity.com/news/view/35811/Google-Patches-Critical-Chrome-Vulnerability.html,https://da.gd/6btoP
PacketstormSecurity,Hackers Are Using Developing Countries For Ransomware Practice,https://packetstormsecurity.com/news/view/35810/Hackers-Are-Using-Developing-Countries-For-Ransomware-Practice.html,https://da.gd/O2Wh
