feed,title,long_url,short_url
CiscoSecurityAdvisory,Cisco Nexus Dashboard Fabric Controller Arbitrary Command Execution Vulnerability,https://sec.cloudapps.cisco.com/security/center/content/CiscoSecurityAdvisory/cisco-sa-ndfc-cmdinj-UvYZrKfr?vs_f=Cisco%20Security%20Advisory%26vs_cat=Security%20Intelligence%26vs_type=RSS%26vs_p=Cisco%20Nexus%20Dashboard%20Fabric%20Controller%20Arbitrary%20Command%20Execution%20Vulnerability%26vs_k=1,https://da.gd/5g7Yp
CiscoSecurityAdvisory,"Cisco UCS B-Series, Managed C-Series, and X-Series Servers Redfish API Command Injection Vulnerability","https://sec.cloudapps.cisco.com/security/center/content/CiscoSecurityAdvisory/cisco-sa-cimc-redfish-cominj-sbkv5ZZ?vs_f=Cisco%20Security%20Advisory%26vs_cat=Security%20Intelligence%26vs_type=RSS%26vs_p=Cisco%20UCS%20B-Series,%20Managed%20C-Series,%20and%20X-Series%20Servers%20Redfish%20API%20Command%20Injection%20Vulnerability%26vs_k=1",https://da.gd/49Flax
CiscoSecurityAdvisory,"Cisco Small Business RV042, RV042G, RV320, and RV325 Routers Denial of Service and Remote Code Execution Vulnerabilities","https://sec.cloudapps.cisco.com/security/center/content/CiscoSecurityAdvisory/cisco-sa-sb-rv04x_rv32x_vulns-yJ2OSDhV?vs_f=Cisco%20Security%20Advisory%26vs_cat=Security%20Intelligence%26vs_type=RSS%26vs_p=Cisco%20Small%20Business%20RV042,%20RV042G,%20RV320,%20and%20RV325%20Routers%20Denial%20of%20Service%20and%20Remote%20Code%20Execution%20Vulnerabilities%26vs_k=1",https://da.gd/M05sM7
CiscoSecurityAdvisory,"Cisco Small Business RV340, RV340W, RV345, and RV345P Dual WAN Gigabit VPN Routers Privilege Escalation and Remote Command Execution Vulnerabilities","https://sec.cloudapps.cisco.com/security/center/content/CiscoSecurityAdvisory/cisco-sa-rv34x-privesc-rce-qE33TCms?vs_f=Cisco%20Security%20Advisory%26vs_cat=Security%20Intelligence%26vs_type=RSS%26vs_p=Cisco%20Small%20Business%20RV340,%20RV340W,%20RV345,%20and%20RV345P%20Dual%20WAN%20Gigabit%20VPN%20Routers%20Privilege%20Escalation%20and%20Remote%20Command%20Execution%20Vulnerabilities%26vs_k=1",https://da.gd/YmQIky
CiscoSecurityAdvisory,Cisco Nexus Dashboard Orchestrator SSL/TLS Certificate Validation Vulnerability,https://sec.cloudapps.cisco.com/security/center/content/CiscoSecurityAdvisory/cisco-sa-ndo-tlsvld-FdUF3cpw?vs_f=Cisco%20Security%20Advisory%26vs_cat=Security%20Intelligence%26vs_type=RSS%26vs_p=Cisco%20Nexus%20Dashboard%20Orchestrator%20SSL/TLS%20Certificate%20Validation%20Vulnerability%26vs_k=1,https://da.gd/HW6nBK
CiscoSecurityAdvisory,Cisco Nexus Dashboard and Nexus Dashboard Fabric Controller Unauthorized REST API Vulnerabilities,https://sec.cloudapps.cisco.com/security/center/content/CiscoSecurityAdvisory/cisco-sa-ndhs-uaapi-Jh4V6zpN?vs_f=Cisco%20Security%20Advisory%26vs_cat=Security%20Intelligence%26vs_type=RSS%26vs_p=Cisco%20Nexus%20Dashboard%20and%20Nexus%20Dashboard%20Fabric%20Controller%20Unauthorized%20REST%20API%20Vulnerabilities%26vs_k=1,https://da.gd/H44I8i
CiscoSecurityAdvisory,Cisco Nexus Dashboard Hosted Services Information Disclosure Vulnerabilities,https://sec.cloudapps.cisco.com/security/center/content/CiscoSecurityAdvisory/cisco-sa-ndhs-idv-Bk8VqEDc?vs_f=Cisco%20Security%20Advisory%26vs_cat=Security%20Intelligence%26vs_type=RSS%26vs_p=Cisco%20Nexus%20Dashboard%20Hosted%20Services%20Information%20Disclosure%20Vulnerabilities%26vs_k=1,https://da.gd/fowRy
CiscoSecurityAdvisory,Cisco Nexus Dashboard Fabric Controller REST API Command Injection Vulnerability,https://sec.cloudapps.cisco.com/security/center/content/CiscoSecurityAdvisory/cisco-sa-ndfc-raci-T46k3jnN?vs_f=Cisco%20Security%20Advisory%26vs_cat=Security%20Intelligence%26vs_type=RSS%26vs_p=Cisco%20Nexus%20Dashboard%20Fabric%20Controller%20REST%20API%20Command%20Injection%20Vulnerability%26vs_k=1,https://da.gd/GAB947
CiscoSecurityAdvisory,Cisco Nexus Dashboard Fabric Controller Remote Code Execution Vulnerability,https://sec.cloudapps.cisco.com/security/center/content/CiscoSecurityAdvisory/cisco-sa-ndfc-ptrce-BUSHLbp?vs_f=Cisco%20Security%20Advisory%26vs_cat=Security%20Intelligence%26vs_type=RSS%26vs_p=Cisco%20Nexus%20Dashboard%20Fabric%20Controller%20Remote%20Code%20Execution%20Vulnerability%26vs_k=1,https://da.gd/2IF35
CiscoSecurityAdvisory,Cisco Nexus Dashboard Fabric Controller Configuration Backup Information Disclosure Vulnerability,https://sec.cloudapps.cisco.com/security/center/content/CiscoSecurityAdvisory/cisco-sa-ndfc-cidv-XvyX2wLj?vs_f=Cisco%20Security%20Advisory%26vs_cat=Security%20Intelligence%26vs_type=RSS%26vs_p=Cisco%20Nexus%20Dashboard%20Fabric%20Controller%20Configuration%20Backup%20Information%20Disclosure%20Vulnerability%26vs_k=1,https://da.gd/EW8w
CiscoSecurityAdvisory,Cisco Meraki MX and Z Series Teleworker Gateway AnyConnect VPN Session Takeover and Denial of Service Vulnerability,https://sec.cloudapps.cisco.com/security/center/content/CiscoSecurityAdvisory/cisco-sa-meraki-mx-vpn-dos-by-QWUkqV7X?vs_f=Cisco%20Security%20Advisory%26vs_cat=Security%20Intelligence%26vs_type=RSS%26vs_p=Cisco%20Meraki%20MX%20and%20Z%20Series%20Teleworker%20Gateway%20AnyConnect%20VPN%20Session%20Takeover%20and%20Denial%20of%20Service%20Vulnerability%26vs_k=1,https://da.gd/Nd7us1
CiscoSecurityAdvisory,Cisco Meraki MX and Z Series Teleworker Gateway AnyConnect VPN Denial of Service Vulnerabilities,https://sec.cloudapps.cisco.com/security/center/content/CiscoSecurityAdvisory/cisco-sa-meraki-mx-vpn-dos-QTRHzG2?vs_f=Cisco%20Security%20Advisory%26vs_cat=Security%20Intelligence%26vs_type=RSS%26vs_p=Cisco%20Meraki%20MX%20and%20Z%20Series%20Teleworker%20Gateway%20AnyConnect%20VPN%20Denial%20of%20Service%20Vulnerabilities%26vs_k=1,https://da.gd/BAeDc1
CiscoSecurityAdvisory,Cisco Identity Services Engine Information Disclosure Vulnerability,https://sec.cloudapps.cisco.com/security/center/content/CiscoSecurityAdvisory/cisco-sa-ise-info-disc-ZYF2nEEX?vs_f=Cisco%20Security%20Advisory%26vs_cat=Security%20Intelligence%26vs_type=RSS%26vs_p=Cisco%20Identity%20Services%20Engine%20Information%20Disclosure%20Vulnerability%26vs_k=1,https://da.gd/lKCQ0
CiscoSecurityAdvisory,Cisco Expressway Series Privilege Escalation Vulnerability,https://sec.cloudapps.cisco.com/security/center/content/CiscoSecurityAdvisory/cisco-sa-expw-escalation-3bkz77bD?vs_f=Cisco%20Security%20Advisory%26vs_cat=Security%20Intelligence%26vs_type=RSS%26vs_p=Cisco%20Expressway%20Series%20Privilege%20Escalation%20Vulnerability%26vs_k=1,https://da.gd/DkUzr1
