feed,title,long_url,short_url
LinuxSecurity,openSUSE: Trivy Important Security Update 2025:0489-1 Enhances Protection,https://linuxsecurity.com/advisories/opensuse/trivy-opensuse-2025-0489-1-2025-11065,https://da.gd/pmaqj
LinuxSecurity,openSUSE: Trivy Important Fix for 14 Issues Advisory 2025:0490-1,https://linuxsecurity.com/advisories/opensuse/trivy-opensuse-2025-0490-1-2025-11065,https://da.gd/0x2h5
LinuxSecurity,openSUSE: python312 Moderate Security Issues Update 2025:15850-1,https://linuxsecurity.com/advisories/opensuse/python312-3-12-12-4-1-2025-12084,https://da.gd/VQwkGw
LinuxSecurity,openSUSE: Trivy Moderate Security Update for 4 Issues 2025:15852-1,https://linuxsecurity.com/advisories/opensuse/trivy-0-68-2-1-2025-47911,https://da.gd/khrsC
LinuxSecurity,openSUSE Tumbleweed: python311 Moderate Security Update 2025:15849-1,https://linuxsecurity.com/advisories/opensuse/python311-3-11-14-3-1-2025-12084,https://da.gd/5pSv
LinuxSecurity,openSUSE: python313 Moderate Update Advisory 2025:15851-1 for 3 Issues,https://linuxsecurity.com/advisories/opensuse/python313-3-13-11-1-1-2025-12084,https://da.gd/9TPJ4
