feed,title,long_url,short_url
PacketstormSecurity,Biden Signs Cybercrime Tracking Bill Into Law,https://packetstormsecurity.com/news/view/33426/Biden-Signs-Cybercrime-Tracking-Bill-Into-Law.html,https://bit.ly/3N3kNyv
PacketstormSecurity,Crypto Assets Shed $800 Billion In Market Value In A Month,https://packetstormsecurity.com/news/view/33427/Crypto-Assets-Shed-800-Billion-In-Market-Value-In-A-Month.html,https://bit.ly/3FxZtPg
PacketstormSecurity,Malware Goes Regional As Attackers Change Tactics,https://packetstormsecurity.com/news/view/33428/Malware-Goes-Regional-As-Attackers-Change-Tactics.html,https://bit.ly/37w6J1p
PacketstormSecurity,Hackers Actively Exploit F5 BIG-IP Bug,https://packetstormsecurity.com/news/view/33429/Hackers-Actively-Exploit-F5-BIG-IP-Bug.html,https://bit.ly/3wkySAS
PacketstormSecurity,Conti Ransomware Attack Spurs State Of Emergency In Costa Rica,https://packetstormsecurity.com/news/view/33425/Conti-Ransomware-Attack-Spurs-State-Of-Emergency-In-Costa-Rica.html,https://bit.ly/3M0K3p9
