feed,title,long_url,short_url
LinuxSecurity,Debian: DSA-5644-1: thunderbird security update,https://linuxsecurity.com/advisories/debian/debian-dsa-5644-1-thunderbird-security-update-qa5jrdsydtue,https://da.gd/xMxps
LinuxSecurity,Debian: DSA-5643-1: firefox-esr security update,https://linuxsecurity.com/advisories/debian/debian-dsa-5643-1-firefox-esr-security-update-hdalloovesdx,https://da.gd/QqQcl
LinuxSecurity,Oracle9: ELSA-2024-1427: libreoffice Important Security Update,https://linuxsecurity.com/advisories/oracle/oracle9-elsa-2024-1427-libreoffice-important-security-update-ffqbau8gmddu,https://da.gd/kG5R
LinuxSecurity,Oracle9: ELSA-2024-1436: postgresql-jdbc Important Security Update,https://linuxsecurity.com/advisories/oracle/oracle9-elsa-2024-1436-postgresql-jdbc-important-security-update-caseg12vsjkm,https://da.gd/vRhA
LinuxSecurity,Oracle9: ELSA-2024-1376: squid security Important Security Update,https://linuxsecurity.com/advisories/oracle/oracle9-elsa-2024-1376-squid-security-important-security-update-winirsvcabql,https://da.gd/AGRJx
LinuxSecurity,"Oracle8: ELSA-2024-1431: ruby:3.1 security, bug fix, and enhancement M",https://linuxsecurity.com/advisories/oracle/oracle8-elsa-2024-1431-ruby-3-1-security-bug-fix-and-enhancement-m-s8vviaoqaihh,https://da.gd/ELSse
