feed,title,long_url,short_url
PacketstormSecurity,GoFetch - Breaking Constant-Time Cryptographic Implementations Using Data Memory-Dependent Prefetchers,https://packetstormsecurity.com/news/view/35687/GoFetch-Breaking-Constant-Time-Cryptographic-Implementations-Using-Data-Memory-Dependent-Prefetchers.html,https://da.gd/5fAp6a
PacketstormSecurity,Russian APT29 Hackers Caught Targeting German Political Parties,https://packetstormsecurity.com/news/view/35688/Russian-APT29-Hackers-Caught-Targeting-German-Political-Parties.html,https://da.gd/8jp7dm
PacketstormSecurity,Apple Lawsuit: US Says iPhone Monopoly Undermines Security,https://packetstormsecurity.com/news/view/35690/Apple-Lawsuit-US-Says-iPhone-Monopoly-Undermines-Security.html,https://da.gd/HQhJn
PacketstormSecurity,Hackers Can Unlock Over 3 Millions Hotel Doors In Seconds,https://packetstormsecurity.com/news/view/35691/Hackers-Can-Unlock-Over-3-Millions-Hotel-Doors-In-Seconds.html,https://da.gd/6NidE
PacketstormSecurity,China Relaxes Some Security Review Rules For Data Exports,https://packetstormsecurity.com/news/view/35689/China-Relaxes-Some-Security-Review-Rules-For-Data-Exports.html,https://da.gd/WduWru
