feed,title,long_url,short_url
LinuxSecurity,openSUSE: libsoup Important Buffer Overflow Fix CVE-2025-11021 2025:3752-1,https://linuxsecurity.com/advisories/opensuse/opensuse-2025-3752-1-libsoup,https://da.gd/w0bEu
LinuxSecurity,SUSE: libsoup Important Out-Of-Bounds Read Vuln 2025:3752-1 CVE-2025-11021,https://linuxsecurity.com/advisories/suse/suse-2025-3752-1-for-libsoup-brktrrmjj0hr,https://da.gd/xGOQ
LinuxSecurity,openSUSE: libsoup Important Out-Of-Bounds Read Fix 2025:3753-1,https://linuxsecurity.com/advisories/opensuse/opensuse-2025-3753-1-libsoup,https://da.gd/ZQBvBL
LinuxSecurity,SUSE Advises on libsoup Critical Cookie Handling DoS CVE-2025-11021,https://linuxsecurity.com/advisories/suse/suse-2025-3753-1-for-libsoup-mgnczyoabqu7,https://da.gd/MsIPR
LinuxSecurity,openSUSE Leap 15.6: python-Authlib Important DoS Issue 2025:3754-1,https://linuxsecurity.com/advisories/opensuse/opensuse-2025-3754-1-python-authlib,https://da.gd/CLCv7
LinuxSecurity,SUSE: python-Authlib Critical DoS Vulnerability Patch 2025:3754-2,https://linuxsecurity.com/advisories/suse/suse-2025-3754-1-for-python-authlib-2zpadfdm9ihx,https://da.gd/QjQj
