feed,title,long_url,short_url
PacketstormSecurity,Nasty Linux systemd Root Level Security Bug Revealed And Patched,https://packetstormsecurity.com/news/view/32382/Nasty-Linux-systemd-Root-Level-Security-Bug-Revealed-And-Patched.html,https://j.mp/3wvrlhv
PacketstormSecurity,Police Bust Major Ransomware Gang Cl0p,https://packetstormsecurity.com/news/view/32383/Police-Bust-Major-Ransomware-Gang-Cl0p.html,https://j.mp/35oGoOa
PacketstormSecurity,Digital Ad Industry Accused Of Huge Data Breach,https://packetstormsecurity.com/news/view/32385/Digital-Ad-Industry-Accused-Of-Huge-Data-Breach.html,https://j.mp/3cL9U4U
PacketstormSecurity,"Peloton Bike+ Was Vulnerable To Remote Hacking, Researchers Find",https://packetstormsecurity.com/news/view/32384/Peloton-Bike-Was-Vulnerable-To-Remote-Hacking-Researchers-Find.html,https://j.mp/2TG5gP2
PacketstormSecurity,"Facebook Awards $30,000 Bounty For Exploit Exposing Private Instagram Content",https://packetstormsecurity.com/news/view/32381/Facebook-Awards-30-000-Bounty-For-Exploit-Exposing-Private-Instagram-Content.html,https://j.mp/2SD8WRk
