feed,title,long_url,short_url
UbuntuSecurityNotice,USN-6865-2: Linux kernel (Azure) vulnerabilities,https://ubuntu.com/security/notices/USN-6865-2,https://da.gd/so8avh
UbuntuSecurityNotice,USN-6870-2: Linux kernel (AWS) vulnerabilities,https://ubuntu.com/security/notices/USN-6870-2,https://da.gd/rBN0u
UbuntuSecurityNotice,USN-6873-2: Linux kernel (StarFive) vulnerabilities,https://ubuntu.com/security/notices/USN-6873-2,https://da.gd/rUURVQ
UbuntuSecurityNotice,USN-6864-2: Linux kernel vulnerabilities,https://ubuntu.com/security/notices/USN-6864-2,https://da.gd/RigJzK
UbuntuSecurityNotice,USN-6872-2: Linux kernel vulnerabilities,https://ubuntu.com/security/notices/USN-6872-2,https://da.gd/REqoR
UbuntuSecurityNotice,USN-6878-1: Linux kernel (Oracle) vulnerabilities,https://ubuntu.com/security/notices/USN-6878-1,https://da.gd/9kSM3u
