feed,title,long_url,short_url
LinuxSecurity,Debian: libpng1.6 Critical Info Leak & DoS Vulnerabilities DSA-6076-1,https://linuxsecurity.com/advisories/debian/debian-dsa-6076-1-libpng1-6-znzodb8zt0fg,https://da.gd/KDn0
LinuxSecurity,SUSE: go1.25 Important Resource Consumption Risk 2025:4336-1,https://linuxsecurity.com/advisories/suse/suse-2025-4336-1-for-go1-25-dolgwrjkdxxr,https://da.gd/pPCt5
LinuxSecurity,openSUSE: Addressing go1.25 Resource Issues and Crypto Vulnerabilities,https://linuxsecurity.com/advisories/opensuse/opensuse-2025-4336-1-go1-25-rag0lsy4i5xo,https://da.gd/JF25Q
LinuxSecurity,"SUSE: go1.24 Vital Security Updates for Resources CVE-2025-61727, 61729",https://linuxsecurity.com/advisories/suse/suse-2025-4337-1-for-go1-24-tdozq5tqnnx3,https://da.gd/OBVfys
LinuxSecurity,"openSUSE: Critical Security Update for go1.24, CVE-2025-61727, 61729",https://linuxsecurity.com/advisories/opensuse/opensuse-2025-4337-1-go1-24-5mj6ndh6srhm,https://da.gd/CGlpd
